category	entry_id	openalex_id	doi	publication_year	authors
fields	https://openalex.org/fields/11	https://openalex.org/W1964282650	https://doi.org/10.1038/nrmicro1635	2007	Eugene Rosenberg, Omry Koren, Leah Reshef, Rotem Efrony, Ilana Zilber‐Rosenberg
fields	https://openalex.org/fields/11	https://openalex.org/W2001856591	https://doi.org/10.1093/nar/17.6.2362	1989	Theo C. Verwoerd, B.M.M. Dekker, André Hoekema
fields	https://openalex.org/fields/11	https://openalex.org/W2094442337	https://doi.org/10.1073/pnas.97.21.11655	2000	Peer M. Schenk, Kemal Kazan, Iain W. Wilson, Jonathan P. Anderson, Todd Richmond, Shauna Somerville, John M. Manners
fields	https://openalex.org/fields/11	https://openalex.org/W2118182941	https://doi.org/10.1016/j.fcr.2012.09.009	2012	M.K. van Ittersum, Kenneth G. Cassman, Patricio Grassini, J. Wolf, Pablo Tittonell, Zvi Hochman
fields	https://openalex.org/fields/11	https://openalex.org/W2137058134	https://doi.org/10.1146/annurev.ecolsys.39.110707.173506	2008	Fernando Valladares, Ülo Niinemets
fields	https://openalex.org/fields/11	https://openalex.org/W2155732403	https://doi.org/10.1152/physrev.1975.55.2.247	1975	Sten Grillner
fields	https://openalex.org/fields/11	https://openalex.org/W2125066647	https://doi.org/10.1126/science.1174276	2009	Edward S. Buckler, James B. Holland, Peter J. Bradbury, Charlotte B. Acharya, Patrick J. Brown, Chris Browne, Elhan S. Ersoz, Sherry Flint‐Garcia, Arturo García, Jeffrey C. Glaubitz, M. M. Goodman, Carlos Harjes, Kate Guill, Dallas E. Kroon, Sara J. Larsson, Nicholas Lepak, Huihui Li, Sharon E. Mitchell, Gaël Pressoir, Jason A. Peiffer, Marco Oropeza Rosas, Torbert Rocheford, M. Cinta Romay, Susan Romero, Stella Salvo, Hector Sanchez Villeda, H. Sofia da Silva, Qi Sun, Feng Tian, Narasimham Upadyayula, Doreen Ware, Heather E. Yates, Jianming Yu, Zhiwu Zhang, Stephen Kresovich, Michael D. McMullen
fields	https://openalex.org/fields/11	https://openalex.org/W4395553377	https://doi.org/10.15468/0npzcg	2023	Koya Akiyama
fields	https://openalex.org/fields/11	https://openalex.org/W1947664013		1976	Wilkie F. Harrigan, Margaret E. McCance
fields	https://openalex.org/fields/11	https://openalex.org/W1971992471	https://doi.org/10.1016/0168-1605(96)01134-8	1996	Lone Gram, Hans Henrik Huss
fields	https://openalex.org/fields/11	https://openalex.org/W2051786203	https://doi.org/10.1016/0304-4076(85)90134-4	1985	Angus Deaton
fields	https://openalex.org/fields/11	https://openalex.org/W3086125063	https://doi.org/10.1016/j.cell.2020.09.037	2020	Luca Piccoli, Young‐Jun Park, M. Alejandra Tortorici, Nadine Czudnochowski, Alexandra C. Walls, Martina Beltramello, Chiara Silacci-Fregni, Dora Pinto, Laura E. Rosen, John E. Bowen, Oliver J. Acton, Stefano Jaconi, Barbara Guarino, Andrea Minola, Fabrizia Zatta, Nicole Sprugasci, Jessica Bassi, Alessia Peter, Anna De Marco, Jay C. Nix, Federico Mele, Sandra Jovic, Blanca Fernandez Rodriguez, Sneha Gupta, Feng Jin, Giovanni Piumatti, Giorgia Lo Presti, Alessandra Franzetti-Pellanda, Maira Biggiogero, Maciej Tarkowski, Matteo Samuele Pizzuto, Elisabetta Cameroni, Colin Havenar‐Daughton, Megan J. Smithey, David K. Hong, Valentino Lepori, Emiliano Albanese, Alessandro Ceschi, Enos Bernasconi, Luigia Elzi, Paolo Ferrari, Christian Garzoni, Agostino Riva, Gyorgy Snell, Federica Sallusto, Katja Fink, Herbert W. Virgin, Antonio Lanzavecchia, Davide Corti, David Veesler
fields	https://openalex.org/fields/11	https://openalex.org/W4256561644	https://doi.org/10.1037/e471672008-001	1951	Evelyn Fix, J. L. Hodges
fields	https://openalex.org/fields/11	https://openalex.org/W1590922852	https://doi.org/10.1016/s0021-9258(18)93575-1	1968	Hidehiko Saito, Tatsuya Yamagata, Sakaru Suzuki
fields	https://openalex.org/fields/11	https://openalex.org/W1972538870	https://doi.org/10.1105/tpc.9.6.841	1997	Mitsuhiro Aida, Tetsuya Ishida, Hidehiro Fukaki, H. Fujisawa, Masao Tasaka
fields	https://openalex.org/fields/11	https://openalex.org/W1980268367	https://doi.org/10.1016/j.ejsobi.2006.10.002	2006	P. Lavelle, Thibaud Decaëns, Michaël Aubert, Sébastien Barot, Manuel Blouin, Fabrice Bureau, Pierre Margerie, P. Mora, Jean‐Pierre Rossi
fields	https://openalex.org/fields/11	https://openalex.org/W2164618384	https://doi.org/10.1016/s0092-8674(00)80436-5	1997	Zoltán Ivics, Perry B. Hackett, Ronald H.A. Plasterk, Zsuzsanna Izsvák
fields	https://openalex.org/fields/11	https://openalex.org/W2562443513	https://doi.org/10.7554/elife.21856	2017	Peter J. Skene, Steven Henikoff
fields	https://openalex.org/fields/11	https://openalex.org/W2936425449	https://doi.org/10.1016/s0958-6946(97)87631-5	1997	Patrick F. Fox
fields	https://openalex.org/fields/11	https://openalex.org/W1952903862	https://doi.org/10.1128/jcm.30.6.1365-1373.1992	1992	Jon R. Gentsch, Roger I. Glass, Patricia Woods, Vera Gouvêa, M Gorziglia, Jorge Flores, Bimal Kumar Das, M. K. Bhan
fields	https://openalex.org/fields/11	https://openalex.org/W1984671422	https://doi.org/10.1016/j.envsoft.2014.07.009	2014	Dean Holzworth, Neil Huth, Peter de Voil, Eric J. Zurcher, Neville I. Herrmann, Greg McLean, Karine Chenu, Erik van Oosterom, Val Snow, Chris Murphy, Andrew D. Moore, Hamish Brown, Jeremy Whish, S. Verrall, Justin Fainges, Lindsay W. Bell, Allan Peake, Perry Poulton, Zvi Hochman, Peter J. Thorburn, Donald S. Gaydon, Neal Dalgliesh, Daniel Rodrı́guez, Howard Cox, Scott Chapman, A. Doherty, Edmar Teixeira, Joanna Sharp, Rogerio Cichota, Iris Vogeler, Frank Yonghong Li, Enli Wang, Graeme Hammer, M. J. Robertson, John Dimes, Anthony Whitbread, James Hunt, Harm van Rees, Tim McClelland, Peter Carberry, J. N. G. Hargreaves, Neil D. MacLeod, C. K. McDonald, Justin Harsdorf, Sara Wedgwood, B. A. Keating
fields	https://openalex.org/fields/11	https://openalex.org/W2019654784	https://doi.org/10.1016/j.tifs.2010.08.003	2010	Zhongxiang Fang, Bhesh Bhandari
fields	https://openalex.org/fields/11	https://openalex.org/W2118140755	https://doi.org/10.1038/nature11543	2012	Klaus Mayer, Robbie Waugh, Peter Langridge, Timothy J. Close, Roger P. Wise, Andreas Graner, Takashi Matsumoto, Kazuhiro Sato, Alan H. Schulman, Ruvini Ariyadasa, Daniela Schulte, Naser Poursarebani, Ruonan Zhou, Burkhard Steuernagel, Martin Mascher, Uwe Scholz, Bu-Jun Shi, Kavitha Madishetty, Jan T. Svensson, Prasanna R. Bhat, Matthew Moscou, Josh Resnik, Gary J. Muehlbauer, Pete E. Hedley, Hui Liu, Jenny Morris, Zeev Frenkel, A. Korol, Hélène Bergès, Stefan Taudien, Marius Felder, Marco Groth, Matthias Platzer, Axel Himmelbach, Stefano Lonardi, Denisa Duma, Matthew Alpert, Francesca Cordero, Marco Beccuti, Gianfranco Ciardo, Yaqin Ma, Steve Wanamaker, Federica Cattonaro, Vera Vendramin, Simone Scalabrin, Slobodanka Radović, Rod A. Wing, Michele Morgante, Thomas Nussbaumer, Heidrun Gundlach, Mihaela M. Martis, Jesse Poland, Matthias Pfeifer, Cédric Moisy, Jaakko Tanskanen, Andrea Zuccolo, M. Spannagl, Joanne Russell, Arnis Druka, David Marshall, Micha Bayer, David Swarbreck, Dharanya Sampath, Sarah Ayling, Melanie Febrer, Mario Cáccamo, Tsuyoshi Tanaka, Steve Wannamaker, Thomas Schmutzer, John W. Brown, Geoffrey B. Fincher, Nils Stein
fields	https://openalex.org/fields/11	https://openalex.org/W2126623160	https://doi.org/10.1111/j.1365-313x.2007.03052.x	2007	Joachim Kilian, Dion Whitehead, Jakub Horák, Dierk Wanke, Stefan Weinl, Oliver Batistič, Cecilia D’Angelo, Erich Bornberg‐Bauer, Jörg Kudla, Klaus Harter
fields	https://openalex.org/fields/11	https://openalex.org/W1724705168	https://doi.org/10.1002/cphy.cp010226	1981	Sten Grillner
fields	https://openalex.org/fields/11	https://openalex.org/W2048787638	https://doi.org/10.1016/s0734-9750(00)00050-1	2000	Félix Garcı́a-Ochoa, Victoria E. Santos, José A. Casas, Emilio Gómez
fields	https://openalex.org/fields/11	https://openalex.org/W2084449649	https://doi.org/10.1111/j.1467-985x.2010.00663_9.x	2010	Ana F. Militino
fields	https://openalex.org/fields/11	https://openalex.org/W2089892649	https://doi.org/10.1007/s00267-002-2630-x	2002	Peter H. Verburg, W. Soepboer, A. Veldkamp, RAMIL LIMPIADA, Victoria O. Espaldon, SHARIFAH S.A. MASTURA
fields	https://openalex.org/fields/11	https://openalex.org/W2091407052	https://doi.org/10.1038/415806a	2002	Jiřı́ Friml, Justyna Wiśniewska, Eva Benková, Kurt Mendgen, Klaus Palme
fields	https://openalex.org/fields/11	https://openalex.org/W2098255020	https://doi.org/10.1093/jaoac/77.2.421	1994	Nalur C. Shantha, Eric A. Decker
fields	https://openalex.org/fields/11	https://openalex.org/W2126309815	https://doi.org/10.1016/s0140-6736(97)11212-0	1998	Eric C. J. Claas, Albert D. M. E. Osterhaus, Ruud van Beek, J.C. de Jong, Guus F. Rimmelzwaan, Dennis A. Senne, Scott Krauss, K. F. Shortridge, Robert G. Webster
fields	https://openalex.org/fields/11	https://openalex.org/W41673608	https://doi.org/10.1016/0076-6879(88)61025-1	1988	Ming Tien, T. Kent Kirk
fields	https://openalex.org/fields/11	https://openalex.org/W1553946241	https://doi.org/10.2307/3495501	1992	J. Howard Frank, Paul DeBach, David Rosen
fields	https://openalex.org/fields/11	https://openalex.org/W1683027565		2006	Lindsay H. Allen
fields	https://openalex.org/fields/11	https://openalex.org/W2070842692	https://doi.org/10.1016/s1369-5266(03)00035-9	2003	José López‐Bucio, Alfredo Cruz‐Ramírez, Luís Herrera‐Estrella
fields	https://openalex.org/fields/11	https://openalex.org/W2159562617	https://doi.org/10.1006/anbo.1996.0134	1996	Stanley Lutts
fields	https://openalex.org/fields/11	https://openalex.org/W1560853515	https://doi.org/10.1128/aem.51.4.683-689.1986	1986	Derek R. Lovley, Elizabeth J. Phillips
fields	https://openalex.org/fields/11	https://openalex.org/W1969248251	https://doi.org/10.1016/j.agee.2009.04.021	2009	Clifford S. Snyder, Tom Bruulsema, T. Jensen, P. E. Fixen
fields	https://openalex.org/fields/11	https://openalex.org/W2023092952	https://doi.org/10.1016/j.antiviral.2009.10.008	2009	Scott C. Weaver, William K. Reisen
fields	https://openalex.org/fields/11	https://openalex.org/W2081653606	https://doi.org/10.1038/ni.2608	2013	Nobuhiko Kamada, Grace Chen, Naohiro Inohara, Gabriel Núñez
fields	https://openalex.org/fields/11	https://openalex.org/W2114034340	https://doi.org/10.1146/annurev.ento.43.1.701	1998	Fred Gould
fields	https://openalex.org/fields/11	https://openalex.org/W2174530374	https://doi.org/10.1016/j.micres.2015.11.008	2015	Gustavo Santoyo, Gabriel Moreno‐Hagelsieb, Ma. del Carmen Orozco-Mosqueda, Bernard R. Glick
fields	https://openalex.org/fields/11	https://openalex.org/W2046867703	https://doi.org/10.1016/j.tree.2009.07.013	2009	Niels J. Dingemanse, Anahita Kazem, Denis Réale, Jonathan Wright
fields	https://openalex.org/fields/11	https://openalex.org/W2096719701	https://doi.org/10.1146/annurev.arplant.53.100301.135248	2002	Ivo Feußner, Claus Wasternack
fields	https://openalex.org/fields/11	https://openalex.org/W2102293625	https://doi.org/10.1016/j.agee.2004.01.015	2004	L. A. Bruijnzeel
fields	https://openalex.org/fields/11	https://openalex.org/W2148956054	https://doi.org/10.1111/j.1365-2389.1996.tb01843.x	1996	Yves Le Bissonnais
fields	https://openalex.org/fields/11	https://openalex.org/W2505440491	https://doi.org/10.1007/978-3-642-81190-6	1978	Francis Hallé, R.A.A. Oldeman, Philip B. Tomlinson
fields	https://openalex.org/fields/11	https://openalex.org/W4233758357	https://doi.org/10.2307/2406450	1965	Sewall Wright
fields	https://openalex.org/fields/11	https://openalex.org/W423707044		1993	Nemi C. Jain
fields	https://openalex.org/fields/11	https://openalex.org/W1542590789	https://doi.org/10.1007/bf00000098	1994	H. Marschner, B. Dell
fields	https://openalex.org/fields/11	https://openalex.org/W1979647722	https://doi.org/10.1038/335563a0	1988	Ivan Sadowski, Jun Ma, Steven J. Triezenberg, Mark Ptashne
fields	https://openalex.org/fields/11	https://openalex.org/W2047848415	https://doi.org/10.1038/nature06069	2007	Elena Baena–González, Filip Rolland, Johan M. Thevelein, Jen Sheen
fields	https://openalex.org/fields/11	https://openalex.org/W2083783640	https://doi.org/10.1126/science.286.5446.1962	1999	Igor Kardailsky, Vipula K. Shukla, Ji Hoon Ahn, Nicole Dagenais, S. Christensen, Jasmine Nguyen, Joanne Chory, Maria Harrison, Detlef Weigel
fields	https://openalex.org/fields/11	https://openalex.org/W2101779884	https://doi.org/10.1111/j.1461-0248.2007.01018.x	2007	Claire Kremen, Neal M. Williams, Marcelo A. Aizen, Barbara Gemmill‐Herren, Gretchen LeBuhn, Robert L. Minckley, Laurence Packer, Simon G. Potts, T’ai H. Roulston, Ingolf Steffan‐Dewenter, Diego P. Vázquez, Rachael Winfree, Laurie Davies Adams, Elizabeth E. Crone, Sarah S. Greenleaf, Timothy H. Keitt, Alexandra‐Maria Klein, James Regetz, Taylor H. Ricketts
fields	https://openalex.org/fields/11	https://openalex.org/W2131353241	https://doi.org/10.1146/annurev.ento.52.110405.091407	2006	S. M. Cook, Zeyaur R. Khan, John A. Pickett
fields	https://openalex.org/fields/11	https://openalex.org/W1506420718		1996	Bernadette Dora Gombossy de Melo Franco, Mariza Landgraf
fields	https://openalex.org/fields/11	https://openalex.org/W2019056784	https://doi.org/10.1104/pp.102.019661	2003	Travis S. Walker, Harsh P. Bais, Erich Grotewold, Jorge M. Vivanco
fields	https://openalex.org/fields/11	https://openalex.org/W2063799895	https://doi.org/10.1016/0092-8674(95)90288-0	1995	Joanna Putterill, Frances Robson, Karen Lee, Rüdiger Simon, George Coupland
fields	https://openalex.org/fields/11	https://openalex.org/W2171437247	https://doi.org/10.2307/1940122	1982	Larry B. Crowder, William E. Cooper
fields	https://openalex.org/fields/11	https://openalex.org/W1521382859	https://doi.org/10.5860/choice.31-2679	1994	Robert L. Dressler
fields	https://openalex.org/fields/11	https://openalex.org/W1656398202	https://doi.org/10.1038/35054550	2001	William J. Murphy, Eduardo Eizirik, Warren E. Johnson, Ya Zhang, Oliver A. Ryder, Stephen J. O’Brien
fields	https://openalex.org/fields/11	https://openalex.org/W1515467954		1978	Williams Charles Evans
fields	https://openalex.org/fields/11	https://openalex.org/W1996723297	https://doi.org/10.1034/j.1399-3054.2003.00086.x	2003	Donna M. Penrose, Bernard R. Glick
fields	https://openalex.org/fields/11	https://openalex.org/W2133691944	https://doi.org/10.1007/s004420100809	2002	S. Joseph Wright‬
fields	https://openalex.org/fields/11	https://openalex.org/W2159194695	https://doi.org/10.1242/dev.119.1.71	1993	Liam Dolan, Kees Janmaat, Viola Willemsen, Paul Linstead, Scott Poethig, Keith Roberts, Ben Scheres
fields	https://openalex.org/fields/11	https://openalex.org/W3048090444	https://doi.org/10.1093/database/baaa062	2020	Conrad L. Schoch, Stacy Ciufo, Michael Domrachev, Carol L. Hotton, Sivakumar Kannan, Rogneda Khovanskaya, Detlef D. Leipe, Richard McVeigh, Kathleen O’Neill, Barbara Robbertse, Shobha Sharma, Vladimir Soussov, John P. Sullivan, Lu Sun, Seán Turner, Ilene Karsch‐Mizrachi
fields	https://openalex.org/fields/11	https://openalex.org/W4232863037	https://doi.org/10.1111/j.0014-3820.2002.tb00191.x	2002	Markus Pfenninger, David Posada
fields	https://openalex.org/fields/11	https://openalex.org/W2039931639	https://doi.org/10.1038/nrg1633	2005	Deborah Bell‐Pedersen, Vincent M. Cassone, David J. Earnest, Susan S. Golden, Paul E. Hardin, Terry L. Thomas, Mark J. Zoran
fields	https://openalex.org/fields/11	https://openalex.org/W2064242794	https://doi.org/10.1111/j.1939-1676.1988.tb02815.x	1988	Mark E. Peterson
fields	https://openalex.org/fields/11	https://openalex.org/W2097075017	https://doi.org/10.1111/j.1365-2435.2008.01467.x	2008	Andrew K. Davis, Donna L. Maney, John C. Maerz
fields	https://openalex.org/fields/11	https://openalex.org/W2100117826	https://doi.org/10.1080/08941920.2012.736605	2012	Fikret Berkes, Helen Ross
fields	https://openalex.org/fields/11	https://openalex.org/W2101230126	https://doi.org/10.3168/jds.s0022-0302(97)76075-2	1997	D.R. Mertens
fields	https://openalex.org/fields/11	https://openalex.org/W2164830139	https://doi.org/10.1126/science.1111773	2005	David Lamb, Peter D. Erskine, John A. Parrotta
fields	https://openalex.org/fields/11	https://openalex.org/W2332855424	https://doi.org/10.1111/j.1558-5646.1955.tb01544.x	1955	Herbert G. Baker
fields	https://openalex.org/fields/11	https://openalex.org/W1985504839	https://doi.org/10.1093/jee/48.2.157	1955	C. F. Henderson, Elvin W. Tilton
fields	https://openalex.org/fields/11	https://openalex.org/W2016418366	https://doi.org/10.1073/pnas.94.5.1857	1997	David Tilman, Clarence Lehman, Kendall T. Thomson
fields	https://openalex.org/fields/11	https://openalex.org/W2163666618	https://doi.org/10.1146/annurev-ento-112408-085504	2010	Paul J. De Barro, Shu‐Sheng Liu, Laura M. Boykin, A. Dinsdale
fields	https://openalex.org/fields/11	https://openalex.org/W2169696545	https://doi.org/10.1016/s1360-1385(01)02052-0	2001	Folkert A. Hoekstra, Elena A. Golovina, Julia Buitink
fields	https://openalex.org/fields/11	https://openalex.org/W2318871708	https://doi.org/10.2307/3545743	1996	Russell Lande
fields	https://openalex.org/fields/11	https://openalex.org/W2781931056	https://doi.org/10.1016/j.talanta.2018.01.013	2018	Justyna Płotka‐Wasylka
fields	https://openalex.org/fields/11	https://openalex.org/W1006492857	https://doi.org/10.1016/s0065-2296(08)60089-0	1980	W. Armstrong
fields	https://openalex.org/fields/11	https://openalex.org/W1999693007	https://doi.org/10.1021/jf970975b	1998	Ann Hagerman, Kenneth M. Riedl, G. Alexander Jones, Kara N. Sovik, Nicole T. Ritchard, Paul W. Hartzfeld, Thomas L. Riechel
fields	https://openalex.org/fields/11	https://openalex.org/W2040841239	https://doi.org/10.1016/j.jtice.2010.06.006	2010	Rijuta Ganesh Saratale, Ganesh Dattatraya Saratale, Jo‐Shu Chang, Sanjay P. Govindwar
fields	https://openalex.org/fields/11	https://openalex.org/W2047858731	https://doi.org/10.1126/science.288.5471.1613	2000	Alon Samach, Hitoshi Onouchi, Scott E. Gold, Gary S. Ditta, Zsuzsanna Schwarz‐Sommer, Martin F. Yanofsky, George Coupland
fields	https://openalex.org/fields/11	https://openalex.org/W1662807310	https://doi.org/10.1038/35074138	2001	Paula Suárez‐López, Kay Wheatley, Frances Robson, Hitoshi Onouchi, Federico Valverde, George Coupland
fields	https://openalex.org/fields/11	https://openalex.org/W2006486492	https://doi.org/10.1038/282424a0	1979	Siu‐Chung Wong, I.R. Cowan, Graham D. Farquhar
fields	https://openalex.org/fields/11	https://openalex.org/W2039662911	https://doi.org/10.1111/j.1574-6968.2007.00918.x	2007	Robert P. Ryan, Kieran J. Germaine, Ashley E. Franks, David Ryan, David N. Dowling
fields	https://openalex.org/fields/11	https://openalex.org/W2095514509	https://doi.org/10.1007/s004250000458	2001	Stephan Clemens
fields	https://openalex.org/fields/11	https://openalex.org/W638862129		1992	Wayne P. Maddison, David R. Maddison
fields	https://openalex.org/fields/11	https://openalex.org/W1980621655	https://doi.org/10.1006/anbo.1997.0469	1997	J. A. Ratter, J. F. Ribeiro, S. Bridgewater
fields	https://openalex.org/fields/11	https://openalex.org/W2131407644	https://doi.org/10.1016/j.tree.2009.07.016	2009	Mark A. Goddard, Andrew J. Dougill, Tim G. Benton
fields	https://openalex.org/fields/11	https://openalex.org/W1595262398	https://doi.org/10.1201/9781420015201	2006	Jan Dirk van Elsas, J. T. Trevors, Janet Jansson, Paola Nannipieri
fields	https://openalex.org/fields/11	https://openalex.org/W1970710265	https://doi.org/10.1016/s0377-0257(97)00004-9	1997	Howard A. Barnes
fields	https://openalex.org/fields/11	https://openalex.org/W2036081018	https://doi.org/10.1139/f85-127	1985	Steven E. Campana, John D. Neilson
fields	https://openalex.org/fields/11	https://openalex.org/W2051337798	https://doi.org/10.1073/pnas.94.2.549	1997	Nicola Saino, Anna Maria Bolzern, Anders Pape Møller
fields	https://openalex.org/fields/11	https://openalex.org/W2057895311	https://doi.org/10.2307/3544698	1985	David N. Reznick
fields	https://openalex.org/fields/11	https://openalex.org/W2150461118	https://doi.org/10.1079/9780851998312.0000	2004	
fields	https://openalex.org/fields/11	https://openalex.org/W2154329712	https://doi.org/10.1128/jvi.72.2.1438-1445.1998	1998	Candace Summerford, R. Jude Samulski
fields	https://openalex.org/fields/11	https://openalex.org/W4235160421	https://doi.org/10.2307/2411924	1956	William L. Brown, E. O. Wilson
fields	https://openalex.org/fields/11	https://openalex.org/W1910936647	https://doi.org/10.1093/genetics/118.3.461	1988	Hugh M. Robertson, Christine R Preston, R W Phillis, Dena M. Johnson-Schlitz, Wendy Benz, William R. Engels
fields	https://openalex.org/fields/11	https://openalex.org/W2105043321	https://doi.org/10.1146/annurev.ento.42.1.291	1997	J. A. McMurtry, B. A. Croft
fields	https://openalex.org/fields/11	https://openalex.org/W2106629036	https://doi.org/10.1111/j.1365-2672.2006.02963.x	2006	Shoukat Parvez, Khairuddin Malik, ⋅Sang-Mo Kang, H.-Y. Kim
fields	https://openalex.org/fields/11	https://openalex.org/W2121531763	https://doi.org/10.1038/nbt.1523	2009	Andreas Gnirke, Alexandre Melnikov, Jared Maguire, Peter Rogov, Emily M LeProust, William W. Brockman, Timothy R. Fennell, Georgia Giannoukos, Sheila Fisher, Carsten Russ, Stacey Gabriel, David B. Jaffe, Eric S. Lander, Chad Nusbaum
fields	https://openalex.org/fields/11	https://openalex.org/W2142805768	https://doi.org/10.1371/journal.pone.0009754	2010	Christopher A. Mullin, Maryann Frazier, James L. Frazier, Sara A. Ashcraft, Roger Simonds, Dennis vanEngelsdorp, Jeffery S. Pettis
fields	https://openalex.org/fields/11	https://openalex.org/W2796536593	https://doi.org/10.2307/2484208	1972	Heidi Hammond, Emanuel Epstein
fields	https://openalex.org/fields/11	https://openalex.org/W1709802691		2002	Jelle Bruinsma
fields	https://openalex.org/fields/11	https://openalex.org/W1961220478	https://doi.org/10.1128/jcm.33.1.24-27.1995	1995	Sylvie Dutka‐Malen, Stefan Evers, Patrice Courvalin
fields	https://openalex.org/fields/11	https://openalex.org/W2032463086	https://doi.org/10.1038/327070a0	1987	Theodore M. Klein, E. D. Wolf, Rong‐Ching Wu, John C. Sanford
fields	https://openalex.org/fields/11	https://openalex.org/W2043522420	https://doi.org/10.1126/science.2294592	1990	Peter Lichter, Chieh-Ju C. Tang, Katherine M. Call, Gary Hermanson, Glen A. Evans, David E. Housman, David C. Ward
fields	https://openalex.org/fields/11	https://openalex.org/W2093826686	https://doi.org/10.1086/286054	1997	Mark Kirkpatrick, Nick Barton
fields	https://openalex.org/fields/11	https://openalex.org/W2101115072	https://doi.org/10.1146/annurev-arplant-042110-103846	2011	Sally E. Smith, F. A. Smith
fields	https://openalex.org/fields/11	https://openalex.org/W2144082513	https://doi.org/10.1016/s0140-6736(03)13490-3	2003	Marko Kalliomäki, Seppo Salminen, Tuija Poussa, Heikki Arvilommi, Erika Isolauri
fields	https://openalex.org/fields/11	https://openalex.org/W1640038695	https://doi.org/10.1016/s0021-9258(18)67912-8	1963	E. A. Wolin, M. J. Wolin, R. S. Wolfe
fields	https://openalex.org/fields/11	https://openalex.org/W2013148539	https://doi.org/10.3389/fpls.2014.00086	2014	Yuriko Osakabe, Keishi Osakabe, Kazuo Shinozaki, Lam‐Son Phan Tran
fields	https://openalex.org/fields/11	https://openalex.org/W2157560775	https://doi.org/10.1111/j.1461-0248.2004.00657.x	2004	Jonathan M. Levine, Peter B. Adler, Stephanie G. Yelenik
fields	https://openalex.org/fields/11	https://openalex.org/W1508896617		1980	N. W. Schaad
fields	https://openalex.org/fields/11	https://openalex.org/W2042930277	https://doi.org/10.1038/nature11243	2012	Yin Shen, Feng Yue, David McCleary, Zhen Ye, Lee Edsall, Samantha Kuan, Ulrich Wagner, Jesse R. Dixon, Leonard Lee, Victor V. Lobanenkov, Bing Ren
fields	https://openalex.org/fields/11	https://openalex.org/W2059075856	https://doi.org/10.1016/0038-0717(93)90113-p	1993	Åsa Frostegård, Erland Bååth, A. Tunlio
fields	https://openalex.org/fields/11	https://openalex.org/W2105422221	https://doi.org/10.1105/tpc.104.022699	2004	Lam‐Son Phan Tran, Kazuo Nakashima, Yoh Sakuma, Séan D. Simpson, Yasunari Fujita, Kyonoshin Maruyama, Miki Fujita, Motoaki Seki, Kazuo Shinozaki, Kazuko Yamaguchi‐Shinozaki
fields	https://openalex.org/fields/11	https://openalex.org/W2105756833	https://doi.org/10.1364/ao.4.000011	1965	David M. Gates, Harry J Keegan, John C Schleter, Victor R. Weidner
