category	entry_id	openalex_id	doi	publication_year	authors
fields	https://openalex.org/fields/11	https://openalex.org/W2160883209	https://doi.org/10.1191/1464993403ps060oa	2003	W. Neil Adger, Saleemul Huq, Katrina Brown, Declan Conway, Mike Hulme
fields	https://openalex.org/fields/11	https://openalex.org/W2608669727	https://doi.org/10.2307/3451427	1993	David B. Taylor, Mike Kent, P. D. Coker
fields	https://openalex.org/fields/11	https://openalex.org/W2745006471	https://doi.org/10.1038/nbt.3893	2017	Robert M. Bowers, Nikos C. Kyrpides, Ramûnas Stepanauskas, Miranda Harmon-Smith, Devin F. R. Doud, T. B. K. Reddy, Frederik Schulz, Jessica K. Jarett, Adam R. Rivers, Emiley A. Eloe‐Fadrosh, Susannah G. Tringe, Natalia Ivanova, Alex Copeland, Alicia Clum, Eric D. Becraft, Rex R. Malmstrom, Bruce W. Birren, Mircea Podar, Peer Bork, George M. Weinstock, George M Garrity, Jeremy A. Dodsworth, Shibu Yooseph, Granger Sutton, Frank Oliver Glöckner, Jack A. Gilbert, William Nelson, Steven Hallam, Sean P. Jungbluth, Thijs J. G. Ettema, Scott Tighe, Konstantinos T. Konstantinidis, Wen‐Tso Liu, Brett J. Baker, Thomas Rattei, Jonathan A. Eisen, Brian P. Hedlund, Katherine D. McMahon, Noah Fierer, Rob Knight, ROBERT FINN, Guy Cochrane, Ilene Karsch‐Mizrachi, Gene W. Tyson, Christian Rinke, Alla Lapidus, Folker Meyer, Pelin Yilmaz, Donovan H. Parks, A. Murat Eren, Lynn M. Schriml, Jillian F. Banfield, Philip Hugenholtz, Tanja Woyke
fields	https://openalex.org/fields/11	https://openalex.org/W4233168270	https://doi.org/10.2307/2419902	1934	Th. Just, C. Raunkiaer
fields	https://openalex.org/fields/11	https://openalex.org/W619792159		1970	A. C. Hulme
fields	https://openalex.org/fields/11	https://openalex.org/W1975867518	https://doi.org/10.1007/bf02912621	1995	Ragan M. Callaway
fields	https://openalex.org/fields/11	https://openalex.org/W2080565381	https://doi.org/10.3168/jds.s0022-0302(99)75474-3	1999	J.K. Drackley
fields	https://openalex.org/fields/11	https://openalex.org/W2092531104	https://doi.org/10.1016/s0308-8146(02)00416-8	2003	Narpinder Singh, Jaspreet Singh, Lovedeep Kaur, Navdeep Singh Sodhi, Balmeet Singh Gill
fields	https://openalex.org/fields/11	https://openalex.org/W1855365699	https://doi.org/10.1128/jb.66.1.24-26.1953	1953	Rudolph Hugh, Einar Leifson
fields	https://openalex.org/fields/11	https://openalex.org/W2037428143	https://doi.org/10.1098/rstb.1987.0030	1987	Ulla Μ. Norberg, J. M. V. Rayner
fields	https://openalex.org/fields/11	https://openalex.org/W2043876718	https://doi.org/10.1016/s0308-8146(00)00223-5	2001	Andrés Moure, J.M. Cruz, Daniel Franco, J.Manuel Domı́nguez, Jorge Sineiro, Herminia Domı́nguez, Marı́a José Núñez, Juan Carlos Parajó
fields	https://openalex.org/fields/11	https://openalex.org/W4243563432	https://doi.org/10.1080/00401706.1999.10485670	1999	Peter J. Rousseeuw, Katrien Van Driessen
fields	https://openalex.org/fields/11	https://openalex.org/W2117925179	https://doi.org/10.1038/nature10811	2012	Trudy F. C. Mackay, Stephen Richards, Eric A. Stone, Antonio Barbadilla, Julien F. Ayroles, Dianhui Zhu, Sònia Casillas, Yi Han, Michael M. Magwire, Julie M. Cridland, Mark F. Richardson, Robert R. H. Anholt, Maite G. Barrón, Crystal Bess, Kerstin P. Blankenburg, Mary Anna Carbone, David Castellano, Lesley Chaboub, Laura Duncan, Zeke Harris, Mehwish Javaid, Joy C. Jayaseelan, Shalini N. Jhangiani, Katherine W. Jordan, Fremiet Lara, Faye Lawrence, Sandra L. Lee, Pablo Librado, Raquel Linheiro, Richard F. Lyman, Aaron J. Mackey, Mala Munidasa, Donna M. Muzny, Lynne Nazareth, Irene Newsham, Lora Perales, Ling-Ling Pu, Carson Qu, Miquel Ràmia, Jeffrey G. Reid, Stephanie M. Rollmann, Julio Rozas, Nehad Saada, Lavanya Turlapati, Kim C. Worley, Yuanqing Wu, Akihiko Yamamoto, Yiming Zhu, Casey Bergman, Kevin Thornton, David Mittelman, Richard A. Gibbs
fields	https://openalex.org/fields/11	https://openalex.org/W2179061470	https://doi.org/10.1016/b978-0-12-108750-0.x5001-0	1979	
fields	https://openalex.org/fields/11	https://openalex.org/W2139427406	https://doi.org/10.1016/s0378-1127(01)00575-8	2002	Jerry F. Franklin, Thomas A. Spies, Robert Van Pelt, Andrew B. Carey, D. A. Thornburgh, Dean Rae Berg, David B. Lindenmayer, Mark E. Harmon, William S. Keeton, David C. Shaw, Ken Bible, Jiquan Chen
fields	https://openalex.org/fields/11	https://openalex.org/W2142718629	https://doi.org/10.1093/oxfordjournals.molbev.a040517	1988	Pekka Pamilo, M Nei
fields	https://openalex.org/fields/11	https://openalex.org/W2578081910		2013	A. van Huis, Joost Van Itterbeeck, Harmke C. Klunder, Elly Mertens, Afton Halloran, Giulia Muir, Paul Vantomme
fields	https://openalex.org/fields/11	https://openalex.org/W2013075104	https://doi.org/10.1890/1540-9295(2005)003[0479:lofscf]2.0.co;2	2005	Aaron M. Ellison, Michael S. Bank, Barton D. Clinton, Elizabeth A. Colburn, Katherine J. Elliott, Chelcy R. Ford, David R. Foster, Brian D. Kloeppel, Jennifer D. Knoepp, Gary M. Lovett, Jacqueline E. Mohan, David A. Orwig, Nicholas L. Rodenhouse, William V. Sobczak, Kristina A. Stinson, Jeffrey K. Stone, Christopher M. Swan, Jill Thompson, Betsy Von Holle, Jackson R. Webster
fields	https://openalex.org/fields/11	https://openalex.org/W2016867755	https://doi.org/10.1016/s0065-3454(16)30011-0	2016	Daniel S. Lehrman, Jay S. Rosenblatt, Robert A. Hinde, Evelyn S. Shaw, Colin Beer, P.J.B. Slater, H. Jane Brockmann, Marc Naguib
fields	https://openalex.org/fields/11	https://openalex.org/W2099399906	https://doi.org/10.1016/0377-8401(94)90171-6	1994	Michael K. Theodorou, Barbara A. Williams, M.S. Dhanoa, Alex B. McAllan
fields	https://openalex.org/fields/11	https://openalex.org/W2125359798	https://doi.org/10.1093/bioinformatics/13.3.235	1997	Andrew Rambaut, N. Grass
fields	https://openalex.org/fields/11	https://openalex.org/W2575311006		1955	C. W. Thornthwaite
fields	https://openalex.org/fields/11	https://openalex.org/W2050991795	https://doi.org/10.1016/s0261-2194(97)83220-6	1997	D. M. Benson
fields	https://openalex.org/fields/11	https://openalex.org/W2051201019	https://doi.org/10.1111/j.1574-6941.2012.01437.x	2012	Katarina Ihrmark, Inga T. M. Bödeker, Karelyn Cruz-Martínez, Hanna Friberg, Ariana Kubartová, Jessica Schenck, Ylva Strid, Jan Stenlid, Mikael Brandström-Durling, Karina E. Clemmensen, Björn D. Lindahl
fields	https://openalex.org/fields/11	https://openalex.org/W2073376866	https://doi.org/10.1038/nature02485	2004	Cyril Zipfel, Silke Robatzek, Lionel Navarro, Edward J. Oakeley, Jonathan D. G. Jones, Georg Felix, Thomas Boller
fields	https://openalex.org/fields/11	https://openalex.org/W2061177996	https://doi.org/10.1111/j.1469-8137.2009.03160.x	2010	Kessy Abarenkov, R. Henrik Nilsson, Karl‐Henrik Larsson, Ian J. Alexander, Ursula Eberhardt, Susanne Erland, Klaus Høiland, Rasmus Kjøller, Ellen Larsson, Taina Pennanen, Robin Sen, Andy F. S. Taylor, Leho Tedersoo, Björn M. Ursing, Trude Vrålstad, Kare Liimatainen, Ursula Peintner, Urmas Kõljalg
fields	https://openalex.org/fields/11	https://openalex.org/W2110328754	https://doi.org/10.1111/j.1461-0248.2009.01418.x	2009	Mark van Kleunen, Ewald Weber, Markus Fischer
fields	https://openalex.org/fields/11	https://openalex.org/W1989949238	https://doi.org/10.2307/3546886	1997	Rien Aerts
fields	https://openalex.org/fields/11	https://openalex.org/W3172843845	https://doi.org/10.5433/1679-0359	2022	
fields	https://openalex.org/fields/11	https://openalex.org/W4395633821	https://doi.org/10.15468/b63cw6	2017	Jean L. Woods
fields	https://openalex.org/fields/11	https://openalex.org/W1971059297	https://doi.org/10.1128/aem.68.8.3795-3801.2002	2002	Cheryl L. Patten, Bernard R. Glick
fields	https://openalex.org/fields/11	https://openalex.org/W2013287304	https://doi.org/10.1016/s0168-1176(97)00281-4	1998	W. Lindinger, Armin Hansel, Alfons Jordan
fields	https://openalex.org/fields/11	https://openalex.org/W2027484375	https://doi.org/10.1126/science.1085658	2003	K. Anand, John Ziebuhr, Parvesh Wadhwani, J.R. Mesters, R. Hilgenfeld
fields	https://openalex.org/fields/11	https://openalex.org/W2076485300	https://doi.org/10.1111/j.1744-7348.1952.tb00904.x	1952	J. M. Hirst
fields	https://openalex.org/fields/11	https://openalex.org/W1968830441	https://doi.org/10.1016/j.tplants.2008.10.004	2008	Yang Jung-Wook, Joseph W. Kloepper, Choong‐Min Ryu
fields	https://openalex.org/fields/11	https://openalex.org/W1999420160	https://doi.org/10.1111/j.1469-185x.1967.tb01419.x	1967	R. H. Whittaker
fields	https://openalex.org/fields/11	https://openalex.org/W2127375043	https://doi.org/10.1105/tpc.8.10.1773	1996	K. E. Hammond‐Kosack, Jonathan D. G. Jones
fields	https://openalex.org/fields/11	https://openalex.org/W1542870356	https://doi.org/10.1016/0003-9861(68)90523-7	1968	Robert L. Heath, Lester Packer
fields	https://openalex.org/fields/11	https://openalex.org/W2132656837	https://doi.org/10.1016/j.cpr.2006.08.002	2006	E. David Klonsky
fields	https://openalex.org/fields/11	https://openalex.org/W2152424523	https://doi.org/10.1007/978-94-009-8647-3	1981	Juhan Ross
fields	https://openalex.org/fields/11	https://openalex.org/W2323123718	https://doi.org/10.2307/2399464	1988	Alwyn H. Gentry
fields	https://openalex.org/fields/11	https://openalex.org/W2033169664	https://doi.org/10.1016/j.cell.2014.08.009	2014	Matthew T. Weirauch, Ally Yang, Mihai Albu, Atina G. Coté, Alejandro Montenegro‐Montero, Philipp Drewe, Hamed S. Najafabadi, Samuel A. Lambert, Ishminder K. Mann, Kate B. Cook, Hong Zheng, Alejandra Goity, Harm van Bakel, Jean-Claude Lozano, Mary Galli, Mathew G. Lewsey, Eryong Huang, Tuhin Mukherjee, Xiaoting Chen, John Reece-Hoyes, Sridhar Govindarajan, Gad Shaulsky, Albertha J.M. Walhout, François-Yves Bouget, Gunnar Rätsch, Luis F. Larrondo, Joseph R. Ecker, Timothy R. Hughes
fields	https://openalex.org/fields/11	https://openalex.org/W2052178794	https://doi.org/10.1016/0006-291x(84)90411-x	1984	O. Östling, Karl J. Johanson
fields	https://openalex.org/fields/11	https://openalex.org/W2059506482	https://doi.org/10.1111/j.1365-3059.1995.tb02773.x	1995	D. WYNN PARRY, Peter Jenkinson, Lynette J. McLeod
fields	https://openalex.org/fields/11	https://openalex.org/W1986322390	https://doi.org/10.1111/j.1365-2745.2007.01295.x	2007	Rob W. Brooker, Fernando T. Maestre, Ragan M. Callaway, Christopher J. Lortie, Lohengrin A. Cavieres, Georges Künstler, Pierre Liancourt, Katja Tielbörger, Justin M. J. Travis, Fabien Anthelme, Cristina Armas, Lluís Coll, Emmanuel Corcket, Sylvain Delzon, Estelle Forey, Zaal Kikvidze, Johan Olofsson, Francisco I. Pugnaire, Constanza L. Quiroz, Patrick Saccone, Katja Schiffers, Merav Seifan, Blaize Touzard, Richard Michalet
fields	https://openalex.org/fields/11	https://openalex.org/W2109126550	https://doi.org/10.1084/jem.103.5.653	1956	Theodore T. Puck, Philip I. Marcus
fields	https://openalex.org/fields/11	https://openalex.org/W2153299286	https://doi.org/10.1093/jxb/ert208	2013	Erik H. Murchie, Tracy Lawson
fields	https://openalex.org/fields/11	https://openalex.org/W2102288184	https://doi.org/10.1111/ejss.4_12398	2017	P. Nannipieri, Judith Ascher‐Jenull, Maria Teresa Ceccherini, L. Landi, Giacomo Pietramellara, Giancarlo Renella
fields	https://openalex.org/fields/11	https://openalex.org/W2136963235	https://doi.org/10.1186/2193-1801-2-587	2013	Seema B. Sharma, R. Z. Sayyed, Mrugesh Trivedi, Thivakaran A. Gobi
fields	https://openalex.org/fields/11	https://openalex.org/W2137152840	https://doi.org/10.1146/annurev.es.17.110186.000435	1986	Peter G. Murphy, A. E. Lugo
fields	https://openalex.org/fields/11	https://openalex.org/W2142469467		1985	W. Helle, Maurice W. Sabelis
fields	https://openalex.org/fields/11	https://openalex.org/W2157294197	https://doi.org/10.1071/ar9951459	1995	GJ Blair, R. D. B. Lefroy, Leanne Lisle
fields	https://openalex.org/fields/11	https://openalex.org/W3011537081	https://doi.org/10.1038/s41423-020-0400-4	2020	Wanbo Tai, Lei He, Xiujuan Zhang, Jing Pu, Denis Voronin, Shibo Jiang, Yusen Zhou, Lanying Du
fields	https://openalex.org/fields/11	https://openalex.org/W1986580287	https://doi.org/10.1104/pp.98.4.1222	1992	İsmail Çakmak, Horst Marschner
fields	https://openalex.org/fields/11	https://openalex.org/W2168111104	https://doi.org/10.1038/sj.bjp.0707442	2007	Roger G. Pertwee
fields	https://openalex.org/fields/11	https://openalex.org/W3188909002	https://doi.org/10.1007/s11104-004-2005-6	2005	Kashchandra G. Raghothama, Athikkattuvalasu S. Karthikeyan
fields	https://openalex.org/fields/11	https://openalex.org/W1991022833	https://doi.org/10.1086/413215	1983	Mary Jane West‐Eberhard
fields	https://openalex.org/fields/11	https://openalex.org/W2116935344	https://doi.org/10.1016/0341-8162(94)90001-9	1994	David L. Rosgen
fields	https://openalex.org/fields/11	https://openalex.org/W2253902135	https://doi.org/10.1038/ncomms10541	2016	Manuel Delgado‐Baquerizo, Fernando T. Maestre, Peter B. Reich, Thomas C. Jeffries, Juan Gaitán, Daniel Encinar, Miguel Berdugo, Colin D. Campbell, Brajesh K. Singh
fields	https://openalex.org/fields/11	https://openalex.org/W2282448634	https://doi.org/10.2307/1940152	1992	Mark D. Hunter, Peter W. Price
fields	https://openalex.org/fields/11	https://openalex.org/W2165460636	https://doi.org/10.1373/clinchem.2014.237016	2015	J. Craig Venter, Hamilton O. Smith, Mark D. Adams
fields	https://openalex.org/fields/11	https://openalex.org/W3121496134		2003	James D. Fearon, David D. Laitin
fields	https://openalex.org/fields/11	https://openalex.org/W1505543708	https://doi.org/10.1023/a:1006247623877	2000	William H. Schlesinger, Jeffrey A. Andrews
fields	https://openalex.org/fields/11	https://openalex.org/W2025459454	https://doi.org/10.1111/j.1365-3040.2009.01926.x	2009	Dayakar V. Badri, Jorge M. Vivanco
fields	https://openalex.org/fields/11	https://openalex.org/W2040418904	https://doi.org/10.1061/(asce)0733-9429(1984)110:10(1431)	1984	Leo C. van Rijn
fields	https://openalex.org/fields/11	https://openalex.org/W1969996400	https://doi.org/10.1098/rspb.2003.2327	2003	Jonathan M. Levine, Montserrat Vilà, Carla M. D Antonio, Jeffrey S. Dukes, Karl Grigulis, Sandra Lavorel
fields	https://openalex.org/fields/11	https://openalex.org/W1996995334	https://doi.org/10.2307/3601228	1982	Douglas Rimmer, Robert H. Bates
fields	https://openalex.org/fields/11	https://openalex.org/W2122900297	https://doi.org/10.1590/s1517-83822000000400003	2000	Gislene G. F. Nascimento, Juliana Locatelli, Paulo Chanel Deodato de Freitas, Giuliana L. Silva
fields	https://openalex.org/fields/11	https://openalex.org/W2178324140	https://doi.org/10.1128/mmbr.00019-15	2016	Essaïd Ait Barka, Parul Vatsa, Lisa Sanchez, Nathalie Vaillant‐Gaveau, Cédric Jacquard, Hans‐Peter Klenk, Christophe Clément, Yder Ouhdouch, Gilles P. van Wezel
fields	https://openalex.org/fields/11	https://openalex.org/W1908810753	https://doi.org/10.1093/genetics/132.2.583	1992	R R Hudson, Montgomery Slatkin, Wayne P. Maddison
fields	https://openalex.org/fields/11	https://openalex.org/W2135684970	https://doi.org/10.1242/jeb.01730	2005	Paul H. Yancey
fields	https://openalex.org/fields/11	https://openalex.org/W2157291679	https://doi.org/10.1214/ss/1177011926	1991	G. K. Robinson
fields	https://openalex.org/fields/11	https://openalex.org/W2024848067	https://doi.org/10.1126/science.1186366	2010	Assaf Zemach, Ivy E. McDaniel, Pedro Silva, Daniel Zilberman
fields	https://openalex.org/fields/11	https://openalex.org/W2062689653	https://doi.org/10.2134/agronj1951.00021962004300090005x	1951	George John Bouyoucos
fields	https://openalex.org/fields/11	https://openalex.org/W2137001862	https://doi.org/10.1002/cne.901650405	1976	Fernando Nottebohm, Tegner M. Stokes, Christiana M. Leonard
fields	https://openalex.org/fields/11	https://openalex.org/W4238805501	https://doi.org/10.1037/h0070888	1933	H. Hotelling
fields	https://openalex.org/fields/11	https://openalex.org/W2071667086	https://doi.org/10.1023/a:1024199013926	2003	Esperanza Martínez‐Romero
fields	https://openalex.org/fields/11	https://openalex.org/W2075015345	https://doi.org/10.1078/0176-1617-0774	2002	Dev T. Britto, Herbert J. Kronzucker
fields	https://openalex.org/fields/11	https://openalex.org/W1981244178	https://doi.org/10.1371/journal.pone.0121945	2015	Birk Diedenhofen, Jochen Musch
fields	https://openalex.org/fields/11	https://openalex.org/W2012505332	https://doi.org/10.1038/nrmicro2090	2009	Lanying Du, Yuxian He, Yusen Zhou, Shuwen Liu, Bo-Jian Zheng, Shibo Jiang
fields	https://openalex.org/fields/11	https://openalex.org/W2091512138	https://doi.org/10.1016/0378-1119(92)90454-w	1992	Thomas Christianson, Robert Sikorski, Michael Dante, James H. Shero, Philip Hieter
fields	https://openalex.org/fields/11	https://openalex.org/W2167493116	https://doi.org/10.1038/nature01554	2003	James E. Galagan, Sarah E. Calvo, Katherine A. Borkovich, Eric U. Selker, Nick D. Read, David B. Jaffe, William W. Fitzhugh, Li‐Jun Ma, Serge Smirnov, Seth Purcell, Bushra Rehman, Timothy Elkins, Reinhard Engels, Shunguang Wang, Cydney Nielsen, Jonathan A. Butler, Matthew G. Endrizzi, Dayong Qui, Peter Ianakiev, Deborah Bell‐Pedersen, Mary Anne Nelson, Margaret Werner‐Washburne, Claude P. Selitrennikoff, John Á. Kinsey, Edward L. Braun, Alex Zelter, Ulrich Schulte, Gregory O. Kothe, Gregory Jedd, Hans‐Werner Mewes, Chuck Stäben, Edward M. Marcotte, David Greenberg, Alice C. Roy, Karen Foley, Jerome W. Naylor, Nicole Stange-Thomann, Robert J. Barrett, Sante Gnerre, Michael Kamal, Manolis Kamvysselis, Evan Mauceli, C. Bielke, Stephen Rudd, Dmitrij Frishman, Svetlana Kryštofová, Carolyn G. Rasmussen, Robert L. Metzenberg, David D. Perkins, Scott Kroken, Carlo Cogoni, Giuseppe Macino, David Catcheside, Weixi Li, Robert Pratt, Stephen A. Osmani, Colin P. C. DeSouza, Louise Glass, Marc J. Orbach, J. Andrew Berglund, Rodger B. Voelker, Oded Yarden, Michael Plamann, Stephan Seiler, Jay Dunlap, Alan Radford, Rodolfo Aramayo, Donald O. Natvig, Lisa A. Alex, Gertrud Mannhaupt, Daniel J. Ebbole, Michael Freitag, Ian T. Paulsen, Matthew S. Sachs, Eric S. Lander, Chad Nusbaum, Bruce W. Birren
fields	https://openalex.org/fields/11	https://openalex.org/W4395259276	https://doi.org/10.15468/asgd85	2022	Claes Gustafsson
fields	https://openalex.org/fields/11	https://openalex.org/W1997191564	https://doi.org/10.1016/s0308-8146(02)00423-5	2003	Dae‐Ok Kim, Seung Weon Jeong, Chang Yeol Lee
fields	https://openalex.org/fields/11	https://openalex.org/W2043557587	https://doi.org/10.1016/j.progpolymsci.2013.11.004	2013	Stéphanie Laurichesse, Luc Avérous
fields	https://openalex.org/fields/11	https://openalex.org/W2126552603	https://doi.org/10.1093/beheco/ark016	2006	Graeme D. Ruxton
fields	https://openalex.org/fields/11	https://openalex.org/W2131112579	https://doi.org/10.1371/journal.pone.0032253	2012	Jesse Poland, Patrick J. Brown, Mark E. Sorrells, Jean‐Luc Jannink
fields	https://openalex.org/fields/11	https://openalex.org/W3106534923		2007	Eusebius J. Doedel, Alan R. Champneys, Fabio Dercole, Thomas F. Fairgrieve, Yuri A. Kuznetsov, Bart E. Oldeman, Randy Paffenroth, Björn Sandstede, X. J. Wang, C. H. Zhang
fields	https://openalex.org/fields/11	https://openalex.org/W1985442257	https://doi.org/10.1111/j.2044-8317.1985.tb00832.x	1985	Bengt Muthén, David M. Kaplan
fields	https://openalex.org/fields/11	https://openalex.org/W1561299178	https://doi.org/10.1038/095089b0	1915	E. J. RUSSELL
fields	https://openalex.org/fields/11	https://openalex.org/W1990548509	https://doi.org/10.1073/pnas.75.1.280	1978	Paul C. Zamecnik, Mary L. Stephenson
fields	https://openalex.org/fields/11	https://openalex.org/W2111900042	https://doi.org/10.1074/jbc.c200673200	2003	Naohiro Inohara, Yasunori Ogura, Ana Fontalba, Olga Gutiérrez, Fernando Pons, Javier Crespo, Koichi Fukase, Seiichi Inamura, Shoichi Kusumoto, Masahito Hashimoto, Simon J. Foster, Anthony P. Moran, José L. Fernández-Luna, Gabriel Núñez
fields	https://openalex.org/fields/11	https://openalex.org/W1971196378	https://doi.org/10.1111/j.1365-3040.1990.tb01304.x	1990	Frank Van Assche, H. Clijsters
fields	https://openalex.org/fields/11	https://openalex.org/W2053061982	https://doi.org/10.1093/biomet/asn034	2008	Jie Chen, Zehua Chen
fields	https://openalex.org/fields/11	https://openalex.org/W2082142840	https://doi.org/10.1016/j.plantsci.2012.07.014	2012	Giovanni Agati, Elisa Azzarello, Susanna Pollastri, Massimiliano Tattini
fields	https://openalex.org/fields/11	https://openalex.org/W2111924154	https://doi.org/10.1007/s11104-009-9895-2	2009	Alan E. Richardson, J. M. Barea, Ann McNeill, Claire Prigent‐Combaret
fields	https://openalex.org/fields/11	https://openalex.org/W2152756549	https://doi.org/10.1016/j.femsre.2004.06.005	2004	Tony Collins, Charles Gerday, Georges Feller
fields	https://openalex.org/fields/11	https://openalex.org/W3209404337		2008	Freddy Rangkutti
fields	https://openalex.org/fields/11	https://openalex.org/W1992809988	https://doi.org/10.1038/417067a	2002	John N. Klironomos
fields	https://openalex.org/fields/11	https://openalex.org/W2156053130	https://doi.org/10.1016/c2009-0-03109-2	1980	
fields	https://openalex.org/fields/11	https://openalex.org/W2169545551	https://doi.org/10.1128/mr.60.3.539-574.1996	1996	John R. W. Govan, Vojo Deretić
fields	https://openalex.org/fields/11	https://openalex.org/W2041726628	https://doi.org/10.1111/j.1558-5646.1980.tb04817.x	1980	Russell Lande
fields	https://openalex.org/fields/11	https://openalex.org/W2085154695	https://doi.org/10.1016/j.biocon.2009.05.006	2009	Brian L. Sullivan, Christopher Wood, Marshall J. Iliff, Rick Bonney, Daniel Fink, Steve Kelling
fields	https://openalex.org/fields/11	https://openalex.org/W2038423019		1984	Donald R. Strong, John H. Lawton, Sir R. Southwood
fields	https://openalex.org/fields/11	https://openalex.org/W2038581914	https://doi.org/10.1016/s0008-6215(00)80510-8	1967	Peter Albersheim, Donald J. Nevins, Patricia D. English, Arthur L. Karr
fields	https://openalex.org/fields/11	https://openalex.org/W2163541402	https://doi.org/10.1641/b580607	2008	Kenneth F. Raffa, Brian H. Aukema, Barbara Bentz, Allan L. Carroll, Jeffrey A. Hicke, Monica G. Turner, William H. Romme
fields	https://openalex.org/fields/11	https://openalex.org/W2242001249		1982	Rainer F. Foelix
fields	https://openalex.org/fields/11	https://openalex.org/W1988033736	https://doi.org/10.1007/bf00378733	1989	R. R. Hofmann
fields	https://openalex.org/fields/11	https://openalex.org/W1988183526	https://doi.org/10.1038/385313a0	1997	David C. Van Essen
fields	https://openalex.org/fields/11	https://openalex.org/W1989480537	https://doi.org/10.1016/0003-2697(76)90488-7	1976	Erich F. Elstner, Adelheid Heupel
fields	https://openalex.org/fields/11	https://openalex.org/W2004737831	https://doi.org/10.1126/science.250.4985.1251	1990	Ted C. J. Turlings, James H. Tumlinson, W. J. Lewis
fields	https://openalex.org/fields/11	https://openalex.org/W2031199055	https://doi.org/10.1038/nature03542	2005	Stefan Kepinski, Ottoline Leyser
fields	https://openalex.org/fields/11	https://openalex.org/W2131026689	https://doi.org/10.1038/nmeth.2066	2012	Nicola Segata, Levi Waldron, Annalisa Ballarini, Vagheesh M. Narasimhan, Olivier Jousson, Curtis Huttenhower
fields	https://openalex.org/fields/11	https://openalex.org/W2163650164	https://doi.org/10.1093/genetics/76.2.379	1974	Masatoshi Nei, A. K. Roychoudhury
fields	https://openalex.org/fields/11	https://openalex.org/W30738615	https://doi.org/10.1093/aibsbulletin/5.1.12-b	1955	S. A. Barnett
fields	https://openalex.org/fields/11	https://openalex.org/W2090936658	https://doi.org/10.1126/science.280.5360.104	1998	Kirsten R. Jaglo‐Ottosen, Sarah J. Gilmour, Daniel G. Zarka, Oliver Schabenberger, Michael F. Thomashow
fields	https://openalex.org/fields/11	https://openalex.org/W2135614782	https://doi.org/10.1016/j.tplants.2006.06.007	2006	Jian Feng, Naoki Yamaji
fields	https://openalex.org/fields/11	https://openalex.org/W2159100436	https://doi.org/10.1128/mmbr.66.2.300-372.2002	2002	Stefan Hohmann
fields	https://openalex.org/fields/11	https://openalex.org/W2163425068	https://doi.org/10.1146/annurev.arplant.55.031903.141655	2004	Leon V. Kochian, Owen A. Hoekenga, Miguel A. Piñeros
fields	https://openalex.org/fields/11	https://openalex.org/W1501554064	https://doi.org/10.5860/choice.31-2107	1993	Carol Ann Kearns, David W. Inouye
fields	https://openalex.org/fields/11	https://openalex.org/W2064237100	https://doi.org/10.4161/psb.21663	2012	Abdul Rashid War, Michael Gabriel Paulraj, Tariq Ahmad, Abdul Ahad Buhroo, Barkat Hussain, S. Ignacimuthu, Hari Chand Sharma
fields	https://openalex.org/fields/11	https://openalex.org/W2062571325	https://doi.org/10.1056/nejm197601222940402	1976	Allen C. Alfrey, Gary R. LeGendre, William D. Kaehny
fields	https://openalex.org/fields/11	https://openalex.org/W2053415661	https://doi.org/10.2307/1931725	1951	J. T. Curtis, Robert P. McIntosh
fields	https://openalex.org/fields/11	https://openalex.org/W2144260204	https://doi.org/10.1093/jxb/erl165	2006	E. Fereres, María-Auxiliadora Soriano
fields	https://openalex.org/fields/11	https://openalex.org/W3121518240	https://doi.org/10.1177/147078530805000106	2008	John Dawes
fields	https://openalex.org/fields/11	https://openalex.org/W2103307438	https://doi.org/10.1093/icb/23.2.347	1983	Stevan J. Arnold
fields	https://openalex.org/fields/11	https://openalex.org/W2031775282	https://doi.org/10.1073/pnas.91.1.11	1994	Emanuel Epstein
fields	https://openalex.org/fields/11	https://openalex.org/W2040553259	https://doi.org/10.1016/j.cell.2014.02.045	2014	Édith Heard, Robert A. Martienssen
fields	https://openalex.org/fields/11	https://openalex.org/W2063825413	https://doi.org/10.1016/0166-0934(88)90134-6	1988	Rudi Pauwels, Jan Balzarini, Masanori Baba, Robert Snoeck, Dominique Schols, Piet Herdewijn, Jan Desmyter, Erik De Clercq
