category	entry_id	openalex_id	doi	publication_year	authors
fields	https://openalex.org/fields/11	https://openalex.org/W1604444942	https://doi.org/10.5962/bhl.title.48637	1909	Santiago Ramón y Cajal
fields	https://openalex.org/fields/11	https://openalex.org/W4253164051	https://doi.org/10.1146/annurev-arplant-042809-112315	2010	Henrik Vibe Scheller, Peter Ulvskov
fields	https://openalex.org/fields/11	https://openalex.org/W2060881812	https://doi.org/10.1016/s0309-1740(03)00022-6	2003	J. D. Wood, R.I. Richardson, G.R. Nute, A.V. Fisher, M.M. Campo, Eleni Kasapidou, P.R. Sheard, M. Enser
fields	https://openalex.org/fields/11	https://openalex.org/W2113617438	https://doi.org/10.2307/2258617	1975	D Tennant
fields	https://openalex.org/fields/11	https://openalex.org/W2119006714	https://doi.org/10.1038/nature11688	2012	Brendan Choat, Steven Jansen, Timothy J. Brodribb, Hervé Cochard, Sylvain Delzon, Radika Bhaskar, Sandra J. Bucci, Taylor S. Feild, Sean M. Gleason, Uwe G. Hacke, Anna L. Jacobsen, Frederic Lens, Hafiz Maherali, Jordi Martínez‐Vilalta, Stefan Mayr, Maurizio Mencuccini, Patrick J. Mitchell, Andrea Nardini, Jarmila Pittermann, R. Brandon Pratt, John S. Sperry, Mark Westoby, Ian J. Wright, Amy E. Zanne
fields	https://openalex.org/fields/11	https://openalex.org/W2003788503	https://doi.org/10.1126/science.1058709	2001	Lora V. Hooper, Jeffrey I. Gordon
fields	https://openalex.org/fields/11	https://openalex.org/W2158765373	https://doi.org/10.1098/rstb.2013.0122	2013	Klaus Butterbach‐Bahl, Elizabeth M. Baggs, Michael Dannenmann, Ralf Kiese, Sophie Zechmeister‐Boltenstern
fields	https://openalex.org/fields/11	https://openalex.org/W2168148721		2004	LaDeana W. Hillier, Webb Miller, Ewan Birney, Wesley C. Warren, Ross C. Hardison, Chris P. Ponting, Peer Bork, David W. Burt, Martien A. M. Groenen, Mary E. Delany, Jerry B. Dodgson, Asif Chinwalla, Paul Cliften, Sandra W. Clifton, Kimberly D. Delehaunty, Catrina C. Fronick, Robert S. Fulton, Tina Graves, Colin Kremitzki, Dan Layman, Vincent Magrini, John D. McPherson, Tracie L. Miner, Patrick Minx, William E. Nash, Michael N. Nhan, Joanne O. Nelson, Lachlan Oddy, Craig Pohl, Jennifer Randall-Maher, Scott M. Smith, John W. Wallis, Shiaw Pyng Yang, Michael N Romanov, Catherine M. Rondelli, Bob Paton, Jacqueline Smith, David Morrice, Laura M. Daniels, H.G. Tempest, Lindsay B. Robertson, Julio Masabanda, Darren K. Griffin, Alain Vignal, Valérie Fillon, Lina Jacobbson, Susanne Kerje, Leif Andersson, R.P.M.A. Crooijmans, Jan Aerts, J.J. van der Poel, Hans Ellegren, Randolph B. Caldwell, Simon J. Hubbard, Darren Grafham, Andrzej Kierzek, Stuart McLaren, Ian M. Overton, Hiroshi Arakawa, Kevin J. Beattie, Yuri Bezzubov, Paul E. Boardman, James Bonfield, Michael D. R. Croning, Robert M. Davies, Matthew D. Francis, Sean Humphray, Clare L. Scott, Ruth Taylor, Cheryll Tickle, William R. Brown, Jane Rogers, J M Buerstedde, Stuart A. Wilson, Lisa Stubbs, Ivan Ovcharenko, Laurie Gordon, Susan Lucas, Marcia M. Miller, Hidetoshi Inoko, Takashi Shiina, Jim Kaufman, Jan Salomonsen, Karsten Skjoedt, Gane Ka‐Shu Wong, Jun Wang, Bin Liu, Jian Wang, Jun Yu, Huanming Yang, Mikhail Nefedov, Maxim Koriabine, Pieter DeJong, Leo Goodstadt, Caleb Webber, Nicholas J. Dickens, Ivica Letunić, Mikita Suyama, David Torrents, Christian von Mering
fields	https://openalex.org/fields/11	https://openalex.org/W1970077040	https://doi.org/10.1111/j.1365-2664.2008.01600.x	2009	Philip E. Hulme
fields	https://openalex.org/fields/11	https://openalex.org/W2038161366	https://doi.org/10.1007/bf00033156	1990	O. van Kooten, J. Snel
fields	https://openalex.org/fields/11	https://openalex.org/W2315386399	https://doi.org/10.2307/2256497	1947	A. S. Watt
fields	https://openalex.org/fields/11	https://openalex.org/W1986526974	https://doi.org/10.1525/can.1992.7.1.02a00030	1992	Liisa H. Malkki
fields	https://openalex.org/fields/11	https://openalex.org/W1996018742	https://doi.org/10.1086/284547	1986	Arie J. van Noordwijk, G. de Jong
fields	https://openalex.org/fields/11	https://openalex.org/W2118885226	https://doi.org/10.1038/nature11917	2013	Xuejun Liu, Ying Zhang, Wenxuan Han, Aohan Tang, Jianlin Shen, Zhenling Cui, Peter M. Vitousek, J. W. Erisman, K. W. T. Goulding, Peter Christie, Andreas Fangmeier, Fusuo Zhang
fields	https://openalex.org/fields/11	https://openalex.org/W2040890982	https://doi.org/10.1080/10705510903008204	2009	Tihomir Asparouhov, Bengt Muthén
fields	https://openalex.org/fields/11	https://openalex.org/W2062505214	https://doi.org/10.1016/j.landurbplan.2003.08.003	2003	Anna Chiesura
fields	https://openalex.org/fields/11	https://openalex.org/W2004113883	https://doi.org/10.1007/s10584-008-9520-z	2008	W. Neil Adger, Suraje Dessai, Marisa Goulden, Mike Hulme, Irene Lorenzoni, Donald R. Nelson, Lars Otto Næss, Johanna Wolf, Anita Wreford
fields	https://openalex.org/fields/11	https://openalex.org/W2168793216	https://doi.org/10.1073/pnas.1633576100	2003	Jordi Bascompte, Pedro Jordano, Carlos J. Melián, Jes Olesen
fields	https://openalex.org/fields/11	https://openalex.org/W1989282030	https://doi.org/10.1056/nejm198207223070401	1982	Michael R. Bristow, Robert Ginsburg, Wayne Minobe, Roger S. Cubicciotti, W. Scott Sageman, Keith G. Lurie, Margaret E. Billingham, Donald C. Harrison, Edward B. Stinson
fields	https://openalex.org/fields/11	https://openalex.org/W1523336822	https://doi.org/10.1111/j.1095-8312.2004.00368.x	2004	Jan Pinceel, Kurt Jordaens, Natalie Van Houtte, A.J. de Winter, Thierry Backeljau
fields	https://openalex.org/fields/11	https://openalex.org/W2004271888	https://doi.org/10.1038/nrg2504	2009	Megha Ghildiyal, Phillip D. Zamore
fields	https://openalex.org/fields/11	https://openalex.org/W1484187172	https://doi.org/10.1038/2524	1998	Daniel Pinkel, Richard Segraves, Damir Sudar, Steven M. Clark, Ian Poole, David Kowbel, Colin C. Collins, Wen-Lin Kuo, Chira Chen, Ye Zhai, Shanaz H. Dairkee, Britt‐Marie Ljung, Joe W. Gray, Donna G. Albertson
fields	https://openalex.org/fields/11	https://openalex.org/W2729191089		1988	Menke Kh
fields	https://openalex.org/fields/11	https://openalex.org/W2082598566	https://doi.org/10.1111/j.1469-185x.1966.tb01624.x	1966	Stephen Jay Gould
fields	https://openalex.org/fields/11	https://openalex.org/W2119658459	https://doi.org/10.1146/annurev.es.15.110184.002033	1984	Wayne P. Sousa
fields	https://openalex.org/fields/11	https://openalex.org/W2034357419	https://doi.org/10.1126/science.277.5329.1063	1997	Steven D. Tanksley, Susan R. McCouch
fields	https://openalex.org/fields/11	https://openalex.org/W2072692157	https://doi.org/10.1016/j.mimet.2005.03.018	2005	Alessandra Carattoli, Alessia Bertini, Laura Villa, Vincenzo Falbo, Katie L. Hopkins, E. John Threlfall
fields	https://openalex.org/fields/11	https://openalex.org/W2136596893	https://doi.org/10.1098/rstb.2007.2184	2007	Pete Smith, Daniel Martino, Zucong Cai, D. M. Gwary, H. H. Janzen, Pushpam Kumar, Bruce A. McCarl, Stephen M. Ogle, F.P. O’Mara, Charles W. Rice, Robert J. Scholes, O. D. Sirotenko, Mark Howden, Tim A. McAllister, Genxing Pan, Vladimir Romanenkov, Uwe A. Schneider, Sirintornthep Towprayoon, M. Wattenbach, Jo Smith
fields	https://openalex.org/fields/11	https://openalex.org/W2140862057	https://doi.org/10.1016/j.ecolmodel.2010.08.019	2010	Volker Grimm, Uta Berger, Donald L. DeAngelis, Gary Polhill, Jarl Giske, Steven F. Railsback
fields	https://openalex.org/fields/11	https://openalex.org/W2054600557	https://doi.org/10.1073/pnas.1414592112	2015	Joseph Edwards, Cameron Johnson, Christian Santos‐Medellín, Eugene Lurie, Natraj Kumar Podishetty, Srijak Bhatnagar, Jonathan A. Eisen, Venkatesan Sundaresan
fields	https://openalex.org/fields/11	https://openalex.org/W2144693286	https://doi.org/10.1126/science.1230200	2013	Lucas A. Garibaldi, Ingolf Steffan‐Dewenter, Rachael Winfree, Marcelo A. Aizen, Riccardo Bommarco, Saul A. Cunningham, Claire Kremen, Luísa G. Carvalheiro, Lawrence D. Harder, Ohad Afik, Ígnasi Bartomeus, Faye Benjamin, Virginie Boreux, Daniel P. Cariveau, Natacha P. Chacoff, Jan‐Hendrik Dudenhöffer, Breno Magalhães Freitas, Jaboury Ghazoul, Sarah S. Greenleaf, Juliana Hipólito, Andrea Holzschuh, Brad G. Howlett, Rufus Isaacs, Steven K. Javorek, Christina M. Kennedy, Kristin M. Krewenka, Smitha Krishnan, Yael Mandelik, Margaret M. Mayfield, Iris Motzke, Théodore Munyuli, Brian A. Nault, Mark Otieno, Jessica D. Petersen, Gideon Pisanty, Simon G. Potts, Romina Rader, Taylor H. Ricketts, Maj Rundlöf, Colleen L. Seymour, Christof Schüepp, Hajnalka Szentgyörgyi, Hisatomo Taki, Teja Tscharntke, Carlos Vergara, Blandina Felipe Viana, Thomas Cherico Wanger, Catrin Westphal, Neal M. Williams, Alexandra‐Maria Klein
fields	https://openalex.org/fields/11	https://openalex.org/W2752080353	https://doi.org/10.15468/lysaex	2016	Leslie Honey
fields	https://openalex.org/fields/11	https://openalex.org/W2079378073	https://doi.org/10.1126/science.277.5328.955	1997	Toru Nakamura, Gregg B. Morin, Karen Chapman, Scott L. Weinrich, William H. Andrews, Joachim Lingner, Calvin B. Harley, Thomas R. Cech
fields	https://openalex.org/fields/11	https://openalex.org/W1581830689		1997	Richard Karban, Ian T. Baldwin
fields	https://openalex.org/fields/11	https://openalex.org/W3147934212		1998	Patricia K. Holmgren
fields	https://openalex.org/fields/11	https://openalex.org/W156146614	https://doi.org/10.1007/978-3-642-60458-4_21	1997	Kenneth J. Sytsma, William J. Hahn
fields	https://openalex.org/fields/11	https://openalex.org/W1567692432	https://doi.org/10.5860/choice.44-0035	2006	Reay H. N. Smithers
fields	https://openalex.org/fields/11	https://openalex.org/W2143014195	https://doi.org/10.1146/annurev.phyto.050908.135202	2009	A. Corina Vlot, D’Maris Amick Dempsey, Daniel F. Klessig
fields	https://openalex.org/fields/11	https://openalex.org/W2153640166	https://doi.org/10.1111/j.1944-8287.2003.tb00220.x	2003	W. Neil Adger
fields	https://openalex.org/fields/11	https://openalex.org/W2004255104	https://doi.org/10.1086/208674	1977	Harold H. Kassarjian
fields	https://openalex.org/fields/11	https://openalex.org/W2171787842	https://doi.org/10.1038/nrg1348	2004	Hans Ellegren
fields	https://openalex.org/fields/11	https://openalex.org/W2139610873	https://doi.org/10.1890/03-8002	2004	Joshua P. Schimel, Jennifer Bennett
fields	https://openalex.org/fields/11	https://openalex.org/W2030017358	https://doi.org/10.1038/313277a0	1985	Lee Ratner, William A. Haseltine, Roberto Patarca, Kenneth J. Livak, B Starcich, Steven F. Josephs, Ellen R. Doran, J. Antoni Rafalski, Erik A. Whitehorn, Kirk Baumeister, Lucinda A. Ivanoff, Stephen R. Petteway, Mark Pearson, James A. Lautenberger, Takis S. Papas, John Ghrayeb, Nancy Chang, Robert C. Gallo, Flossie Wong‐Staal
fields	https://openalex.org/fields/11	https://openalex.org/W2202180915		1962	Aaron H. Anton, David F. Sayre
fields	https://openalex.org/fields/11	https://openalex.org/W2273605253		1993	Robert E. Ricklefs, Dolph Schluter
fields	https://openalex.org/fields/11	https://openalex.org/W2097607146	https://doi.org/10.1146/annurev.ecolsys.28.1.289	1997	Gary A. Polis, Wendy B. Anderson, Robert D. Holt
fields	https://openalex.org/fields/11	https://openalex.org/W1967543716	https://doi.org/10.1016/s0092-8674(02)00863-2	2002	Matthew W. Rhoades, Brenda J. Reinhart, Lee P. Lim, Christopher B. Burge, Bonnie Bartel, David P. Bartel
fields	https://openalex.org/fields/11	https://openalex.org/W2037893757	https://doi.org/10.2136/sssaj1984.03615995004800060013x	1984	D. M. Linn, J. W. Doran
fields	https://openalex.org/fields/11	https://openalex.org/W3856834		1968	Sir H. G. Champion, S. K. Seth
fields	https://openalex.org/fields/11	https://openalex.org/W2029074727	https://doi.org/10.1016/0168-1923(91)90002-8	1991	G. J. Collatz, J. Timothy Ball, Cyril Grivet, J. A. Berry
fields	https://openalex.org/fields/11	https://openalex.org/W2092722122	https://doi.org/10.1080/01431168508948283	1985	P. J. Sellers
fields	https://openalex.org/fields/11	https://openalex.org/W2142329269	https://doi.org/10.1890/03-8006	2003	Bradford A. Hawkins, Richard Field, Howard V. Cornell, David J. Currie, Jean‐François Guégan, Dawn M. Kaufman, Jeremy T. Kerr, Gary G. Mittelbach, Thierry Oberdorff, Eileen M. O’Brien, Eric E. Porter, John R. G. Turner
fields	https://openalex.org/fields/11	https://openalex.org/W2168557059	https://doi.org/10.1146/annurev.genet.34.1.401	2000	Sarah P. Otto, Jeannette Whitton
fields	https://openalex.org/fields/11	https://openalex.org/W2093588915	https://doi.org/10.1016/0022-5193(66)90184-6	1966	W D Hamilton
fields	https://openalex.org/fields/11	https://openalex.org/W2002652493	https://doi.org/10.1073/pnas.78.6.3721	1981	Russell Lande
fields	https://openalex.org/fields/11	https://openalex.org/W2089441588	https://doi.org/10.2307/1936256	1969	Carl F. Jordan
fields	https://openalex.org/fields/11	https://openalex.org/W2199695484	https://doi.org/10.1038/nrmicro3569	2015	Kira S. Makarova, Yuri I. Wolf, Omer S. Alkhnbashi, Fabrizio Costa, Samir A. Shah, Sita J. Saunders, Rodolphe Barrangou, Stan J. J. Brouns, Emmanuelle Charpentier, Daniel H. Haft, Philippe Horvath, Sylvain Moineau, Francisco J. M. Mojica, Rebecca M. Terns, Michael P. Terns, Malcolm F. White, Alexander F. Yakunin, Roger A. Garrett, John van der Oost, Rolf Backofen, Eugene V. Koonin
fields	https://openalex.org/fields/11	https://openalex.org/W2041230234	https://doi.org/10.1016/0038-0717(90)90046-3	1990	Jianzhao Wu, Rainer Georg Joergensen, B. Pommerening, R. Chaussod, Philip C. Brookes
fields	https://openalex.org/fields/11	https://openalex.org/W1504702575	https://doi.org/10.1017/9781316276259.010	2018	Rasmus Grønfeldt Winther
fields	https://openalex.org/fields/11	https://openalex.org/W2011652298	https://doi.org/10.2134/agronj1959.00021962005100090002x	1959	Douglas R. Dewey, Kai Lu
fields	https://openalex.org/fields/11	https://openalex.org/W2137751722	https://doi.org/10.1007/978-3-642-87925-8	1982	Leendert van der Pijl
fields	https://openalex.org/fields/11	https://openalex.org/W2006802554	https://doi.org/10.1086/652373	2010	Mark Vellend
fields	https://openalex.org/fields/11	https://openalex.org/W2014313900	https://doi.org/10.1073/pnas.0308709101	2004	Seung Hee Yoo, Shin Yamazaki, Phillip L. Lowrey, Kazuhiro Shimomura, Caroline H. Ko, Ethan D. Buhr, Sandra M. Siepka, Hee-Kyung Hong, Won Jun Oh, Ook Joon Yoo, Michael Menaker, Joseph S. Takahashi
fields	https://openalex.org/fields/11	https://openalex.org/W2106173155	https://doi.org/10.1056/nejmoa1304459	2013	Rongbao Gao, Bin Cao, Yunwen Hu, Zijian Feng, Dayan Wang, Wanfu Hu, Jian Chen, Zhijun Jie, Haibo Qiu, Ke Xu, Xuewei Xu, Hongzhou Lu, Wenfei Zhu, Zhancheng Gao, Nijuan Xiang, Yinzhong Shen, Zebao He, Yong Gu, Zhi-Yong Zhang, Yi Yang, Xiang Zhao, Lei Zhou, Xiaodan Li, Shumei Zou, Ye Zhang, Xiyan Li, Lei Yang, Junfeng Guo, Jie Dong, Qun Li, Libo Dong, Yun Zhu, Tian Bai, Shiwen Wang, Pei Hao, Weizhong Yang, Yanping Zhang, Jun Han, Hongjie Yu, Dexin Li, George F. Gao, Guizhen Wu, Yong‐Min Liang, Zhenghong Yuan, Yuelong Shu
fields	https://openalex.org/fields/11	https://openalex.org/W2052289430	https://doi.org/10.1038/298156a0	1982	W. M. Post, William R. Emanuel, Paul J. Zinke, Alan G. Stangenberger
fields	https://openalex.org/fields/11	https://openalex.org/W2157039533	https://doi.org/10.1016/j.molcel.2004.05.027	2004	Matthew W. Jones-Rhoades, David P. Bartel
fields	https://openalex.org/fields/11	https://openalex.org/W2175094144	https://doi.org/10.1093/bioinformatics/btv681	2015	Michael Richter, Ramon Rosselló‐Móra, Frank Oliver Glöckner, Jörg Peplies
fields	https://openalex.org/fields/11	https://openalex.org/W2106276251	https://doi.org/10.1111/j.1461-0248.2008.01250.x	2008	Jason M. Tylianakis, Raphaël K. Didham, Jordi Bascompte, David A. Wardle
fields	https://openalex.org/fields/11	https://openalex.org/W2121955404	https://doi.org/10.1098/rstb.1996.0112	1996	J. L. Hamrick, Mary Jo W. Godt
fields	https://openalex.org/fields/11	https://openalex.org/W2039810102	https://doi.org/10.2307/3817	1977	T. R. E. Southwood
fields	https://openalex.org/fields/11	https://openalex.org/W2099721226	https://doi.org/10.1146/annurev.pp.29.060178.002455	1978	C. D. Foy, R. L. Chaney, Mary C. White
fields	https://openalex.org/fields/11	https://openalex.org/W2015884448	https://doi.org/10.1055/s-2006-957563	1998	J.N. Eloff
fields	https://openalex.org/fields/11	https://openalex.org/W2078394714	https://doi.org/10.1016/s0098-8472(98)00058-6	1999	Luigi Sanità di Toppi, R. Gabbrielli
fields	https://openalex.org/fields/11	https://openalex.org/W2321165182	https://doi.org/10.2307/2260471	1988	F. Stuart Chapin, T. J. Givinish
fields	https://openalex.org/fields/11	https://openalex.org/W1525882651	https://doi.org/10.5860/choice.40-2771	2003	F. Stuart Chapin, Pamela A. Matson, Peter M. Vitousek
fields	https://openalex.org/fields/11	https://openalex.org/W1967574201	https://doi.org/10.2981/0909-6396(2006)12[450:oeamip]2.0.co;2	2006	Nigel G. Yoccoz
fields	https://openalex.org/fields/11	https://openalex.org/W2105003778	https://doi.org/10.1111/j.1461-0248.2006.00924.x	2006	Owen L. Petchey, Kevin J. Gaston
fields	https://openalex.org/fields/11	https://openalex.org/W2128175005	https://doi.org/10.1146/annurev.arplant.47.1.377	1996	Jonathan Ingram, Dorothea Bartels
fields	https://openalex.org/fields/11	https://openalex.org/W2131842864	https://doi.org/10.1007/s00265-010-1037-6	2010	Matthew R. E. Symonds, Adnan Moussalli
fields	https://openalex.org/fields/11	https://openalex.org/W2266877935		1989	A. J. M. Baker, Robert R. Brooks
fields	https://openalex.org/fields/11	https://openalex.org/W2319020379	https://doi.org/10.1093/besa/17.4.288	1971	Robert W. Matthews
fields	https://openalex.org/fields/11	https://openalex.org/W1995444885	https://doi.org/10.1038/35107108	2001	Mary C. Wildermuth, Julia Dewdney, Gang Wu, Frederick M. Ausubel
fields	https://openalex.org/fields/11	https://openalex.org/W2144653885	https://doi.org/10.1016/s0168-1923(02)00109-0	2002	Kell Wilson, A. H. Goldstein, Eva Falge, Marc Aubinet, Dennis Baldocchi, Paul Berbigier, Christian Bernhofer, R. Ceulemans, A. J. Dolman, Chris Field, Achim Grelle, Andreas Ibrom, B. E. Law, Andrew S. Kowalski, Tilden P. Meyers, John Moncrieff, R. K. Monson, Walter C. Oechel, John Tenhunen, Riccardo Valentini, Shashi B. Verma
fields	https://openalex.org/fields/11	https://openalex.org/W2114439125	https://doi.org/10.1016/j.ultsonch.2010.11.023	2010	Farid Chemat, Zill-e-Huma, Muhammad Kamran Khan
fields	https://openalex.org/fields/11	https://openalex.org/W1543889784		1992	Robert Chambers, Gordon Conway
fields	https://openalex.org/fields/11	https://openalex.org/W1575125165	https://doi.org/10.1016/0378-1119(90)90073-z	1990	A. H. D. Brown, M. T. Clegg, A. L. Kahler, B. S. Weir
fields	https://openalex.org/fields/11	https://openalex.org/W643035040		1985	David M. Glover
fields	https://openalex.org/fields/11	https://openalex.org/W2043676058	https://doi.org/10.1038/nature05960	2007	Bryan Thines, Leron Katsir, Maeli Melotto, Yajie Niu, Ajin Mandaokar, Guang‐Hui Liu, Kinya Nomura, Sheng Yang He, Gregg A. Howe, John Browse
fields	https://openalex.org/fields/11	https://openalex.org/W2083096725	https://doi.org/10.1021/jf60217a041	1978	K. N. Pearce, John Kinsella
fields	https://openalex.org/fields/11	https://openalex.org/W1995548542	https://doi.org/10.1097/00010694-200004000-00001	2000	Karsten Kalbitz, Stephan Solinger, J.-H. Park, Beate Michalzik, Egbert Matzner
fields	https://openalex.org/fields/11	https://openalex.org/W2003604861	https://doi.org/10.1104/pp.110.155119	2010	Ruben Vanholme, Brecht Demedts, Kris Morreel, John Ralph, Wout Boerjan
fields	https://openalex.org/fields/11	https://openalex.org/W4243821215	https://doi.org/10.1038/019118a0	1878	E. P. W.
fields	https://openalex.org/fields/11	https://openalex.org/W1998663807	https://doi.org/10.1073/pnas.89.21.10114	1992	Richard Allsopp, Homayoun Vaziri, Cam Patterson, Samuel Goldstein, Edwardv . Younglai, A. B. Futcher, Carol W. Greider, Calvin B. Harley
fields	https://openalex.org/fields/11	https://openalex.org/W2072627116	https://doi.org/10.2136/sssaj1986.03615995005000030017x	1986	Edward T. Elliott
fields	https://openalex.org/fields/11	https://openalex.org/W2016006311	https://doi.org/10.1073/pnas.0403720101	2004	Shaobing Peng, Jianliang Huang, J. E. SHEEHY, Rebecca C. Laza, R. M. Visperas, Xuhua Zhong, Grace S. Centeno, G. S. Khush, Kenneth G. Cassman
fields	https://openalex.org/fields/11	https://openalex.org/W2141075017	https://doi.org/10.1038/21181	1999	Camille Parmesan, Nils Ryrholm, Constantí Stefanescu, Jane K. Hill, Chris D. Thomas, Henri Descimon, Brian Huntley, Lauri Kaila, Jaakko Kullberg, Toomas Tammaru, W. John Tennent, Jeremy A. Thomas, M. S. Warren
fields	https://openalex.org/fields/11	https://openalex.org/W2549442499		1981	Shouichi Yoshida
fields	https://openalex.org/fields/11	https://openalex.org/W2072883743	https://doi.org/10.1104/pp.43.8.1185	1968	R. W. F. Hardy, R. D. Holsten, E. K. Jackson, R. C. Burns
fields	https://openalex.org/fields/11	https://openalex.org/W1713265338	https://doi.org/10.1017/cbo9780511845727	2013	H. G. Jones
fields	https://openalex.org/fields/11	https://openalex.org/W2094199486	https://doi.org/10.1016/0031-9422(91)83426-l	1991	Augustin Scalbert
fields	https://openalex.org/fields/11	https://openalex.org/W2084229951	https://doi.org/10.1016/j.foodchem.2008.09.001	2008	Araceli Castañeda‐Ovando, Ma de Lourdes Pacheco-Hernández, María Elena Páez-Hernández, José A. Rodrı́guez, Carlos Andrés Galán-Vidal
fields	https://openalex.org/fields/11	https://openalex.org/W2015032635	https://doi.org/10.1007/s10021-003-0161-9	2003	Michael E. McClain, Elizabeth W. Boyer, C. Lisa Dent, Sarah E. Gergel, Nancy B. Grimm, Peter M. Groffman, Stephen C. Hart, Judson W. Harvey, Carol A. Johnston, Emilio Mayorga, William H. McDowell, Gilles Pinay
fields	https://openalex.org/fields/11	https://openalex.org/W2118537438	https://doi.org/10.1128/aem.63.10.3741-3751.1997	1997	Ian Wilson
fields	https://openalex.org/fields/11	https://openalex.org/W2506364346		1997	E. Malavolta, Godofredo César Vitti, Sebastião Alberto de Oliveira
fields	https://openalex.org/fields/11	https://openalex.org/W2004220201	https://doi.org/10.1016/s0001-8686(02)00069-6	2003	Robert Aveyard, Bernard P. Binks, John H. Clint
fields	https://openalex.org/fields/11	https://openalex.org/W2055843776	https://doi.org/10.3897/phytokeys.12.2849	2012	Wouter Van Landuyt, Léo Vanhecke, Dimitri Brosens
fields	https://openalex.org/fields/11	https://openalex.org/W2134351926	https://doi.org/10.1126/science.1060391	2001	David Tilman, Peter B. Reich, Johannes M. H. Knops, David A. Wedin, Troy Mielke, Clarence Lehman
fields	https://openalex.org/fields/11	https://openalex.org/W1973453874	https://doi.org/10.1093/aob/mci083	2005	Andrew W. Woodward
fields	https://openalex.org/fields/11	https://openalex.org/W2037695354		1986	Peter Whitehead
fields	https://openalex.org/fields/11	https://openalex.org/W1551604414	https://doi.org/10.1002/047147844x.sw2162	2004	Lewis M. Cowardin, Virginia Carter, Francis C. Golet, Edward T. LaRoe
fields	https://openalex.org/fields/11	https://openalex.org/W2065069831	https://doi.org/10.1038/nature04795	2006	Neil M. Ferguson, Derek A. T. Cummings, Christophe Fraser, James Cajka, Philip C. Cooley, Donald S. Burke
fields	https://openalex.org/fields/11	https://openalex.org/W2783981376	https://doi.org/10.1038/nrmicro1273	2005	Paul D. Cotter, Colin Hill, R. Paul Ross
fields	https://openalex.org/fields/11	https://openalex.org/W1941424948	https://doi.org/10.1093/ajcn/61.6.1402s	1995	W C Willett, F. Sacks, Antonia Trichopoulou, Greg Drescher, A Ferro-Luzzi, Elisabet Helsing, D. Trichopoulos
fields	https://openalex.org/fields/11	https://openalex.org/W2035178202	https://doi.org/10.1021/ac60139a005	1958	Stanford Moore, D. Spackman, William H. Stein
fields	https://openalex.org/fields/11	https://openalex.org/W2102628698	https://doi.org/10.1128/mmbr.62.3.597-635.1998	1998	Mala B. Rao, Aparna M. Tanksale, Mohini S. Ghatge, Vasanti Deshpande
fields	https://openalex.org/fields/11	https://openalex.org/W1568438607	https://doi.org/10.1016/c2013-0-08103-0	1965	M. A. Amerine, Rose Marie Pangborn, Edward B. Roessler
fields	https://openalex.org/fields/11	https://openalex.org/W2095478872	https://doi.org/10.1016/j.sjbs.2014.12.001	2014	Pooja Shrivastava, Rajesh Kumar
fields	https://openalex.org/fields/11	https://openalex.org/W2170402252	https://doi.org/10.1146/annurev.arplant.59.032607.092825	2007	Gregg A. Howe, Georg Jander
fields	https://openalex.org/fields/11	https://openalex.org/W2059643569	https://doi.org/10.1016/s0009-8981(03)00003-2	2003	Isabella Dalle‐Donne, Ranieri Rossi, Daniela Giustarini, Aldo Milzani, Roberto Colombo
fields	https://openalex.org/fields/11	https://openalex.org/W2137439980	https://doi.org/10.1016/s0169-5347(02)02495-3	2002	Katriona Shea
fields	https://openalex.org/fields/11	https://openalex.org/W2010461414	https://doi.org/10.1038/nrg2936	2011	Eric Huntzinger, Elisa Izaurralde
fields	https://openalex.org/fields/11	https://openalex.org/W4253512500	https://doi.org/10.1644/10-mamm-f-355.1	2011	Robert S. Sikes, William L. Gannon
fields	https://openalex.org/fields/11	https://openalex.org/W1975258901	https://doi.org/10.1111/j.1466-8238.2007.00287.x	2007	Joern Fischer, David B. Lindenmayer
fields	https://openalex.org/fields/11	https://openalex.org/W2094171166	https://doi.org/10.1590/s0036-36342006000600011	2006	Julio Frenk
fields	https://openalex.org/fields/11	https://openalex.org/W1482674833		1999	Harry T. Lawless, Hildegarde Heymann
fields	https://openalex.org/fields/11	https://openalex.org/W1980090141	https://doi.org/10.1038/nbt0595-468	1995	David E. Salt, Michael J. Blaylock, Nanda P.B.A. Kumar, Slavik Dushenkov, Burt D. Ensley, I. Chet, Ilya Raskin
