category	entry_id	openalex_id	doi	publication_year	authors
subfields	https://openalex.org/subfields/1710	https://openalex.org/W2101819268	https://doi.org/10.1145/1101908.1101949	2005	James A. Jones, Mary Jean Harrold
subfields	https://openalex.org/subfields/1710	https://openalex.org/W2122960384	https://doi.org/10.1145/224056.224076	1995	Dawson Engler, M. Frans Kaashoek, James W. O’Toole
subfields	https://openalex.org/subfields/1710	https://openalex.org/W2158342889	https://doi.org/10.1080/07421222.1990.11517898	1990	Jay F. Nunamaker, Minder Chen, Titus D. M. Purdin
subfields	https://openalex.org/subfields/1710	https://openalex.org/W2120072309	https://doi.org/10.1016/s0360-1315(01)00045-8	2001	W.J. Pelgrum
subfields	https://openalex.org/subfields/1710	https://openalex.org/W2131399871	https://doi.org/10.1109/mc.2003.1204375	2003	Craig Larman, Victor R. Basili
subfields	https://openalex.org/subfields/1710	https://openalex.org/W2768494752	https://doi.org/10.30997/dt.v2i1.302	2017	Omon Abdurakhman, Radif Khotamir Rusli
subfields	https://openalex.org/subfields/1710	https://openalex.org/W2100064951	https://doi.org/10.1007/978-3-540-24675-6_1	2004	Barry Boehm
subfields	https://openalex.org/subfields/1710	https://openalex.org/W2164988972	https://doi.org/10.1007/3-540-69053-0_18	1997	Victor Shoup
subfields	https://openalex.org/subfields/1710	https://openalex.org/W2105776892	https://doi.org/10.1109/tse.2008.35	2008	Stefan Lessmann, Bart Baesens, Christophe Mues, Swantje Pietsch
subfields	https://openalex.org/subfields/1710	https://openalex.org/W1538821400		1999	Alan Cooper
subfields	https://openalex.org/subfields/1710	https://openalex.org/W2054701320	https://doi.org/10.1109/tpds.2013.45	2013	Ning Cao, Cong Wang, Ming Li, Kui Ren, Wenjing Lou
subfields	https://openalex.org/subfields/1710	https://openalex.org/W2157034822	https://doi.org/10.1109/comst.2000.5340804	2000	Tyrone Grandison, Morris Sloman
subfields	https://openalex.org/subfields/1710	https://openalex.org/W1714132059	https://doi.org/10.1007/978-3-642-19193-0_7	2011	Dumitru Roman, Uwe Keller, Holger Lausen, Jos de Bruijn, Rubén Lara, Michael Stollberg, Axel Polleres, Cristina Feier, Cristoph Bussler, Dieter Fensel
subfields	https://openalex.org/subfields/1710	https://openalex.org/W2215376118	https://doi.org/10.1016/j.knosys.2015.06.015	2015	Kumar Ravi, Vadlamani Ravi
subfields	https://openalex.org/subfields/1710	https://openalex.org/W1498113315	https://doi.org/10.5860/choice.43-3080	2006	Melanie Killen, Judith G. Smetana
subfields	https://openalex.org/subfields/1710	https://openalex.org/W1994326726	https://doi.org/10.1145/1084805.1084812	2005	Yogesh Simmhan, Beth Plale, Dennis Gannon
subfields	https://openalex.org/subfields/1710	https://openalex.org/W2043508455	https://doi.org/10.1145/564691.564717	2002	Hakan Hacıgümüş, B. R. Iyer, Chen Li, Sharad Mehrotra
subfields	https://openalex.org/subfields/1710	https://openalex.org/W2140922128	https://doi.org/10.1007/978-3-540-74343-9_1	2009	David Garlan, Mary Shaw
subfields	https://openalex.org/subfields/1710	https://openalex.org/W2535104337	https://doi.org/10.1145/2976749.2978389	2016	Loi Luu, Viswesh Narayanan, Chaodong Zheng, Kunal Baweja, Seth Gilbert, Prateek Saxena
subfields	https://openalex.org/subfields/1710	https://openalex.org/W1526281128		2009	Jan vom Brocke, Alexander Simons, Björn Niehaves, Björn Niehaves, Kai Reimer, Ralf Plattfaut, Anne Cleven
subfields	https://openalex.org/subfields/1710	https://openalex.org/W2101746535	https://doi.org/10.1016/s0306-4573(02)00021-3	2002	Akiko Aizawa
subfields	https://openalex.org/subfields/1710	https://openalex.org/W96123121	https://doi.org/10.1023/a:1026131715856	2003	Rosemary E. Sutton, Karl F. Wheatley
subfields	https://openalex.org/subfields/1710	https://openalex.org/W1593874741		1997	Bertrand Meyer
subfields	https://openalex.org/subfields/1710	https://openalex.org/W2155482025		2009	Stephen Robertson, Hugo Zaragoza
subfields	https://openalex.org/subfields/1710	https://openalex.org/W1973309971	https://doi.org/10.1109/msp.2009.76	2009	Patrick McDaniel, Stephen McLaughlin
subfields	https://openalex.org/subfields/1710	https://openalex.org/W1995008247	https://doi.org/10.1145/197320.197383	1994	Barbara Liskov, Jeannette M. Wing
subfields	https://openalex.org/subfields/1710	https://openalex.org/W2016968870	https://doi.org/10.1006/jfin.1998.0255	1999	Ross Levine
subfields	https://openalex.org/subfields/1710	https://openalex.org/W2031163547	https://doi.org/10.1016/j.cose.2011.12.012	2012	Ali Shiravi, Hadi Shiravi, Mahbod Tavallaee, Ali A. Ghorbani
subfields	https://openalex.org/subfields/1710	https://openalex.org/W2040193872	https://doi.org/10.1145/1460877.1460889	2008	Giuseppe Ateniese, Roberto Di Pietro, Luigi V. Mancini, Gene Tsudik
subfields	https://openalex.org/subfields/1710	https://openalex.org/W2063355793	https://doi.org/10.1155/2008/579416	2008	Anil K. Jain, Karthik Nandakumar, Abhishek Nagar
subfields	https://openalex.org/subfields/1710	https://openalex.org/W2284666997		1999	Dimyati, Mudjiono
subfields	https://openalex.org/subfields/1710	https://openalex.org/W1513248649	https://doi.org/10.5860/choice.40-3447	2003	Louis Rosenfeld, Peter Morville
subfields	https://openalex.org/subfields/1710	https://openalex.org/W2030144199	https://doi.org/10.1145/223904.223929	1995	Will Hill, Larry Stead, Mark Rosenstein, George W. Furnas
subfields	https://openalex.org/subfields/1710	https://openalex.org/W2804558735		2005	Robert E. Slavin
subfields	https://openalex.org/subfields/1710	https://openalex.org/W2144651846	https://doi.org/10.1145/775152.775211	2003	Liangzhao Zeng, Boualem Benatallah, Marlon Dumas, Jayant Kalagnanam, Quan Z. Sheng
subfields	https://openalex.org/subfields/1710	https://openalex.org/W1483679765		1997	Mohammed J. Zaki, Srinivasan Parthasarathy, Mitsunori Ogihara, Li Wei
subfields	https://openalex.org/subfields/1710	https://openalex.org/W2250879510	https://doi.org/10.3115/v1/p14-1146	2014	Duyu Tang, Furu Wei, Nan Yang, Ming Zhou, Ting Liu, Bing Qin
subfields	https://openalex.org/subfields/1710	https://openalex.org/W2038412523	https://doi.org/10.1145/2723372.2742797	2015	Michael Armbrust, Reynold Xin, Cheng Lian, Yin Huai, Davies Liu, Joseph K. Bradley, Xiangrui Meng, Tomer Kaftan, Michael J. Franklin, Ali Ghodsi, Matei Zaharia
subfields	https://openalex.org/subfields/1710	https://openalex.org/W3118485687	https://doi.org/10.1162/tacl_a_00349	2020	Anna Rogers, Olga Kovaleva, Anna Rumshisky
subfields	https://openalex.org/subfields/1710	https://openalex.org/W3213422946		1979	Alain Albrecht
subfields	https://openalex.org/subfields/1710	https://openalex.org/W2152505375	https://doi.org/10.1109/sp.1987.10001	1987	David D. Clark, David R. Wilson
subfields	https://openalex.org/subfields/1710	https://openalex.org/W1522500515	https://doi.org/10.1016/0967-0661(95)90062-4	1995	Watts S. Humphrey
subfields	https://openalex.org/subfields/1710	https://openalex.org/W2086578213	https://doi.org/10.2307/2548685	1935	Erich Schneider, F. Y. Edgeworth
subfields	https://openalex.org/subfields/1710	https://openalex.org/W2318940639	https://doi.org/10.1016/0011-684x(86)90240-6	1986	Sunil Vadera
subfields	https://openalex.org/subfields/1710	https://openalex.org/W2762041969	https://doi.org/10.1016/j.bushor.2017.09.003	2017	In Lee, Yong Jae Shin
subfields	https://openalex.org/subfields/1710	https://openalex.org/W1918878574		2001	Mary Beth Rosson, John M. Carroll
subfields	https://openalex.org/subfields/1710	https://openalex.org/W1935417991		2006	Gert Biesta
subfields	https://openalex.org/subfields/1710	https://openalex.org/W1994386233	https://doi.org/10.1007/bf00124891	1992	Whitfield Diffie, Paul C. van Oorschot, Michael J. Wiener
subfields	https://openalex.org/subfields/1710	https://openalex.org/W2795321837	https://doi.org/10.1080/07421222.2018.1440766	2018	Peter Gomber, Robert J. Kauffman, Chris Parker, Bruce W. Weber
subfields	https://openalex.org/subfields/1710	https://openalex.org/W2526568049	https://doi.org/10.1016/j.frl.2016.09.025	2016	Elie Bouri, Péter Molnár, Georges Azzi, David Roubaud, Lars Ivar Hagfors
subfields	https://openalex.org/subfields/1710	https://openalex.org/W647049502		1982	Andrew W. Ellis
subfields	https://openalex.org/subfields/1710	https://openalex.org/W1526182533	https://doi.org/10.1007/0-387-28980-1	2005	Geert Molenberghs, Geert Verbeke, An Conny, Jasper Godewina, Aart Lien
subfields	https://openalex.org/subfields/1710	https://openalex.org/W2140254662	https://doi.org/10.1111/j.1467-9701.2006.00758.x	2006	Elizabeth Asiedu
subfields	https://openalex.org/subfields/1710	https://openalex.org/W2141992894	https://doi.org/10.1145/2741948.2741964	2015	Abhishek Verma, Luis Pedrosa, Madhukar Korupolu, David Oppenheimer, Eric Tune, John Wilkes
subfields	https://openalex.org/subfields/1710	https://openalex.org/W2949835970	https://doi.org/10.1109/ccgrid.2001.923162	2005	Ian Foster
subfields	https://openalex.org/subfields/1710	https://openalex.org/W1597561788		1996	Hannu Toivonen
subfields	https://openalex.org/subfields/1710	https://openalex.org/W174342562		1999	Eric Margolis, Stephen Laurence
subfields	https://openalex.org/subfields/1710	https://openalex.org/W1971605365	https://doi.org/10.1090/s0025-5718-1987-0866113-7	1987	Peter L. Montgomery
subfields	https://openalex.org/subfields/1710	https://openalex.org/W2049624350	https://doi.org/10.1109/tse.1984.5010301	1984	Victor R. Basili, David M. Weiss
subfields	https://openalex.org/subfields/1710	https://openalex.org/W2137125422	https://doi.org/10.1016/j.intcom.2010.07.003	2010	Gordon Baxter, Ian Sommerville
subfields	https://openalex.org/subfields/1710	https://openalex.org/W2161349318	https://doi.org/10.1023/a:1007608224229	2000	Tjen-Sien Lim, Wei‐Yin Loh, Yu‐Shan Shih
subfields	https://openalex.org/subfields/1710	https://openalex.org/W3142333173	https://doi.org/10.1007/0-387-34799-2_25	1990	David Chaum, Amos Fiat, Moni Naor
subfields	https://openalex.org/subfields/1710	https://openalex.org/W2139440703	https://doi.org/10.17487/rfc2598	1999	Van Jacobson, Kathleen Nichols, Kedarnath Poduri
subfields	https://openalex.org/subfields/1710	https://openalex.org/W1486172410	https://doi.org/10.1017/9781108974073.004	2021	Ralf Bierig, Stephen Brown, Edgar Galván, Joe Timoney
subfields	https://openalex.org/subfields/1710	https://openalex.org/W2110143060	https://doi.org/10.1109/tse.2009.67	2009	Daniel L. Moody
subfields	https://openalex.org/subfields/1710	https://openalex.org/W2119587968	https://doi.org/10.2307/249551	1998	Detmar W. Straub, Richard J. Welke
subfields	https://openalex.org/subfields/1710	https://openalex.org/W2002934700	https://doi.org/10.1145/96267.96279	1990	Barton P. Miller, Lars Fredriksen, Bryan So
subfields	https://openalex.org/subfields/1710	https://openalex.org/W2168217134	https://doi.org/10.1186/1472-6947-12-67	2012	Abu Saleh Mohammad Mosa, Illhoi Yoo, Lincoln Sheets
subfields	https://openalex.org/subfields/1710	https://openalex.org/W3129601704		1978	Tom DeMarco
subfields	https://openalex.org/subfields/1710	https://openalex.org/W4237685485	https://doi.org/10.1007/978-0-387-75969-2	2008	Deepayan Sarkar
subfields	https://openalex.org/subfields/1710	https://openalex.org/W2128967738	https://doi.org/10.1016/j.is.2010.01.001	2010	David Benavides, Sergio Segura, Antonio Ruiz‐Cortés
subfields	https://openalex.org/subfields/1710	https://openalex.org/W1659289657	https://doi.org/10.1007/978-3-540-30581-1_5	2005	Jinghai Rao, Xiaomeng Su
subfields	https://openalex.org/subfields/1710	https://openalex.org/W1879587332		1996	Alon Y. Levy, Anand Rajaraman, Joann J. Ordille
subfields	https://openalex.org/subfields/1710	https://openalex.org/W1538499489		1997	Linda Darling‐Hammond
subfields	https://openalex.org/subfields/1710	https://openalex.org/W1835740130	https://doi.org/10.1007/978-3-540-78246-9_38	2008	Michael R. Berthold, Nicolas Cebron, Fabian Dill, Thomas R. Gabriel, Tobias Kötter, Thorsten Meinl, Peter Ohl, Christoph Sieb, Kilian Thiel, Bernd Wiswedel
subfields	https://openalex.org/subfields/1710	https://openalex.org/W2740168486	https://doi.org/10.18653/v1/w17-1101	2017	Anna Grau Schmidt, Michael Wiegand
subfields	https://openalex.org/subfields/1710	https://openalex.org/W2045749853	https://doi.org/10.1109/proc.1980.11805	1980	M. M. Lehman
subfields	https://openalex.org/subfields/1710	https://openalex.org/W1979493600	https://doi.org/10.1109/tpds.2015.2401003	2015	Zhihua Xia, Xinhui Wang, Xingming Sun, Qian Wang
subfields	https://openalex.org/subfields/1710	https://openalex.org/W2022710553	https://doi.org/10.1126/science.1160379	2008	Luis von Ahn, Benjamin Maurer, Colin McMillen, David Abraham, Manuel Blum
subfields	https://openalex.org/subfields/1710	https://openalex.org/W2131715540	https://doi.org/10.1109/cts.2013.6567202	2013	Şeref Sağıroğlu, Duygu Sinanç Terzi
subfields	https://openalex.org/subfields/1710	https://openalex.org/W1987873266	https://doi.org/10.1016/s0022-5371(66)80044-0	1966	Murray Glanzer, Anita R. Cunitz
subfields	https://openalex.org/subfields/1710	https://openalex.org/W2010902645	https://doi.org/10.1057/ejis.2009.6	2009	Tejaswini Herath, H. Raghav Rao
subfields	https://openalex.org/subfields/1710	https://openalex.org/W2066149784	https://doi.org/10.1016/0263-7863(95)00093-3	1996	David Baccarini
subfields	https://openalex.org/subfields/1710	https://openalex.org/W2148540243	https://doi.org/10.1016/j.artint.2005.03.001	2005	Oren Etzioni, Michael Cafarella, Doug Downey, Ana-Maria Popescu, Tal Shaked, Stephen Soderland, Daniel S. Weld, Alexander Yates
subfields	https://openalex.org/subfields/1710	https://openalex.org/W3141989311	https://doi.org/10.1109/tse.2007.256941	2006	Tim Menzies, Jeremy Greenwald, Art Frank
subfields	https://openalex.org/subfields/1710	https://openalex.org/W1511886987	https://doi.org/10.1007/978-3-642-14992-4_13	2010	Seny Kamara, Kristin Lauter
subfields	https://openalex.org/subfields/1710	https://openalex.org/W1552647623		1990	Carroll Morgan
subfields	https://openalex.org/subfields/1710	https://openalex.org/W3127901954	https://doi.org/10.1177/016146810610800150	2006	Kevin Gary
subfields	https://openalex.org/subfields/1710	https://openalex.org/W2569214105	https://doi.org/10.1016/j.csbj.2016.12.005	2017	Ioannis Kavakiotis, O. Tsave, Athanasios Salifoglou, Nicos Maglaveras, Ioannis Vlahavas, Ioanna Chouvarda
subfields	https://openalex.org/subfields/1710	https://openalex.org/W2963323306	https://doi.org/10.1145/3077136.3080777	2017	Xiangnan He, Tat‐Seng Chua
subfields	https://openalex.org/subfields/1710	https://openalex.org/W3206746188	https://doi.org/10.17632/txbsw7sd2p.1	2021	Nguyễn Minh Sáng
subfields	https://openalex.org/subfields/1710	https://openalex.org/W4255535209	https://doi.org/10.1504/ijwgs.2018.10016848	2018	Huaimin Wang, Zibin Zheng, Shaoan Xie, Hong‐Ning Dai, Xiangping Chen
subfields	https://openalex.org/subfields/1710	https://openalex.org/W1511543899	https://doi.org/10.1145/944217.944233	2003	M. Papazoglou, Dimitrios Georgakopoulos
subfields	https://openalex.org/subfields/1710	https://openalex.org/W2101238481	https://doi.org/10.1007/978-3-642-28108-2_19	2012	Wil M. P. van der Aalst, Arya Adriansyah, Ana Karla Alves de Medeiros, Franco Arcieri, Thomas Baier, Tobias Blickle, Jagadeesh Chandra Bose, Peter van den Brand, Ronald Brandtjen, Joos C. A. M. Buijs, Andrea Burattin, Josep Carmona, Malú Castellanos, Jan Claes, Jonathan E. Cook, Nicola Costantini, Francisco Curbera, Ernesto Damiani, Massimiliano de Leoni, Pavlos Delias, Boudewijn F. van Dongen, Marlon Dumas, Schahram Dustdar, Dirk Fahland, Diogo R. Ferreira, Walid Gaaloul, Frank van Geffen, Sukriti Goel, Christian Günther, Antonella Guzzo, Paul Harmon, Arthur H. M. ter Hofstede, John L. Hoogland, Jon Espen Ingvaldsen, Koki Kato, Rudolf B. Kuhn, Akhil Kumar, Marcello La Rosa, Fabrizio Maria Maggi, Donato Malerba, Ronny S. Mans, Alberto Manuel, Martin McCreesh, Paola Mello, Jan Mendling, Marco Montali, Hamid Reza Motahari‐Nezhad, Michael zur Muehlen, Jorge Muñoz-Gama, Luigi Pontieri, Joël Ribeiro, A. Rozinat, Hugo Seguel Pérez, R.E. Seguel Pérez, Marcos Sepúlveda, Jim Sinur, Pnina Soffer, Minseok Song, Alessandro Sperduti, Giovanni Stilo, Casper Stoel, Keith D. Swenson, Maurizio Talamo, Wei Tan, Christopher Turner, Jan Vanthienen, George Varvaressos, Eric Verbeek, Marc Verdonk, Roberto Vigo, Jianmin Wang, Barbara Weber, Matthias Weidlich, Ton Weijters, Lijie Wen, Michael Westergaard, Moe Thandar Wynn
subfields	https://openalex.org/subfields/1710	https://openalex.org/W2126620275	https://doi.org/10.1287/mnsc.14.4.b147	1967	Russell L. Ackoff
subfields	https://openalex.org/subfields/1710	https://openalex.org/W3122507327		2019	Shuai Zhang, Lina Yao, Aixin Sun, Yi Tay
subfields	https://openalex.org/subfields/1710	https://openalex.org/W1597703625		2010	Dietmar Jannach, Markus Zanker, Alexander Felfernig, Gerhard Friedrich
subfields	https://openalex.org/subfields/1710	https://openalex.org/W4235532671	https://doi.org/10.31219/osf.io/cmv89	2021	Eravianti Eravianti
subfields	https://openalex.org/subfields/1710	https://openalex.org/W1551909886	https://doi.org/10.1007/978-3-540-30115-8_7	2004	Rehan Akbani, Stephen Kwek, Nathalie Japkowicz
subfields	https://openalex.org/subfields/1710	https://openalex.org/W2057248704	https://doi.org/10.1109/p2p.2013.6688704	2013	Christian Decker, Roger Wattenhofer
subfields	https://openalex.org/subfields/1710	https://openalex.org/W2102297485	https://doi.org/10.1145/1132960.1132963	2006	Liqiang Geng, Howard J. Hamilton
subfields	https://openalex.org/subfields/1710	https://openalex.org/W2119902448	https://doi.org/10.5334/2012-18	2012	John Daniel
subfields	https://openalex.org/subfields/1710	https://openalex.org/W2145255308	https://doi.org/10.1007/3-540-36178-2_34	2002	Craig Gentry, Alice Silverberg
subfields	https://openalex.org/subfields/1710	https://openalex.org/W2080320419	https://doi.org/10.1145/1557019.1557072	2009	Yehuda Koren
subfields	https://openalex.org/subfields/1710	https://openalex.org/W2124074197	https://doi.org/10.1145/146941.146942	1992	James J. Kistler, Mahadev Satyanarayanan
subfields	https://openalex.org/subfields/1710	https://openalex.org/W1625891438		2004	Abdul Chaer, Leonie Agustina
subfields	https://openalex.org/subfields/1710	https://openalex.org/W1755228850	https://doi.org/10.14742/ajet.1233	2008	Gregor Kennedy, Terry Judd, Anna Churchward, Kathleen Gray, Kerri‐Lee Krause
subfields	https://openalex.org/subfields/1710	https://openalex.org/W2069613886	https://doi.org/10.1002/aris.1440360102	2002	Christine L. Borgman, Jonathan Furner
subfields	https://openalex.org/subfields/1710	https://openalex.org/W2106639360	https://doi.org/10.1257/089533003769204344	2003	William Easterly
subfields	https://openalex.org/subfields/1710	https://openalex.org/W2318665975	https://doi.org/10.2307/3151989	1995	George R. Franke, Barbara M. Byrne
subfields	https://openalex.org/subfields/1710	https://openalex.org/W3144736497	https://doi.org/10.4135/9781544307763.n14	2014	Masami Nishishiba, Matthew W. Jones, Mariah Kraner
subfields	https://openalex.org/subfields/1710	https://openalex.org/W2013093146	https://doi.org/10.1109/tkde.2011.253	2011	Pavel Shvaiko, Jérôme Euzenat
subfields	https://openalex.org/subfields/1710	https://openalex.org/W4233110100	https://doi.org/10.2307/2065930	1978	James R. Beniger, John W. Tukey
subfields	https://openalex.org/subfields/1710	https://openalex.org/W2089194229	https://doi.org/10.1109/mcom.2015.7045396	2015	Bo Han, Vijay Gopalakrishnan, Lusheng Ji, Seungjoon Lee
subfields	https://openalex.org/subfields/1710	https://openalex.org/W4205774955	https://doi.org/10.1007/978-1-4302-0248-6_11	2007	
subfields	https://openalex.org/subfields/1710	https://openalex.org/W1489270652	https://doi.org/10.5860/choice.31-2158	1993	Starr Roxanne Hiltz, Murray Turoff
subfields	https://openalex.org/subfields/1710	https://openalex.org/W1583406525	https://doi.org/10.1598/0829	2011	S. Jay Samuels, Alan E. Farstrup
subfields	https://openalex.org/subfields/1710	https://openalex.org/W1797206029	https://doi.org/10.1007/3-540-45325-3_32	2001	Clifford Cocks
subfields	https://openalex.org/subfields/1710	https://openalex.org/W2150531367	https://doi.org/10.1145/58566.59297	1988	Jeff Conklin, Michael L. Begeman
subfields	https://openalex.org/subfields/1710	https://openalex.org/W2142340571	https://doi.org/10.1007/s10009-007-0038-x	2007	Kurt Jensen, Lars Michael Kristensen, Lisa Wells
subfields	https://openalex.org/subfields/1710	https://openalex.org/W2562836854		1996	Martin Ester, Hans‐Peter Kriegel, Jörg Sander, Xiaowei Xu
subfields	https://openalex.org/subfields/1710	https://openalex.org/W2626239712		2003	James A. Fitzsimmons, Mona J. Fitzsimmons
subfields	https://openalex.org/subfields/1710	https://openalex.org/W2981552608		2013	James Manyika, Michael Chui, Jacques Bughin, Richard Dobbs, Peter Bisson, Alex Marrs
subfields	https://openalex.org/subfields/1710	https://openalex.org/W1870146437	https://doi.org/10.2307/41409971	2011	Bélanger, Robert E. Crossler
subfields	https://openalex.org/subfields/1710	https://openalex.org/W1972793074	https://doi.org/10.1145/507533.507536	2001	K. Selçuk Candan, Huan Liu, Reshma Suvarna
subfields	https://openalex.org/subfields/1710	https://openalex.org/W2100958137	https://doi.org/10.1145/290941.290956	1998	Oren Zamir, Oren Etzioni
subfields	https://openalex.org/subfields/1710	https://openalex.org/W2121583048	https://doi.org/10.1016/j.pubrev.2009.01.006	2009	Richard D. Waters, Emily Burnett, Anna Lamm, Jessica Lucas
subfields	https://openalex.org/subfields/1710	https://openalex.org/W2975535563		1986	L. S. Schulman
subfields	https://openalex.org/subfields/1710	https://openalex.org/W2001914359	https://doi.org/10.1002/1097-024x(200009)30:11<1203::aid-spe338>3.3.co;2-e	2000	Emden R. Gansner, Stephen C. North
subfields	https://openalex.org/subfields/1710	https://openalex.org/W2058638038	https://doi.org/10.1145/203330.203345	1995	Robert E. Kraut, Lynn A. Streeter
subfields	https://openalex.org/subfields/1710	https://openalex.org/W4256358309	https://doi.org/10.2307/3340285	1978	John P. Fox, John W. Tukey, Donald R. McNeil, Bonnie H. Erickson, T. A. Nosanchuk
subfields	https://openalex.org/subfields/1710	https://openalex.org/W2114303224	https://doi.org/10.1145/1559845.1559865	2009	Andrew Pavlo, Erik K. Paulson, Alexander Rasin, Daniel J. Abadi, David J. DeWitt, Samuel Madden, Michael Stonebraker
subfields	https://openalex.org/subfields/1710	https://openalex.org/W2912486915		2011	Tom Heath, Christian Bizer, James Hendler
subfields	https://openalex.org/subfields/1710	https://openalex.org/W1541914996	https://doi.org/10.5860/choice.35-1634	1997	Robert J. Barro
subfields	https://openalex.org/subfields/1710	https://openalex.org/W2147131251	https://doi.org/10.1177/0165551508095781	2008	David Bawden, Lyn Robinson
subfields	https://openalex.org/subfields/1710	https://openalex.org/W1920715936	https://doi.org/10.1016/s0166-4115(08)x6006-6	1986	Raymond B. Cattell
subfields	https://openalex.org/subfields/1710	https://openalex.org/W2337969425	https://doi.org/10.1145/1364782.1364786	2008	Brian Hayes
subfields	https://openalex.org/subfields/1710	https://openalex.org/W3123643074	https://doi.org/10.1016/j.jce.2003.08.001	2003	Thorsten Beck, Aslı Demirgüç-Kunt, Ross Levine
subfields	https://openalex.org/subfields/1710	https://openalex.org/W4238998169	https://doi.org/10.1037/0033-295x.106.4.643	1999	Peter Pirolli, Stuart Card
subfields	https://openalex.org/subfields/1710	https://openalex.org/W1485431829	https://doi.org/10.1080/07421222.2001.11045670	2001	Michael J. Earl
subfields	https://openalex.org/subfields/1710	https://openalex.org/W2081917329	https://doi.org/10.1016/0164-1212(93)90077-b	1993	Wei Li, Sallie M. Henry
subfields	https://openalex.org/subfields/1710	https://openalex.org/W2164827649	https://doi.org/10.2307/249133	1988	Bonnie Kaplan, Dennis Duchon
subfields	https://openalex.org/subfields/1710	https://openalex.org/W2092709505	https://doi.org/10.1016/0883-9026(93)90011-s	1993	Scott Shane
subfields	https://openalex.org/subfields/1710	https://openalex.org/W2402235285	https://doi.org/10.1007/978-3-642-32009-5_38	2012	Ivan Damgård, Valerio Pastro, Nigel P. Smart, Sarah Zakarias
subfields	https://openalex.org/subfields/1710	https://openalex.org/W1741036149	https://doi.org/10.5860/choice.30-2812	1993	Martin V. Covington
subfields	https://openalex.org/subfields/1710	https://openalex.org/W4297971002	https://doi.org/10.1145/2872427.2883037	2016	Ruining He, Julian McAuley
subfields	https://openalex.org/subfields/1710	https://openalex.org/W2093456341	https://doi.org/10.1109/69.553164	1996	R. K. Agrawal, J.C. Shafer
subfields	https://openalex.org/subfields/1710	https://openalex.org/W2129289644		2009	Axel van Lamsweerde
subfields	https://openalex.org/subfields/1710	https://openalex.org/W2168810410	https://doi.org/10.1146/annurev.pp.21.060170.001513	1970	H. B. Tukey
subfields	https://openalex.org/subfields/1710	https://openalex.org/W3125577189	https://doi.org/10.1016/j.jdeveco.2008.10.005	2008	Paola Giuliano, Marta Ruiz-Arranz
subfields	https://openalex.org/subfields/1710	https://openalex.org/W1545131993		1988	Allan C. Ornstein, Francis P. Hunkins
subfields	https://openalex.org/subfields/1710	https://openalex.org/W2040367556	https://doi.org/10.1145/1864708.1864770	2010	James Davidson, Benjamin Liebald, Junning Liu, Palash Nandy, Taylor Van Vleet, Ullas Gargi, S. K. Gupta, Yu He, M.L. Lambert, Blake Livingston, Dasarathi Sampath
subfields	https://openalex.org/subfields/1710	https://openalex.org/W2099647042	https://doi.org/10.2307/25750691	2010	Allen C. Johnston, Merrill Warkentin
subfields	https://openalex.org/subfields/1710	https://openalex.org/W2606537796	https://doi.org/10.1109/jiot.2017.2694844	2017	Yuchen Yang, Longfei Wu, Guisheng Yin, Lijie Li, Hongbin Zhao
