category	entry_id	openalex_id	doi	publication_year	authors
subfields	https://openalex.org/subfields/1710	https://openalex.org/W2156438052	https://doi.org/10.1016/j.dss.2009.02.005	2009	Tejaswini Herath, H. Raghav Rao
subfields	https://openalex.org/subfields/1710	https://openalex.org/W2539781657	https://doi.org/10.1609/aaai.v30i1.9971	2016	Qiang Liu, Shu Wu, Liang Wang, Tieniu Tan
subfields	https://openalex.org/subfields/1710	https://openalex.org/W2897676665	https://doi.org/10.1145/3243734.3243853	2018	Mahdi Zamani, Mahnush Movahedi, Mariana Raykova
subfields	https://openalex.org/subfields/1710	https://openalex.org/W2903429044	https://doi.org/10.1016/j.ijinfomgt.2018.11.021	2018	Maciel M. Queiroz, Samuel Fosso Wamba
subfields	https://openalex.org/subfields/1710	https://openalex.org/W2072737419	https://doi.org/10.1145/1988042.1988044	2011	Vasanth Bala, Evelyn Duesterwald, Sanjeev Banerjia
subfields	https://openalex.org/subfields/1710	https://openalex.org/W46786753	https://doi.org/10.1007/978-3-540-77048-0	2007	Sihan Qing, Hideki Imai, Guilin Wang
subfields	https://openalex.org/subfields/1710	https://openalex.org/W1510940979	https://doi.org/10.1007/3-540-62852-5_4	1997	David M. Chess, Colin Harrison, Aaron Kershenbaum
subfields	https://openalex.org/subfields/1710	https://openalex.org/W2032401773	https://doi.org/10.1006/jpdc.1996.0107	1996	Robert D. Blumofe, Christopher F. Joerg, Bradley C. Kuszmaul, Charles E. Leiserson, Keith H. Randall, Yuli Zhou
subfields	https://openalex.org/subfields/1710	https://openalex.org/W2097425676	https://doi.org/10.1016/j.jdeveco.2008.06.006	2008	Badi H. Baltagi, Panicos Demetriades, Siong Hook Law
subfields	https://openalex.org/subfields/1710	https://openalex.org/W2123479684	https://doi.org/10.1109/secpri.2002.1004366	2005	Ninghui Li, John C. Mitchell, William H. Winsborough
subfields	https://openalex.org/subfields/1710	https://openalex.org/W2154797012	https://doi.org/10.1007/s00354-008-0081-5	2010	Lizhe Wang, Gregor von Laszewski, Andrew Younge, Xi He, M. Kunze, Jie Tao, Cheng Fu
subfields	https://openalex.org/subfields/1710	https://openalex.org/W1828171833	https://doi.org/10.1016/j.edurev.2008.02.003	2008	Charlotte Dignath, Gerhard Buettner, Hans‐Peter Langfeldt
subfields	https://openalex.org/subfields/1710	https://openalex.org/W2105300539	https://doi.org/10.1145/1134285.1134349	2006	Nachiappan Nagappan, Thomas Ball, Andreas Zeller
subfields	https://openalex.org/subfields/1710	https://openalex.org/W2133230560	https://doi.org/10.4337/9781845424602	2005	Christopher Green, Colin Kirkpatrick, Victor Murinde
subfields	https://openalex.org/subfields/1710	https://openalex.org/W2165621523	https://doi.org/10.1145/828.1884	1984	Michael L. Fredman, János Komlós, Endre Szemerédi
subfields	https://openalex.org/subfields/1710	https://openalex.org/W2907683311	https://doi.org/10.1109/access.2018.2890507	2019	Khaled Salah, Muhammad Habib ur Rehman, Nishara Nizamuddin, Ala Al‐Fuqaha
subfields	https://openalex.org/subfields/1710	https://openalex.org/W5293729		1994	Richard Edwards, Robin Usher
subfields	https://openalex.org/subfields/1710	https://openalex.org/W1527139820		2008	Tony Wagner
subfields	https://openalex.org/subfields/1710	https://openalex.org/W1572474464		1982	Daniel P. Siewiorek, Robert S. Swarz
subfields	https://openalex.org/subfields/1710	https://openalex.org/W1973747955	https://doi.org/10.1016/j.jpdc.2014.01.003	2014	Karthik Kambatla, Giorgos Kollias, Vipin Kumar, Ananth Grama
subfields	https://openalex.org/subfields/1710	https://openalex.org/W213307413	https://doi.org/10.1002/9781118996874	2015	P. Alex Linley, Stephen Joseph
subfields	https://openalex.org/subfields/1710	https://openalex.org/W2139889174	https://doi.org/10.1016/j.datak.2004.07.003	2004	Wil M. P. van der Aalst, Mathias Weske, Dolf Grünbauer
subfields	https://openalex.org/subfields/1710	https://openalex.org/W2167985173	https://doi.org/10.1016/j.is.2006.05.003	2006	Wil M. P. van der Aalst, Hajo A. Reijers, A.J.M.M. Weijters, Boudewijn F. van Dongen, Ana Karla Alves de Medeiros, Minseok Song, H. M. W. Verbeek
subfields	https://openalex.org/subfields/1710	https://openalex.org/W2170523074	https://doi.org/10.1145/357980.357989	1983	E. Dijkstra
subfields	https://openalex.org/subfields/1710	https://openalex.org/W1562749619	https://doi.org/10.1108/ws.2001.07950eaf.003	2001	David S. Linthicum
subfields	https://openalex.org/subfields/1710	https://openalex.org/W169646937	https://doi.org/10.5860/choice.40-1049	2002	Martin L. Maehr, John G. Nicholls
subfields	https://openalex.org/subfields/1710	https://openalex.org/W1996688136	https://doi.org/10.1037//0022-006x.56.5.754	1988	Andrew L. Comrey
subfields	https://openalex.org/subfields/1710	https://openalex.org/W2057763140	https://doi.org/10.1145/1721654.1721677	2010	Yehuda Koren
subfields	https://openalex.org/subfields/1710	https://openalex.org/W2122519137	https://doi.org/10.1109/32.481535	1996	Lionel Briand, Sandro Morasca, Victor R. Basili
subfields	https://openalex.org/subfields/1710	https://openalex.org/W2142481374	https://doi.org/10.1109/34.990140	2002	Dario Maio, Davide Maltoni, Raffaele Cappelli, James L. Wayman, Anil K. Jain
subfields	https://openalex.org/subfields/1710	https://openalex.org/W4233152543	https://doi.org/10.1002/9781118181034	2012	Per Runeson, Martin Höst, Austen Rainer, Björn Regnell
subfields	https://openalex.org/subfields/1710	https://openalex.org/W2511425482	https://doi.org/10.1109/access.2016.2597169	2016	Ke Zhang, Yuming Mao, Supeng Leng, Quanxin Zhao, Longjiang Li, Xin Peng, Pan Li, Sabita Maharjan, Yan Zhang
subfields	https://openalex.org/subfields/1710	https://openalex.org/W1559012732	https://doi.org/10.1007/3-540-28554-7	2005	Sami Beydeda, Matthias Book, Volker Gruhn
subfields	https://openalex.org/subfields/1710	https://openalex.org/W2030907583	https://doi.org/10.1108/k.2006.06735aae.001	2006	Barry Wilkinson, M.S. Allen
subfields	https://openalex.org/subfields/1710	https://openalex.org/W2058785578	https://doi.org/10.1145/1536414.1536461	2009	Chris Peikert
subfields	https://openalex.org/subfields/1710	https://openalex.org/W2151511199	https://doi.org/10.1109/tse.2007.3	2007	Magne Jørgensen, Martin Shepperd
subfields	https://openalex.org/subfields/1710	https://openalex.org/W2159938093	https://doi.org/10.1109/4236.877487	2000	Stefan Decker, Sergey Melnik, Frank van Harmelen, Dieter Fensel, Michel Klein, Jeen Broekstra, M. Erdmann, Ian Horrocks
subfields	https://openalex.org/subfields/1710	https://openalex.org/W1491233988	https://doi.org/10.21236/ada177198	1986	Sidney L. Smith, Jane N. Mosier
subfields	https://openalex.org/subfields/1710	https://openalex.org/W2144979178	https://doi.org/10.1109/tse.2004.9	2004	Simonetta Balsamo, Antinisca Di Marco, Paola Inverardi, Marta Simeoni
subfields	https://openalex.org/subfields/1710	https://openalex.org/W2929438235	https://doi.org/10.3390/healthcare7020056	2019	Cornelius C. Agbo, Qusay H. Mahmoud, Johan Eklund
subfields	https://openalex.org/subfields/1710	https://openalex.org/W2951001079	https://doi.org/10.48550/arxiv.1703.04247	2017	Huifeng Guo, Ruiming Tang, Yunming Ye, Zhenguo Li, Xiuqiang He
subfields	https://openalex.org/subfields/1710	https://openalex.org/W3106861604	https://doi.org/10.1016/j.ssaho.2020.100101	2021	T Muthuprasad, S Aiswarya, Aditya Korekallu Srinivasa, Girish Kumar Jha
subfields	https://openalex.org/subfields/1710	https://openalex.org/W2070242399	https://doi.org/10.1016/j.ejor.2015.04.002	2015	John Mingers, Loet Leydesdorff
subfields	https://openalex.org/subfields/1710	https://openalex.org/W2131126403	https://doi.org/10.1109/65.844498	2000	Martin Arlitt, Tai Jin
subfields	https://openalex.org/subfields/1710	https://openalex.org/W2171104838	https://doi.org/10.1016/b978-012088469-8.50035-8	2004	Xin Luna Dong, Alon Halevy, Jayant Madhavan, Ema Nemes, Jun Zhang
subfields	https://openalex.org/subfields/1710	https://openalex.org/W3106439716	https://doi.org/10.1145/3308558.3313417	2019	Hongwei Wang, Miao Zhao, Xing Xie, Wenjie Li, Minyi Guo
subfields	https://openalex.org/subfields/1710	https://openalex.org/W3123879804	https://doi.org/10.1017/s0007123400009790	1994	John F. Helliwell
subfields	https://openalex.org/subfields/1710	https://openalex.org/W4244726870	https://doi.org/10.1145/2666356.2594299	2014	Steven Arzt, Siegfried Rasthofer, Christian Fritz, Eric Bodden, Alexandre Bartel, Jacques Klein, Yves Le Traon, Damien Octeau, Patrick McDaniel
subfields	https://openalex.org/subfields/1710	https://openalex.org/W1537891716		2006	Thomas Stahl, Markus Voelter, Krzysztof Czarnecki
subfields	https://openalex.org/subfields/1710	https://openalex.org/W1576962511	https://doi.org/10.1007/bfb0014141	1996	Manish Mehta, Rakesh Agrawal, J. Rissanen
subfields	https://openalex.org/subfields/1710	https://openalex.org/W1967384977	https://doi.org/10.1007/s10270-005-0079-0	2005	Jean Bézivín
subfields	https://openalex.org/subfields/1710	https://openalex.org/W2045260557	https://doi.org/10.1214/aoms/1177732186	1939	M. G. Kendall, B. B. Smith
subfields	https://openalex.org/subfields/1710	https://openalex.org/W2087092764	https://doi.org/10.1145/1592451.1592452	2009	Kevin Hoffman, David Zage, Cristina Nita-Rotaru
subfields	https://openalex.org/subfields/1710	https://openalex.org/W2118518941	https://doi.org/10.1016/0020-7373(92)90039-n	1992	Peter G. Polson, Clayton Lewis, John Rieman, Cathleen Wharton
subfields	https://openalex.org/subfields/1710	https://openalex.org/W2164856000	https://doi.org/10.1016/s0306-4573(00)00051-0	2001	Ying Ding, Gobinda Chowdhury, Schubert Foo
subfields	https://openalex.org/subfields/1710	https://openalex.org/W1531910981	https://doi.org/10.1201/9781315373515	2018	Charų C. Aggarwal, Chandan K. Reddy
subfields	https://openalex.org/subfields/1710	https://openalex.org/W2029467255	https://doi.org/10.1145/2043556.2043571	2011	Brad Calder, Wang Ju, Aaron Ogus, Niranjan Nilakantan, Arild Skjolsvold, Sam McKelvie, Yikang Xu, Shashwat Srivastav, Jiesheng Wu, Huseyin Simitci, Jaidev Haridas, Chakravarthy Uddaraju, Hemal Khatri, Andrew Edwards, Vaman Bedekar, Shane Mainali, Rafay Abbasi, Arpit Agarwal, Mian Fahim ul Haq, Muhammad Ikram ul Haq, Deepali Bhardwaj, Sowmya Dayanand, Anitha Adusumilli, Marvin McNett, Sriram Sankaran, Kavitha Manivannan, Leonidas Rigas
subfields	https://openalex.org/subfields/1710	https://openalex.org/W2165949563	https://doi.org/10.1007/978-0-387-85820-3_5	2010	Yehuda Koren, Robert Bell
subfields	https://openalex.org/subfields/1710	https://openalex.org/W2296157284	https://doi.org/10.1145/775152.775250	2003	R. Guha, Rob McCool, Éric Miller
subfields	https://openalex.org/subfields/1710	https://openalex.org/W1511267087	https://doi.org/10.1007/978-1-4757-3304-4	2001	Natália Juristo, Ana M. Moreno
subfields	https://openalex.org/subfields/1710	https://openalex.org/W2015525779	https://doi.org/10.1016/j.joi.2009.01.003	2009	Rudy Prabowo, Mike Thelwall
subfields	https://openalex.org/subfields/1710	https://openalex.org/W2105470748	https://doi.org/10.17487/rfc2693	1999	Carl Ellison, Bill Frantz, Butler Lampson, Ronald L. Rivest, Brian A. Thomas, Tatu Ylönen
subfields	https://openalex.org/subfields/1710	https://openalex.org/W2115461474	https://doi.org/10.1145/988672.988687	2004	Oren Etzioni, Michael Cafarella, Doug Downey, Stanley Kok, Ana-Maria Popescu, Tal Shaked, Stephen Soderland, Daniel S. Weld, Alexander Yates
subfields	https://openalex.org/subfields/1710	https://openalex.org/W2128204165	https://doi.org/10.1109/tse.2004.24	2004	D. Richard Kuhn, Dolores R Wallace, Al Gallo
subfields	https://openalex.org/subfields/1710	https://openalex.org/W2128888088	https://doi.org/10.1109/tse.2007.70725	2007	Stefan Bellon, Rainer Koschke, G. Antoniol, Jens Krinke, Ettore Merlo
subfields	https://openalex.org/subfields/1710	https://openalex.org/W1482585805	https://doi.org/10.1007/11814771_26	2006	Dmitry Tsarkov, Ian Horrocks
subfields	https://openalex.org/subfields/1710	https://openalex.org/W2102397395	https://doi.org/10.1016/j.compedu.2009.07.010	2009	Guoyuan Sang, Martin Valcke, Johan van Braak, Jo Tondeur
subfields	https://openalex.org/subfields/1710	https://openalex.org/W2603080899		2005	Al Bahra Bin Ladjamudin
subfields	https://openalex.org/subfields/1710	https://openalex.org/W3207415189		2011	Bruce Joyce, Marsha Weil, Emily Calhoun
subfields	https://openalex.org/subfields/1710	https://openalex.org/W1965667542	https://doi.org/10.1145/1361684.1361686	2008	H. C. Wu, Robert W. P. Luk, Kam‐Fai Wong, K. L. Kwok
subfields	https://openalex.org/subfields/1710	https://openalex.org/W2012656354	https://doi.org/10.1287/isre.13.4.363.69	2002	Yair Wand, Ron Weber
subfields	https://openalex.org/subfields/1710	https://openalex.org/W2055487721	https://doi.org/10.1287/mnsc.45.3.425	1999	Thomas W. Malone, Kevin Crowston, Jintae Lee, Brian T. Pentland, Chrysanthos Dellarocas, George M. Wyner, John Quimby, Charles S. Osborn, Abraham Bernstein, George Herman, Mark Klein, Elissa O'Donnell
subfields	https://openalex.org/subfields/1710	https://openalex.org/W2066771339	https://doi.org/10.1016/s0306-4379(99)00003-4	1999	Nicolas Pasquier, Yves Bastide, Rafik Taouil, Lotfi Lakhal
subfields	https://openalex.org/subfields/1710	https://openalex.org/W2071058905	https://doi.org/10.1145/285070.285080	1998	Stephen R. Gardner
subfields	https://openalex.org/subfields/1710	https://openalex.org/W3012871709	https://doi.org/10.1145/3366423.3380027	2020	Ziniu Hu, Yuxiao Dong, Kuansan Wang, Yizhou Sun
subfields	https://openalex.org/subfields/1710	https://openalex.org/W4246712142	https://doi.org/10.17487/rfc2327	1998	Mark Handley, V. Jacobson
subfields	https://openalex.org/subfields/1710	https://openalex.org/W85821518	https://doi.org/10.1086/602864	1996	Gloria J. Leckie, Karen E. Pettigrew, Christian Sylvain
subfields	https://openalex.org/subfields/1710	https://openalex.org/W1578415644		2004	Timothy G. Mattson, Beverly A. Sanders, Berna L. Massingill
subfields	https://openalex.org/subfields/1710	https://openalex.org/W1978690967	https://doi.org/10.1145/954339.954341	2003	Stefan Podlipnig, László Böszörményi
subfields	https://openalex.org/subfields/1710	https://openalex.org/W2033150565	https://doi.org/10.1057/palgrave.jibs.8400223	2006	Alvaro Cuervo‐Cazurra
subfields	https://openalex.org/subfields/1710	https://openalex.org/W4245266864	https://doi.org/10.1109/focs.2004.4	2004	
subfields	https://openalex.org/subfields/1710	https://openalex.org/W2104348420	https://doi.org/10.1016/j.ins.2015.01.025	2015	Mazhar Ali, Samee U. Khan, Athanasios V. Vasilakos
subfields	https://openalex.org/subfields/1710	https://openalex.org/W2113999696		2004	Victor Shoup
subfields	https://openalex.org/subfields/1710	https://openalex.org/W109144892		2004	John Biggs
subfields	https://openalex.org/subfields/1710	https://openalex.org/W2036599383	https://doi.org/10.1016/j.eswa.2007.10.005	2007	Mukta Paliwal, Usha A. Kumar
subfields	https://openalex.org/subfields/1710	https://openalex.org/W2129251351	https://doi.org/10.1145/1367497.1367587	2008	Lada A. Adamic, Jun Zhang, Eytan Bakshy, Mark S. Ackerman
subfields	https://openalex.org/subfields/1710	https://openalex.org/W2200988052	https://doi.org/10.1007/978-1-4899-7637-6_1	2015	Francesco Ricci⋆, Lior Rokach, Bracha Shapira
subfields	https://openalex.org/subfields/1710	https://openalex.org/W2318262672	https://doi.org/10.1038/scientificamerican0407-56	2007	Harry A. Atwater
subfields	https://openalex.org/subfields/1710	https://openalex.org/W3122636688	https://doi.org/10.1093/rfs/hhz007	2019	Lin William Cong, Zhiguo He
subfields	https://openalex.org/subfields/1710	https://openalex.org/W4211153864	https://doi.org/10.1016/j.imavis.2008.11.007	2008	Alessandro Vinciarelli, Maja Pantić, Hervé Bourlard
subfields	https://openalex.org/subfields/1710	https://openalex.org/W1542246834		1998	Hugh W. Catts, Alan G. Kamhi
subfields	https://openalex.org/subfields/1710	https://openalex.org/W1963833910	https://doi.org/10.1016/j.websem.2004.06.005	2004	Evren Sirin, Bijan Parsia, Dan Wu, James Hendler, Dana Nau
subfields	https://openalex.org/subfields/1710	https://openalex.org/W2043811931	https://doi.org/10.1145/502034.502041	2001	Dawson Engler, David Yu Chen, Seth Hallem, Andy Chou, Benjamin Chelf
subfields	https://openalex.org/subfields/1710	https://openalex.org/W2095942159	https://doi.org/10.1145/302979.303001	1999	B. J. Fogg, Hsiang Li Tseng
subfields	https://openalex.org/subfields/1710	https://openalex.org/W2038345254	https://doi.org/10.1145/780506.780516	2002	Jean Charles Faugère
subfields	https://openalex.org/subfields/1710	https://openalex.org/W2120887445	https://doi.org/10.1109/tpami.2005.95	2005	Jian Huang, Michael K. Ng, Hongqiang Rong, Zichen Li
subfields	https://openalex.org/subfields/1710	https://openalex.org/W2147105902	https://doi.org/10.1109/32.859533	2000	Todd Graves, Alan F. Karr, J. S. Marron, Harvey Siy
subfields	https://openalex.org/subfields/1710	https://openalex.org/W4256669726	https://doi.org/10.1007/978-1-4899-7687-1	2017	Claude Sammut, Geoffrey I. Webb
subfields	https://openalex.org/subfields/1710	https://openalex.org/W1967740284	https://doi.org/10.1598/rt.39.6.11	1986	Donna Ogle
subfields	https://openalex.org/subfields/1710	https://openalex.org/W2127716901	https://doi.org/10.1038/srep03415	2013	Ladislav Krištoufek
subfields	https://openalex.org/subfields/1710	https://openalex.org/W2990181228	https://doi.org/10.1016/j.jisa.2019.102407	2019	Sudeep Tanwar, Karan Parekh, Richard Evans
subfields	https://openalex.org/subfields/1710	https://openalex.org/W4249138131	https://doi.org/10.1145/1150402	2006	
subfields	https://openalex.org/subfields/1710	https://openalex.org/W1490312119		2005	Mike Cohn
subfields	https://openalex.org/subfields/1710	https://openalex.org/W1977838479	https://doi.org/10.1016/s0167-4048(02)00514-x	2002	Yi‐Hua Liao, V. Rao Vemuri
subfields	https://openalex.org/subfields/1710	https://openalex.org/W1984066943	https://doi.org/10.1016/0306-4573(92)90087-g	1992	Jean Tague‐Sutcliffe
subfields	https://openalex.org/subfields/1710	https://openalex.org/W2620904645	https://doi.org/10.1109/cvcbt.2018.00011	2018	Karl Wüst, Arthur Gervais
subfields	https://openalex.org/subfields/1710	https://openalex.org/W2741249238	https://doi.org/10.1145/3077136.3080797	2017	Jingyuan Chen, Hanwang Zhang, Xiangnan He, Liqiang Nie, Wei Liu, Tat‐Seng Chua
subfields	https://openalex.org/subfields/1710	https://openalex.org/W2748692995	https://doi.org/10.1007/s00450-017-0360-9	2017	Esther Mengelkamp, Benedikt Notheisen, Carolin Beer, David Dauer, Christof Weinhardt
subfields	https://openalex.org/subfields/1710	https://openalex.org/W2805052744	https://doi.org/10.1145/3243734.3243780	2018	Petar Tsankov, Andrei Dan, Dana Drachsler-Cohen, Arthur Gervais, Florian Bünzli, Martin Vechev
subfields	https://openalex.org/subfields/1710	https://openalex.org/W3122975180	https://doi.org/10.1016/j.worlddev.2009.06.004	2009	Pierre‐Guillaume Méon, Laurent Weill
subfields	https://openalex.org/subfields/1710	https://openalex.org/W4247758521	https://doi.org/10.17487/rfc2543	1999	M. Handley, Henning Schulzrinne, E. Schooler, Jonathan Rosenberg
subfields	https://openalex.org/subfields/1710	https://openalex.org/W1545622404	https://doi.org/10.1080/07421222.1993.11518006	1993	Henri Barki, Suzanne Rivard, Jean‐Noël Talbot
subfields	https://openalex.org/subfields/1710	https://openalex.org/W1580684925		1995	Ian Foster
subfields	https://openalex.org/subfields/1710	https://openalex.org/W1581853629		1989	Anthony M. Graziano
subfields	https://openalex.org/subfields/1710	https://openalex.org/W1633659671		1998	Gholamhosein Sheikholeslami, Surojit Chatterjee, Aidong Zhang
subfields	https://openalex.org/subfields/1710	https://openalex.org/W2007642415	https://doi.org/10.1111/j.1746-1049.1962.tb01020.x	1962	Kaname Akamatsu
subfields	https://openalex.org/subfields/1710	https://openalex.org/W2119400430	https://doi.org/10.14778/1454159.1454166	2008	Ronnie Chaiken, B. Keith Jenkins, Per-Åke Larson, Bill Ramsey, Darren Shakib, Simon Weaver, Jingren Zhou
subfields	https://openalex.org/subfields/1710	https://openalex.org/W2121350579	https://doi.org/10.1109/icde.2002.994693	2003	Sanjay Agrawal, Surajit Chaudhuri, Gautam Das
subfields	https://openalex.org/subfields/1710	https://openalex.org/W2134177285	https://doi.org/10.1109/icdcs.2002.1022237	2003	Bin‐Miao Yang, Héctor García-Molina
subfields	https://openalex.org/subfields/1710	https://openalex.org/W2165121897	https://doi.org/10.1145/355602.361309	1972	David Lorge Parnas
subfields	https://openalex.org/subfields/1710	https://openalex.org/W3092216026	https://doi.org/10.21009/jtp.v22i1.15286	2020	Luh Devi Herliandry, Nurhasanah Nurhasanah, Maria Enjelina Suban, Heru Kuswanto
subfields	https://openalex.org/subfields/1710	https://openalex.org/W1506229097		1999	Frank Leymann, Dieter Roller
subfields	https://openalex.org/subfields/1710	https://openalex.org/W2040168265	https://doi.org/10.1145/336992.337028	1999	Moni Naor, Benny Pinkas, Reuban Sumner
subfields	https://openalex.org/subfields/1710	https://openalex.org/W2112486185	https://doi.org/10.1145/2018436.2018465	2011	Hitesh Ballani, Paolo Costa, Thomas Karagiannis, Ant Rowstron
subfields	https://openalex.org/subfields/1710	https://openalex.org/W2165228770		2014	C Lee Ventola
subfields	https://openalex.org/subfields/1710	https://openalex.org/W2169631286	https://doi.org/10.1002/cpe.728	2003	Jack Dongarra, Piotr Łuszczek, Antoine Petitet
subfields	https://openalex.org/subfields/1710	https://openalex.org/W2759211898	https://doi.org/10.18653/v1/d17-1004	2017	Yuhao Zhang, Victor Zhong, Danqi Chen, Gabor Angeli, Christopher D. Manning
subfields	https://openalex.org/subfields/1710	https://openalex.org/W2922234936	https://doi.org/10.1109/icse-seip.2019.00042	2019	Saleema Amershi, Andrew Begel, Christian Bird, Robert DeLine, Harald C. Gall, Ece Kamar, Nachiappan Nagappan, Besmira Nushi, Thomas Zimmermann
subfields	https://openalex.org/subfields/1710	https://openalex.org/W1910751411	https://doi.org/10.1007/11745853_14	2006	Daniel J. Bernstein
subfields	https://openalex.org/subfields/1710	https://openalex.org/W2122947685	https://doi.org/10.1109/icse.2009.5070536	2009	Westley Weimer, ThanhVu Nguyen, Claire Le Goues, Stephanie Forrest
subfields	https://openalex.org/subfields/1710	https://openalex.org/W2145207821	https://doi.org/10.1287/isre.1090.0236	2009	Kieran Conboy
subfields	https://openalex.org/subfields/1710	https://openalex.org/W3124929869		2007	Kusrini Kusrini
subfields	https://openalex.org/subfields/1710	https://openalex.org/W153250912		2000	Robin Burke
subfields	https://openalex.org/subfields/1710	https://openalex.org/W2000106226	https://doi.org/10.1145/312129.312274	1999	Bing Liu, Wynne Hsu, Yiming Ma
subfields	https://openalex.org/subfields/1710	https://openalex.org/W2041591938	https://doi.org/10.1016/s0010-4655(00)00065-5	2000	Ricky A. Kendall, Edoardo Aprà, David E. Bernholdt, Eric J. Bylaska, Michel Dupuis, George I. Fann, Robert J. Harrison, Jialin Ju, Jeffrey A. Nichols, Jarek Nieplocha, Tjerk P. Straatsma, Theresa L. Windus, Adrian T. Wong
subfields	https://openalex.org/subfields/1710	https://openalex.org/W2052658973	https://doi.org/10.1016/0306-4573(94)00041-z	1995	Katriina Byström
subfields	https://openalex.org/subfields/1710	https://openalex.org/W2737887725	https://doi.org/10.2788/33777	2012	Olivier Jos, Janssens-Maenhout Greet, Peters Jeroen
subfields	https://openalex.org/subfields/1710	https://openalex.org/W3007855629	https://doi.org/10.1126/science.aba3758	2020	Eric Masanet, Arman Shehabi, Nuoa Lei, Sarah Smith, Jonathan Koomey
subfields	https://openalex.org/subfields/1710	https://openalex.org/W3011793182	https://doi.org/10.3334/cdiac/otg.co2sys_xls_cdiac105a	2011	Denis Pierrot, Douglas W.R. Wallace, Ernie R. Lewis
subfields	https://openalex.org/subfields/1710	https://openalex.org/W1480302548		1970	Robert G. Owens
subfields	https://openalex.org/subfields/1710	https://openalex.org/W1921097329		2000	Rachna Dhamija, Adrian Perrig
subfields	https://openalex.org/subfields/1710	https://openalex.org/W1970348112	https://doi.org/10.1016/j.ijhcs.2003.08.002	2003	Natalya F. Noy, Mark A. Musen
subfields	https://openalex.org/subfields/1710	https://openalex.org/W2026892462	https://doi.org/10.1016/j.dam.2007.12.010	2008	Steven D. Galbraith, Kenneth G. Paterson, Nigel P. Smart
subfields	https://openalex.org/subfields/1710	https://openalex.org/W2099374284	https://doi.org/10.1109/90.649565	1997	Martin Arlitt, Carey Williamson
subfields	https://openalex.org/subfields/1710	https://openalex.org/W2123845623		2015	Edzer Pebesma, Roger Bivand
subfields	https://openalex.org/subfields/1710	https://openalex.org/W1534169650	https://doi.org/10.1007/978-3-531-92133-4_6	2009	Mike Sharples, Josie Taylor, Giasemi Vavoula
subfields	https://openalex.org/subfields/1710	https://openalex.org/W2088017390		1977	Matthew S. Hecht
subfields	https://openalex.org/subfields/1710	https://openalex.org/W2090036533	https://doi.org/10.1109/ms.2002.1003450	2002	Ioana Rus, Mikael Lindvall
subfields	https://openalex.org/subfields/1710	https://openalex.org/W2118330142	https://doi.org/10.1109/5254.941353	2001	Jaap Gordijn, Hans Akkermans
subfields	https://openalex.org/subfields/1710	https://openalex.org/W2161865688	https://doi.org/10.1109/76.927421	2001	Shih-Fu Chang, T. Sikora, A. Purl
subfields	https://openalex.org/subfields/1710	https://openalex.org/W2962854379	https://doi.org/10.18653/v1/w15-4640	2015	Ryan Lowe, Nissan Pow, Iulian Vlad Serban, Joëlle Pineau
subfields	https://openalex.org/subfields/1710	https://openalex.org/W2187986406		2005	Mike Sharples, Josie Taylor, Giasemi Vavoula
subfields	https://openalex.org/subfields/1710	https://openalex.org/W1486178352	https://doi.org/10.1007/3-540-45800-x_33	2002	Torsten Lodderstedt, David Basin, Jürgen Doser
