category	entry_id	openalex_id	doi	publication_year	authors
subfields	https://openalex.org/subfields/1802	https://openalex.org/W2186732317		1989	Fred D. Davis
subfields	https://openalex.org/subfields/1802	https://openalex.org/W2356613439	https://doi.org/10.1016/j.chb.2016.05.014	2016	Fazil Abdullah, Rupert Ward, Ejaz Ahmed
subfields	https://openalex.org/subfields/1802	https://openalex.org/W2551380182	https://doi.org/10.1016/j.jbusres.2016.10.004	2016	Nick Hajli, Julian Sims, Arash H. Zadeh, Marie‐Odile Richard
subfields	https://openalex.org/subfields/1802	https://openalex.org/W4232523802	https://doi.org/10.1093/imamat/1.1.42	1965	D. J. DALEY, D. G. KENDALL
subfields	https://openalex.org/subfields/1802	https://openalex.org/W4238295905	https://doi.org/10.1108/eb026482	1969	OLE V. GROOS, ALAN PRITCHARD
subfields	https://openalex.org/subfields/1802	https://openalex.org/W1590240496	https://doi.org/10.1108/01443570410563278	2004	Zhilin Yang, Minjoon Jun, Robin T. Peterson
subfields	https://openalex.org/subfields/1802	https://openalex.org/W2048020986	https://doi.org/10.1145/985692.985727	2004	Piotr D. Adamczyk, Brian P. Bailey
subfields	https://openalex.org/subfields/1802	https://openalex.org/W205133821	https://doi.org/10.1023/a:1016323815802	2002	Sonja Grabner‐Kräuter
subfields	https://openalex.org/subfields/1802	https://openalex.org/W2146209612	https://doi.org/10.1002/smj.743	2008	Douglas A. Bosse, Robert A. Phillips, Jeffrey S. Harrison
subfields	https://openalex.org/subfields/1802	https://openalex.org/W2465739951	https://doi.org/10.1038/nature18315	2016	Lindell Bromham, Russell Dinnage, Xia Hua
subfields	https://openalex.org/subfields/1802	https://openalex.org/W1982888377	https://doi.org/10.1007/bf00309260	1989	Tony Gillie, Donald E. Broadbent
subfields	https://openalex.org/subfields/1802	https://openalex.org/W1991976654	https://doi.org/10.1080/03075079712331381034	1997	Peter Ashworth, Philip Bannister, Pauline Thorne, Students on the Qualitative Researc
subfields	https://openalex.org/subfields/1802	https://openalex.org/W2102569447	https://doi.org/10.1080/00220272.2010.521261	2011	Wayne Au
subfields	https://openalex.org/subfields/1802	https://openalex.org/W2118101410	https://doi.org/10.1016/s0378-7206(02)00101-5	2002	Solomon Negash, Terry Ryan, Magid Igbaria
subfields	https://openalex.org/subfields/1802	https://openalex.org/W2571213079	https://doi.org/10.1016/j.chb.2017.01.001	2017	Jalayer Khalilzadeh, Ahmet Öztürk, Anil Bilgihan
subfields	https://openalex.org/subfields/1802	https://openalex.org/W1973277062	https://doi.org/10.1016/j.im.2009.10.002	2009	Ofir Turel, Alexander Serenko, Nick Bontis
subfields	https://openalex.org/subfields/1802	https://openalex.org/W2000822406	https://doi.org/10.5465/amj.2009.0804	2012	Michelle K. Duffy, Kristin L. Scott, Jason D. Shaw, Bennett J. Tepper, Karl Aquino
subfields	https://openalex.org/subfields/1802	https://openalex.org/W2107440332	https://doi.org/10.1016/j.tourman.2012.06.010	2012	Julian K. Ayeh, Norman Au, Rob Law
subfields	https://openalex.org/subfields/1802	https://openalex.org/W2107571014	https://doi.org/10.1016/j.techfore.2010.11.007	2010	Fan‐Yun Pai, Kai-I Huang
subfields	https://openalex.org/subfields/1802	https://openalex.org/W2167131774	https://doi.org/10.1037/0021-9010.71.2.232	1986	Michael J. Burke, Russell R. Day
subfields	https://openalex.org/subfields/1802	https://openalex.org/W2326206704	https://doi.org/10.2307/3150229	1971	Harold H. Kassarjian
subfields	https://openalex.org/subfields/1802	https://openalex.org/W2768260999		2002	Bill Anckar, Davide D'Incau
subfields	https://openalex.org/subfields/1802	https://openalex.org/W2801887814	https://doi.org/10.2307/40252844	2005	Sheldon Krimsky, Jennifer Washburn
subfields	https://openalex.org/subfields/1802	https://openalex.org/W1533506891		2012	Oliver Rose, Adelinde M. Uhrmacher
subfields	https://openalex.org/subfields/1802	https://openalex.org/W2026473865	https://doi.org/10.1016/j.im.2007.03.005	2007	Il Im, Yong-Beom Kim, Hyo‐Joo Han
subfields	https://openalex.org/subfields/1802	https://openalex.org/W2063745966	https://doi.org/10.1108/02652320510584403	2005	Walfried M. Lassar, Chris Manolis, Sharon S. Lassar
subfields	https://openalex.org/subfields/1802	https://openalex.org/W2154423338	https://doi.org/10.1287/isre.2013.0501	2013	Weiyin Hong, Frank K. Y. Chan, James Y.L. Thong, Lewis C. Chasalow, Gurpreet Dhillon
subfields	https://openalex.org/subfields/1802	https://openalex.org/W2923578873	https://doi.org/10.1016/j.jretconser.2019.03.004	2019	Philipp A. Rauschnabel, Reto Felix, Chris Hinsch
subfields	https://openalex.org/subfields/1802	https://openalex.org/W1503342679		2010	Donna L. Hoffman, Marek Fodor
subfields	https://openalex.org/subfields/1802	https://openalex.org/W1975593382	https://doi.org/10.2307/41165254	1987	Edwin M. Epstein
subfields	https://openalex.org/subfields/1802	https://openalex.org/W2023895512	https://doi.org/10.1016/j.jretai.2013.02.001	2013	V. Kumar, Ilaria Dalla Pozza, Jaishankar Ganesh
subfields	https://openalex.org/subfields/1802	https://openalex.org/W2151229266	https://doi.org/10.1590/s0102-311x2007000200016	2007	Gastão Wagner de Sousa Campos, Ana Carla Pereira Domitti
subfields	https://openalex.org/subfields/1802	https://openalex.org/W2154157725	https://doi.org/10.1145/1518701.1519023	2009	Brian Y. Lim, Anind K. Dey, Daniel Avrahami
subfields	https://openalex.org/subfields/1802	https://openalex.org/W3122470356	https://doi.org/10.1016/j.jom.2009.11.010	2009	Hefu Liu, Weiling Ke, Kwok‐Kee Wei, Jibao Gu, Huaping Chen
subfields	https://openalex.org/subfields/1802	https://openalex.org/W1032630705	https://doi.org/10.1016/j.elerap.2015.07.006	2015	Tomi Dahlberg, Jie Guo, Jan Ondruš
subfields	https://openalex.org/subfields/1802	https://openalex.org/W1991322805	https://doi.org/10.1016/j.im.2008.06.004	2008	Tung‐Ching Lin, Chien-Chih Huang
subfields	https://openalex.org/subfields/1802	https://openalex.org/W2054691403	https://doi.org/10.1016/s0305-0483(98)00049-8	1999	Gholamreza Torkzadeh, William J. Doll
subfields	https://openalex.org/subfields/1802	https://openalex.org/W2065131671	https://doi.org/10.1109/2.60882	1990	Brad A. Myers, Dario A. Giuse, Roger B. Dannenberg, Brad Vander Zanden, David S. Kosbie, Edward Pervin, Andrew Mickish, P. Marchal
subfields	https://openalex.org/subfields/1802	https://openalex.org/W2092083003	https://doi.org/10.1089/cpb.2005.8.7	2005	Keith W. Beard
subfields	https://openalex.org/subfields/1802	https://openalex.org/W2110986222	https://doi.org/10.5555/1753235.1753251	2009	Jan Bosch
subfields	https://openalex.org/subfields/1802	https://openalex.org/W2113571606	https://doi.org/10.1111/j.1468-2370.2009.00278.x	2010	François Maon, Adam Lindgreen, Valérie Swaen
subfields	https://openalex.org/subfields/1802	https://openalex.org/W3125930628	https://doi.org/10.25300/misq/2014/38.1.10	2014	Carol Xiaojuan Ou, Paul A. Pavlou, Robert M. Davison
subfields	https://openalex.org/subfields/1802	https://openalex.org/W4249169350	https://doi.org/10.1177/002224299706100102	1997	J. Brock Smith, Donald W. Barclay
subfields	https://openalex.org/subfields/1802	https://openalex.org/W1965338101	https://doi.org/10.1108/08876049710187482	1997	J. Joseph Cronin, Michael K. Brady, Richard R. Brand, Roscoe Hightower, Donald J. Shemwell
subfields	https://openalex.org/subfields/1802	https://openalex.org/W1965808486	https://doi.org/10.1201/1078.10580530/45520.22.4.20050901/90026.2	2005	Sirkka L. Järvenpää, Karl R. Lang
subfields	https://openalex.org/subfields/1802	https://openalex.org/W1986444647	https://doi.org/10.1007/s11191-010-9293-4	2010	Gürol Irzık, Robert Nola
subfields	https://openalex.org/subfields/1802	https://openalex.org/W2160709242	https://doi.org/10.1016/j.jbusres.2011.07.019	2011	Anna Morgan‐Thomas, Cleopatra Veloutsou
subfields	https://openalex.org/subfields/1802	https://openalex.org/W2163528872	https://doi.org/10.1287/isre.1060.0107	2006	Nanda Kumar, Izak Benbasat
subfields	https://openalex.org/subfields/1802	https://openalex.org/W2165116374	https://doi.org/10.1111/1467-9620.00168	2002	Betty Achinstein
subfields	https://openalex.org/subfields/1802	https://openalex.org/W2333337175	https://doi.org/10.1177/1356389016638615	2016	Ana Manzano
subfields	https://openalex.org/subfields/1802	https://openalex.org/W2992654002		2011	Yi Hsuan Lee, Yi Chuan Hsieh, Chia Ning Hsu
subfields	https://openalex.org/subfields/1802	https://openalex.org/W406100599		1970	Carnot E. Nelson, Donald Pollock
subfields	https://openalex.org/subfields/1802	https://openalex.org/W4232132530	https://doi.org/10.1177/002224298705100107	1987	Lawrence Feick, Linda L. Price
subfields	https://openalex.org/subfields/1802	https://openalex.org/W1735053150	https://doi.org/10.1016/j.indmarman.2015.09.003	2015	Raj Agnihotri, Rebecca Dingus, Michael Y. Hu, Michael T. Krush
subfields	https://openalex.org/subfields/1802	https://openalex.org/W181628095	https://doi.org/10.1108/imr-04-2014-0148	2016	Nicole Richter, Rudolf R. Sinkovics, Christian M. Ringle, Christopher Schlägel
subfields	https://openalex.org/subfields/1802	https://openalex.org/W1863383349	https://doi.org/10.17705/1jais.00232	2010	Huigang Liang, Yajiong Xue
subfields	https://openalex.org/subfields/1802	https://openalex.org/W2005639687	https://doi.org/10.1080/01449298208914450	1982	Ben Shneiderman
subfields	https://openalex.org/subfields/1802	https://openalex.org/W2024030746	https://doi.org/10.1016/s0004-3702(97)00008-8	1997	Don R. Swanson, Neil R. Smalheiser
subfields	https://openalex.org/subfields/1802	https://openalex.org/W2082368698	https://doi.org/10.1016/s0019-8501(01)00186-9	2002	Hans H. Bauer, Mark Grether, Mark Leach
subfields	https://openalex.org/subfields/1802	https://openalex.org/W2094727885	https://doi.org/10.1080/14783360902781923	2009	Hsin Hsin Chang, Yao-Hua Wang, Wenying Yang
subfields	https://openalex.org/subfields/1802	https://openalex.org/W2151224512	https://doi.org/10.1016/s1467-0895(03)00008-3	2003	James E. Hunton, Barbara Lippincott, Jacqueline L. Reck
subfields	https://openalex.org/subfields/1802	https://openalex.org/W1756578404		2005	Timothy P. McNamara
subfields	https://openalex.org/subfields/1802	https://openalex.org/W191206311	https://doi.org/10.17705/1cais.03105	2012	Chingning Wang, Ping Zhang
subfields	https://openalex.org/subfields/1802	https://openalex.org/W1995817465	https://doi.org/10.1007/s10796-008-9103-6	2008	Lemuria Carter, Vishanth Weerakkody
subfields	https://openalex.org/subfields/1802	https://openalex.org/W2021568043	https://doi.org/10.1287/mksc.1050.0180	2006	Neil A. Morgan, Lopo L. Rego
subfields	https://openalex.org/subfields/1802	https://openalex.org/W2168624611	https://doi.org/10.5465/ame.2004.13836269	2004	Archie B. Carroll
subfields	https://openalex.org/subfields/1802	https://openalex.org/W2335138213	https://doi.org/10.2307/2580769	1996	James A. Davis, Charles C. Ragin
subfields	https://openalex.org/subfields/1802	https://openalex.org/W2490500587	https://doi.org/10.4135/9781848608320.n9	2012	Paul R. Sackett, Cynthia James DeVore
subfields	https://openalex.org/subfields/1802	https://openalex.org/W2561824495	https://doi.org/10.1016/j.jretai.2016.12.006	2017	J. Jeffrey Inman, Hristina Nikolova
subfields	https://openalex.org/subfields/1802	https://openalex.org/W4205445214	https://doi.org/10.1007/978-3-319-57413-4_15	2021	Marko Sarstedt, Christian M. Ringle, Joseph F. Hair
subfields	https://openalex.org/subfields/1802	https://openalex.org/W1536260248		2007	Richard R. Nelson, Gavin Wright
subfields	https://openalex.org/subfields/1802	https://openalex.org/W1563791530	https://doi.org/10.54155/jbs.19.1.19-42	1970	Zhilin Yang, Minjoon Jun
subfields	https://openalex.org/subfields/1802	https://openalex.org/W1995771729	https://doi.org/10.1016/j.chb.2005.09.001	2005	Chin‐Lung Hsu, Hsi‐Peng Lu
subfields	https://openalex.org/subfields/1802	https://openalex.org/W2013337540	https://doi.org/10.1037/0021-9010.78.5.753	1993	Paul R. Jackson, Toby D. Wall, Robin Martin, Keith Davids
subfields	https://openalex.org/subfields/1802	https://openalex.org/W2025348689	https://doi.org/10.1016/j.jretconser.2008.11.019	2009	Jiyoung Kim, Byoungho Jin, Jane Swinney
subfields	https://openalex.org/subfields/1802	https://openalex.org/W2035626379	https://doi.org/10.1108/09604520110387257	2001	Jennifer Cox, B.G. Dale
subfields	https://openalex.org/subfields/1802	https://openalex.org/W2090297566	https://doi.org/10.3152/147154399781782437	1999	Peter Weingart
subfields	https://openalex.org/subfields/1802	https://openalex.org/W2101184554	https://doi.org/10.1016/j.riob.2012.11.002	2012	Christopher W. Bauman, Linda J. Skitka
subfields	https://openalex.org/subfields/1802	https://openalex.org/W2163950848	https://doi.org/10.2307/249523	1994	James D. McKeen, Tor Guimãrães, James C. Wetherbe
subfields	https://openalex.org/subfields/1802	https://openalex.org/W2441943932	https://doi.org/10.1038/495426a	2013	Richard Van Noorden
subfields	https://openalex.org/subfields/1802	https://openalex.org/W2513577383	https://doi.org/10.1016/j.chb.2016.02.038	2016	Gomaa Agag, Ahmed El‐Masry
subfields	https://openalex.org/subfields/1802	https://openalex.org/W4254255734	https://doi.org/10.1007/s10551-007-9517-y	2007	R. Edward Freeman, Kirsten Martin, Bidhan L. Parmar
subfields	https://openalex.org/subfields/1802	https://openalex.org/W1986701081	https://doi.org/10.1145/258549.258626	1997	Noam Tractinsky
subfields	https://openalex.org/subfields/1802	https://openalex.org/W1995506152	https://doi.org/10.1016/j.ijmedinf.2011.03.002	2011	Tsipi Heart, Efrat Kalderon
subfields	https://openalex.org/subfields/1802	https://openalex.org/W2051761983	https://doi.org/10.1057/palgrave.ejis.3000711	2007	Mohamed Khalifa, Vanessa Liu
subfields	https://openalex.org/subfields/1802	https://openalex.org/W2117837534	https://doi.org/10.1177/016555158000200302	1980	B.C. Brookes
subfields	https://openalex.org/subfields/1802	https://openalex.org/W2122997249	https://doi.org/10.1080/0969594042000304609	2004	Gavin Brown
subfields	https://openalex.org/subfields/1802	https://openalex.org/W4234335579	https://doi.org/10.1109/iccsa16853.2010	2010	
subfields	https://openalex.org/subfields/1802	https://openalex.org/W1977091007	https://doi.org/10.1007/s10551-011-0904-z	2011	Andrea J. S. Stanaland, May O. Lwin, Patrick E. Murphy
subfields	https://openalex.org/subfields/1802	https://openalex.org/W2043227098	https://doi.org/10.1016/s0378-7206(98)00044-5	1998	M. Gelderman
subfields	https://openalex.org/subfields/1802	https://openalex.org/W2761657033	https://doi.org/10.1016/j.jad.2017.10.007	2017	Claudia Marino, Gianluca Gini, Alessio Vieno, Marcantonio M. Spada
subfields	https://openalex.org/subfields/1802	https://openalex.org/W3044483028	https://doi.org/10.1016/j.tele.2020.101473	2020	Muhammad Ashfaq, Yun Jiang, Shubin Yu, Sandra María Correia Loureiro
subfields	https://openalex.org/subfields/1802	https://openalex.org/W110062975	https://doi.org/10.1016/b978-0-444-70536-5.50041-5	1988	John Whiteside, John L. Bennett, Karen Holtzblatt
subfields	https://openalex.org/subfields/1802	https://openalex.org/W2085707688	https://doi.org/10.1007/s10551-005-0132-5	2005	Christine A. Hemingway
subfields	https://openalex.org/subfields/1802	https://openalex.org/W2118962522	https://doi.org/10.1007/bf00871811	1994	James C. Wimbush, Jon M. Shepard
subfields	https://openalex.org/subfields/1802	https://openalex.org/W2127908243	https://doi.org/10.5465/amr.2003.10196791	2003	Quintus R. Jett, Jennifer M. George
subfields	https://openalex.org/subfields/1802	https://openalex.org/W2171116986	https://doi.org/10.5840/beq200818214	2008	Bradley R. Agle, Thomas Donaldson, R. Edward Freeman, Michael C. Jensen, Ronald K. Mitchell, Donna J. Wood
subfields	https://openalex.org/subfields/1802	https://openalex.org/W2468472082	https://doi.org/10.5860/choice.191214	2015	
subfields	https://openalex.org/subfields/1802	https://openalex.org/W1971987011	https://doi.org/10.1023/b:sbej.0000032036.90353.1f	2004	Nir Kshetri
subfields	https://openalex.org/subfields/1802	https://openalex.org/W2023669794	https://doi.org/10.5465/ame.2002.8951333	2002	Mary Jo Bitner, Amy L. Ostrom, Matthew L. Meuter
subfields	https://openalex.org/subfields/1802	https://openalex.org/W2043716431	https://doi.org/10.1016/j.compedu.2012.07.015	2012	Shu-Sheng Liaw, Hsiu‐Mei Huang
subfields	https://openalex.org/subfields/1802	https://openalex.org/W2053014304	https://doi.org/10.1021/ci500593j	2014	Moises Álvarez‐Moreno, Coen de Graaf, Núria Lopéz, Feliu Maseras, Josep M. Poblet, Carles Bó
subfields	https://openalex.org/subfields/1802	https://openalex.org/W2070629130	https://doi.org/10.4018/ijec.2014010101	2014	Ned Kock
subfields	https://openalex.org/subfields/1802	https://openalex.org/W2072883562	https://doi.org/10.1086/208981	1984	Jacob Jacoby
subfields	https://openalex.org/subfields/1802	https://openalex.org/W2158511897	https://doi.org/10.1016/j.compedu.2010.04.005	2010	William Douglas Woody, David B. Daniel, Crystal A. Baker
subfields	https://openalex.org/subfields/1802	https://openalex.org/W2160948978	https://doi.org/10.1093/bioinformatics/16.2.184	2000	Robert Stevens, Patricia Baker, Sean Bechhofer, Gary Ng, A. Jacoby, Norman W. Paton, Carole Goble, Andy Brass
subfields	https://openalex.org/subfields/1802	https://openalex.org/W2168273971	https://doi.org/10.3102/0002831215585562	2015	Matthew Ronfeldt, Susanna Owens Farmer, Kiel McQueen, Jason A. Grissom
subfields	https://openalex.org/subfields/1802	https://openalex.org/W2247317079	https://doi.org/10.14778/2824032.2824076	2015	Tyler Akidau, Robert Bradshaw, Craig Chambers, Slava Chernyak, Rafael J. Fernández-Moctezuma, Reuven Lax, Sam McVeety, D Mills, Frances Perry, Eric Schmidt, Sam Whittle
subfields	https://openalex.org/subfields/1802	https://openalex.org/W269159487		2013	A. Michael Huberman, Matthew B. Miles
subfields	https://openalex.org/subfields/1802	https://openalex.org/W1746336329	https://doi.org/10.1111/j.1559-1816.2010.00615.x	2010	Shumaila Yousafzai, Gordon R. Foxall, John Pallister
subfields	https://openalex.org/subfields/1802	https://openalex.org/W1807711444		2003	Nancy Fichtman Dana, Diane Yendol‐Hoppey
subfields	https://openalex.org/subfields/1802	https://openalex.org/W2047951785	https://doi.org/10.1145/1216016.1216023	2007	Joon Koh, Young‐Gul Kim, Brian S. Butler, Gee‐Woo Bock
subfields	https://openalex.org/subfields/1802	https://openalex.org/W2071582555	https://doi.org/10.1016/j.jbusres.2013.08.010	2013	Robert A. Peterson, Dwight Merunka
subfields	https://openalex.org/subfields/1802	https://openalex.org/W2112619604	https://doi.org/10.5465/amr.2004.13670978	2004	Richard M. Steers, Richard T. Mowday, Debra L. Shapiro
subfields	https://openalex.org/subfields/1802	https://openalex.org/W2141119748	https://doi.org/10.1016/s0747-5632(99)00038-2	1999	Hsiang Chen, Rolf T. Wigand, Michael S. Nilan
subfields	https://openalex.org/subfields/1802	https://openalex.org/W2144502588	https://doi.org/10.1016/s0378-7206(01)00107-0	2002	Eric W.T. Ngai, F.K.T. Wat
subfields	https://openalex.org/subfields/1802	https://openalex.org/W3047381571	https://doi.org/10.1007/s11135-020-01028-z	2020	Arfan Shahzad, Rohail Hassan, Abdulfatai Aremu, Arsalan Hussain, Rab Nawaz Lodhi
subfields	https://openalex.org/subfields/1802	https://openalex.org/W1511560192	https://doi.org/10.5751/es-02671-130246	2008	Thaddeus R. Miller, Timothy D. Baird, Caitlin M. Littlefield, Gary P. Kofinas, F. Stuart Chapin, Charles L. Redman
subfields	https://openalex.org/subfields/1802	https://openalex.org/W1715846772	https://doi.org/10.1007/978-3-662-03345-6	1997	Johannes Sametinger
subfields	https://openalex.org/subfields/1802	https://openalex.org/W2040716619	https://doi.org/10.1016/j.chb.2014.04.016	2014	Mohammad Reza Habibi, Michel Laroche, Marie‐Odile Richard
subfields	https://openalex.org/subfields/1802	https://openalex.org/W2063747225	https://doi.org/10.1111/j.1745-3992.2006.00075.x	2006	Robert J. Mislevy, Geneva D. Haertel
subfields	https://openalex.org/subfields/1802	https://openalex.org/W2083365829	https://doi.org/10.2753/mis0742-1222230210	2006	Kai H. Lim, Choon Ling Sia, Matthew Lee, Izak Benbasat
subfields	https://openalex.org/subfields/1802	https://openalex.org/W1757586515	https://doi.org/10.2307/30036548	2003	Rajeev Sharma, Philip Yetton
subfields	https://openalex.org/subfields/1802	https://openalex.org/W2023436750	https://doi.org/10.1016/j.intmar.2009.02.002	2009	Venkatesh Shankar, Sridhar Balasubramanian
subfields	https://openalex.org/subfields/1802	https://openalex.org/W2068863393	https://doi.org/10.1080/19416520802211677	2008	Ann E. Tenbrunsel, Kristin Smith‐Crowe
subfields	https://openalex.org/subfields/1802	https://openalex.org/W2127297674	https://doi.org/10.1109/tpds.2003.1195409	2003	Francine Berman, Rich Wolski, Henri Casanova, Walfredo Cirne, Holly Dail, Marcio Faerman, Silvia Figueira, J.E. Hayes, Graziano Obertelli, Jennifer M. Schopf, Gary Shao, Shava Smallen, Neil Spring, Alan Su, Dmitrii Zagorodnov
subfields	https://openalex.org/subfields/1802	https://openalex.org/W2127645958	https://doi.org/10.1287/orsc.10.6.758	1999	D. Sandy Staples, John Hulland, Christopher A. Higgins
subfields	https://openalex.org/subfields/1802	https://openalex.org/W2129644018	https://doi.org/10.2307/25148815	2007	Andrew Burton‐Jones, Michael J. Gallivan
subfields	https://openalex.org/subfields/1802	https://openalex.org/W2141150971	https://doi.org/10.1080/10864415.2001.11044233	2001	Marios Koufaris, Ajit Kambil, Priscilla A. LaBarbera
subfields	https://openalex.org/subfields/1802	https://openalex.org/W2489135316	https://doi.org/10.4324/9780203774847-8	2013	
subfields	https://openalex.org/subfields/1802	https://openalex.org/W1581835282		1986	Roger C. Schank
subfields	https://openalex.org/subfields/1802	https://openalex.org/W2008578270	https://doi.org/10.1016/j.tele.2009.11.001	2009	Hannu Verkasalo, Carolina López‐Nicolás, Francisco‐Jose Molina‐Castillo, Harry Bouwman
subfields	https://openalex.org/subfields/1802	https://openalex.org/W2011819170	https://doi.org/10.1007/s10551-008-9806-0	2008	Güler Aras, David Crowther
subfields	https://openalex.org/subfields/1802	https://openalex.org/W2012207800	https://doi.org/10.1177/1098214010389321	2010	Chris L. S. Coryn, Lindsay A. Noakes, Carl D. Westine, Daniela C. Schröter
subfields	https://openalex.org/subfields/1802	https://openalex.org/W2028125440	https://doi.org/10.1016/0263-7855(92)80007-z	1992	Leif Laaksonen
subfields	https://openalex.org/subfields/1802	https://openalex.org/W2088829840	https://doi.org/10.1002/mar.10087	2003	William R. Swinyard, Scott M. Smith
subfields	https://openalex.org/subfields/1802	https://openalex.org/W2097645122	https://doi.org/10.1007/s10551-004-8204-5	2005	Rafik I. Beekun, Jamal A. Badawi
subfields	https://openalex.org/subfields/1802	https://openalex.org/W2145154883	https://doi.org/10.1145/1142473.1142574	2006	Steven P. Callahan, Juliana Freire, Emanuele Santos, Carlos Scheidegger, Claudio Silva, Huy T. Vo
subfields	https://openalex.org/subfields/1802	https://openalex.org/W2299342246	https://doi.org/10.1016/j.ijmedinf.2016.03.002	2016	Miha Cimperman, Maja Makovec Brenčić, Peter Trkman
subfields	https://openalex.org/subfields/1802	https://openalex.org/W2421094920		2006	Homa Darmani
subfields	https://openalex.org/subfields/1802	https://openalex.org/W4243592274	https://doi.org/10.1177/002224299405800303	1994	Harish Sujan, Barton A. Weitz, Nirmalya Kumar
subfields	https://openalex.org/subfields/1802	https://openalex.org/W1022156758	https://doi.org/10.1016/j.sbspro.2015.06.423	2015	Rita Rahayu, John Day
subfields	https://openalex.org/subfields/1802	https://openalex.org/W2066426987	https://doi.org/10.1089/109493103322725469	2003	Ting‐Jui Chou, Chih-Chen Ting
subfields	https://openalex.org/subfields/1802	https://openalex.org/W2120839367	https://doi.org/10.1016/s0149-2063(03)00084-9	2003	Larry J. Williams, Jeffrey R. Edwards, Robert J. Vandenberg
subfields	https://openalex.org/subfields/1802	https://openalex.org/W2125133503	https://doi.org/10.1111/isj.12068	2015	Christian Maier, Sven Laumer, Christoph Weinert, Tim Weitzel
subfields	https://openalex.org/subfields/1802	https://openalex.org/W2146143340	https://doi.org/10.1080/10864415.2001.11044225	2001	Stuart J. Barnes, Richard Vidgen
subfields	https://openalex.org/subfields/1802	https://openalex.org/W2285687272		2010	Kraig Finstad
subfields	https://openalex.org/subfields/1802	https://openalex.org/W2329122077	https://doi.org/10.2307/2149478	1982	Theda Skocpol, Kenneth Finegold
subfields	https://openalex.org/subfields/1802	https://openalex.org/W2499967612	https://doi.org/10.1057/9780230625310	2007	Kapil Raj
subfields	https://openalex.org/subfields/1802	https://openalex.org/W3118898571		2014	Stephen P. Robbins, Timothy A. Judge
subfields	https://openalex.org/subfields/1802	https://openalex.org/W172945610	https://doi.org/10.1063/1.3034780	1968	Donald C. Peltz, Frank M. Andrews, George Auman
subfields	https://openalex.org/subfields/1802	https://openalex.org/W1977258648	https://doi.org/10.5465/amr.1985.4279105	1985	Janelle Brinker Dozier, Marcia P. Miceli
subfields	https://openalex.org/subfields/1802	https://openalex.org/W1985623351	https://doi.org/10.1111/j.1467-9620.2005.00462.x	2004	Gary D. Fenstermacher, Virginia Richardson
subfields	https://openalex.org/subfields/1802	https://openalex.org/W2062325760	https://doi.org/10.1023/b:busi.0000025040.41263.09	2004	Stephen J. Conroy, Tisha L. N. Emerson
subfields	https://openalex.org/subfields/1802	https://openalex.org/W2082769179	https://doi.org/10.1287/mnsc.1070.0765	2008	Constance Elise Porter, Naveen Donthu
subfields	https://openalex.org/subfields/1802	https://openalex.org/W2089466924	https://doi.org/10.1007/bf02017249	1986	A. Schubert, T. Braun
