category	entry_id	openalex_id	doi	publication_year	authors
subfields	https://openalex.org/subfields/1802	https://openalex.org/W2124483205	https://doi.org/10.1016/j.intcom.2009.06.005	2009	Alexander Johannes Aloysius Maria van Deursen, Jan van Dijk
subfields	https://openalex.org/subfields/1802	https://openalex.org/W1744229416	https://doi.org/10.1007/0-306-47559-6_18	2005	Robert E. Stake
subfields	https://openalex.org/subfields/1802	https://openalex.org/W1965046949	https://doi.org/10.1002/mar.20236	2008	Minna Pihlström, Gregory J. Brush
subfields	https://openalex.org/subfields/1802	https://openalex.org/W1967791196	https://doi.org/10.1016/j.im.2007.11.002	2008	June Lu, Chang Liu, Chun‐Sheng Yu, Kanliang Wang
subfields	https://openalex.org/subfields/1802	https://openalex.org/W2029778954	https://doi.org/10.1145/1057237.1057243	2005	James Fogarty, Scott E. Hudson, Christopher G. Atkeson, Daniel Avrahami, Jodi Forlizzi, Sara Kiesler, Johnny C. Lee, Jie Yang
subfields	https://openalex.org/subfields/1802	https://openalex.org/W2084403508	https://doi.org/10.1002/smj.958	2011	Yuri Mishina, Emily S. Block, Michael J. Mannor
subfields	https://openalex.org/subfields/1802	https://openalex.org/W2086210110	https://doi.org/10.1007/s10551-007-9368-6	2007	Jay Prakash Mulki, Jorge Fernando Jaramillo, William B. Locander
subfields	https://openalex.org/subfields/1802	https://openalex.org/W2094350912	https://doi.org/10.1016/j.tourman.2011.10.013	2011	Hatem El‐Gohary
subfields	https://openalex.org/subfields/1802	https://openalex.org/W2136777851	https://doi.org/10.1037/0882-7974.21.1.190	2006	Anne-Sophie Melenhorst, Wendy A. Rogers, D.G. Bouwhuis
subfields	https://openalex.org/subfields/1802	https://openalex.org/W2143852449	https://doi.org/10.2307/25148828	2008	Norman Au, Ngai, T.C.E. Cheng
subfields	https://openalex.org/subfields/1802	https://openalex.org/W2159719881	https://doi.org/10.1080/10548400903163160	2009	Rob Law, Rosanna Leung, Dimitrios Buhalis
subfields	https://openalex.org/subfields/1802	https://openalex.org/W2519706319	https://doi.org/10.1016/j.ijinfomgt.2016.07.009	2016	Ibrar Yaqoob, Mohamed Hashem, Abdullah Gani, Salimah Mokhtar, Ejaz Ahmed, Nor Badrul Anuar, Athanasios V. Vasilakos
subfields	https://openalex.org/subfields/1802	https://openalex.org/W2783356839	https://doi.org/10.1016/j.compedu.2018.01.003	2018	Young Ju Joo, Hyo‐Jeong So, Nam Hee Kim
subfields	https://openalex.org/subfields/1802	https://openalex.org/W2995678499	https://doi.org/10.1016/j.tele.2019.101324	2019	Kwonsang Sohn, Ohbyung Kwon
subfields	https://openalex.org/subfields/1802	https://openalex.org/W3011648542	https://doi.org/10.1016/j.ijinfomgt.2020.102103	2020	Sheshadri Chatterjee, Arpan Kumar Kar
subfields	https://openalex.org/subfields/1802	https://openalex.org/W3101556949	https://doi.org/10.1016/j.ijinfomgt.2020.102269	2020	Kuttimani Tamilmani, Nripendra P. Rana, Samuel Fosso Wamba, Rohita Dwivedi
subfields	https://openalex.org/subfields/1802	https://openalex.org/W2016022053	https://doi.org/10.1145/1735223.1735255	2010	Wonil Hwang, Gavriel Salvendy
subfields	https://openalex.org/subfields/1802	https://openalex.org/W2105334626	https://doi.org/10.1108/02652320910928245	2009	Joaquín Aldás Manzano, Carlos Lassala Navarré, Carla Ruíz Mafé, Silvia Sanz Blas
subfields	https://openalex.org/subfields/1802	https://openalex.org/W2126278216	https://doi.org/10.1177/1745691614556679	2015	Eric Luis Uhlmann, David A. Pizarro, Daniel Diermeier
subfields	https://openalex.org/subfields/1802	https://openalex.org/W2148224179	https://doi.org/10.1017/s0140525x10000907	2010	Joshua Knobe
subfields	https://openalex.org/subfields/1802	https://openalex.org/W2319422515	https://doi.org/10.1177/002224298304700402	1983	Shelby D. Hunt
subfields	https://openalex.org/subfields/1802	https://openalex.org/W3089504954	https://doi.org/10.1016/j.childyouth.2020.105535	2020	Debajyoti Pal, Vajirasak Vanijja
subfields	https://openalex.org/subfields/1802	https://openalex.org/W1550000763		2009	Joshua Sunshine, Serge Egelman, Hazim Almuhimedi, Neha Atri, Lorrie Faith Cranor
subfields	https://openalex.org/subfields/1802	https://openalex.org/W1734615303	https://doi.org/10.2310/jim.0b013e318250871d	2012	Lee Bennett, Howard Gadlin
subfields	https://openalex.org/subfields/1802	https://openalex.org/W1806647190		2014	Danielle Keats Citron, Frank Pasquale
subfields	https://openalex.org/subfields/1802	https://openalex.org/W1910906908	https://doi.org/10.1089/tmj.2014.0148	2015	Shupei Yuan, Wenjuan Ma, Shaheen Kanthawala, Wei Peng
subfields	https://openalex.org/subfields/1802	https://openalex.org/W2010112814	https://doi.org/10.1111/j.1745-6606.2008.00108.x	2008	Lisa J. Servon, Robert Kaestner
subfields	https://openalex.org/subfields/1802	https://openalex.org/W2025517427	https://doi.org/10.1016/j.tourman.2014.07.007	2014	Qiuju Luo, Dixi Zhong
subfields	https://openalex.org/subfields/1802	https://openalex.org/W2121538731	https://doi.org/10.1111/j.1365-2575.2007.00238.x	2007	Chao‐Min Chiu, Chao‐Sheng Chiu, Hae‐Ching Chang
subfields	https://openalex.org/subfields/1802	https://openalex.org/W2135211392	https://doi.org/10.3102/0091732x005001163	1977	Walter Doyle
subfields	https://openalex.org/subfields/1802	https://openalex.org/W2140641837	https://doi.org/10.6007/ijarbss.v1i2.35	2011	Biljana Angelova, Jusuf Zekiri
subfields	https://openalex.org/subfields/1802	https://openalex.org/W2269721265	https://doi.org/10.1362/146934715x14441363377999	2015	Yogesh K. Dwivedi, Kawaljeet Kaur Kapoor, Hsin Chen
subfields	https://openalex.org/subfields/1802	https://openalex.org/W2588316293	https://doi.org/10.3233/isu-170824	2017	Barend Mons, Cameron Neylon, Jan Velterop, Michel Dumontier, Luiz Olavo Bonino da Silva Santos, Mark D. Wilkinson
subfields	https://openalex.org/subfields/1802	https://openalex.org/W2911601159	https://doi.org/10.1017/s1471068411000494	2011	Jan Wielemaker, Tom Schrijvers, Markus Triska, Torbjörn Lager
subfields	https://openalex.org/subfields/1802	https://openalex.org/W1834899002	https://doi.org/10.1590/s1414-49802007000300004	2007	Telma Cristiane Sasso de Lima, Regina Célia Tamaso Mioto
subfields	https://openalex.org/subfields/1802	https://openalex.org/W2001298008	https://doi.org/10.1108/02652321011064881	2010	Pedro Cruz, Lineu Barretto Filgueiras Neto, Pablo Antonio Muñoz Gallego, Tommi Laukkanen
subfields	https://openalex.org/subfields/1802	https://openalex.org/W2005933613	https://doi.org/10.1016/j.ijinfomgt.2013.08.007	2013	Ilyoo Barry Hong, Seo Jang Hoon
subfields	https://openalex.org/subfields/1802	https://openalex.org/W2020313160	https://doi.org/10.1016/j.chb.2010.11.013	2010	Tao Zhou, Yaobin Lu
subfields	https://openalex.org/subfields/1802	https://openalex.org/W2032777240	https://doi.org/10.3200/joeb.82.1.11-19	2006	Randall S. Hansen
subfields	https://openalex.org/subfields/1802	https://openalex.org/W2037884024	https://doi.org/10.1007/s10551-010-0586-y	2010	Yves Fassin, Annick Van Rossem, Marc Buelens
subfields	https://openalex.org/subfields/1802	https://openalex.org/W2119037484		2010	Susan M. Mudambi, David Schuff
subfields	https://openalex.org/subfields/1802	https://openalex.org/W2768249236	https://doi.org/10.1016/j.im.2017.11.003	2017	Zhang Xing, Shan Liu, Chen Xing, Lin Wang, Baojun Gao, Qing Zhu
subfields	https://openalex.org/subfields/1802	https://openalex.org/W2779704869	https://doi.org/10.1016/j.ijinfomgt.2017.12.008	2017	Yulia Sullivan, Dan J. Kim
subfields	https://openalex.org/subfields/1802	https://openalex.org/W2910397568	https://doi.org/10.1016/j.jretconser.2019.01.005	2019	Elvira Ismagilova, Emma Slade, Nripendra P. Rana, Yogesh K. Dwivedi
subfields	https://openalex.org/subfields/1802	https://openalex.org/W1526362058	https://doi.org/10.1080/02642069.2015.1043278	2015	Nicole Koenig‐Lewis, Morgan Marquet, Adrian Palmer, Anita Lifen Zhao
subfields	https://openalex.org/subfields/1802	https://openalex.org/W1569270043	https://doi.org/10.1108/imds-01-2015-0028	2015	Jun-Jie Hew, Voon‐Hsien Lee, Keng‐Boon Ooi, June Wei
subfields	https://openalex.org/subfields/1802	https://openalex.org/W1596887687	https://doi.org/10.7476/9788575415474	2005	Maria Cecí­lia de Souza Minayo, Simone Gonçalves de Assis, Edinilsa Ramos de Souza
subfields	https://openalex.org/subfields/1802	https://openalex.org/W1982697094	https://doi.org/10.1016/j.ijinfomgt.2012.02.006	2012	Ling Zhao, Yaobin Lu, Bin Wang, Patrick Y.K. Chau, Long Zhang
subfields	https://openalex.org/subfields/1802	https://openalex.org/W2058781281	https://doi.org/10.1016/j.respol.2006.04.009	2006	Bhaven N. Sampat
subfields	https://openalex.org/subfields/1802	https://openalex.org/W2160139646	https://doi.org/10.1057/palgrave.jibs.8400396	2008	G. Tomas M. Hult, David J. Ketchen, David A. Griffith, Carol Finnegan, Tracy L. Gonzalez‐Padron, Nükhet Harmancioǧlu, Ying Huang, M. Berk Talay, S. Tamer Çavuşgil
subfields	https://openalex.org/subfields/1802	https://openalex.org/W2163084639	https://doi.org/10.1016/j.im.2008.03.005	2008	Banphot Vatanasombut, Magid Igbaria, Antonis C. Stylianou, Waymond Rodgers
subfields	https://openalex.org/subfields/1802	https://openalex.org/W2186382595	https://doi.org/10.22545/2010/0009	2010	Basarab Nicolescu
subfields	https://openalex.org/subfields/1802	https://openalex.org/W2340272442	https://doi.org/10.2307/41166735	1989	Frederick Bird, James A. Waters
subfields	https://openalex.org/subfields/1802	https://openalex.org/W2591606596	https://doi.org/10.1016/j.techfore.2017.02.014	2017	Simona Popa, Pedro Soto‐Acosta, Isabel Martinez-Conesa
subfields	https://openalex.org/subfields/1802	https://openalex.org/W2621857487	https://doi.org/10.1108/intr-06-2016-0164	2017	Chunmei Gan, Weijun Wang
subfields	https://openalex.org/subfields/1802	https://openalex.org/W2728794304	https://doi.org/10.1145/3123988	2017	Niels van Berkel, Denzil Ferreira, Vassilis Kostakos
subfields	https://openalex.org/subfields/1802	https://openalex.org/W2898605631	https://doi.org/10.1016/j.trf.2018.09.029	2018	Jingwen Wu, Hua Liao, Jinwei Wang, Tianqi Chen
subfields	https://openalex.org/subfields/1802	https://openalex.org/W4308834828	https://doi.org/10.1093/nar/gkac1040	2022	Eric W. Deutsch, Nuno Bandeira, Yasset Pérez‐Riverol, Vagisha Sharma, Jeremy Carver, Luis Mendoza, Deepti Jaiswal Kundu, Shengbo Wang, Chakradhar Bandla, Selvakumar Kamatchinathan, Suresh Hewapathirana, Benjamin Pullman, Julie Wertz, Zhi Sun, Shin Kawano, Shujiro Okuda, Yu Watanabe, Brendan MacLean, Michael J. MacCoss, Yunping Zhu, Yasushi Ishihama, Juan Antonio Vizcaíno
subfields	https://openalex.org/subfields/1802	https://openalex.org/W1534134546	https://doi.org/10.1108/02634500510577492	2005	Serkan Aydın, Gökhan Özer, Ömer Arasil
subfields	https://openalex.org/subfields/1802	https://openalex.org/W1931854307	https://doi.org/10.48550/arxiv.cs/0606079	2006	Chawki Hajjem, Stevan Harnad, Yves Gingras
subfields	https://openalex.org/subfields/1802	https://openalex.org/W1973783865	https://doi.org/10.1016/j.chb.2014.06.015	2014	Will W.K., Albert KM Chan
subfields	https://openalex.org/subfields/1802	https://openalex.org/W1982396665	https://doi.org/10.1007/s10551-007-9567-1	2007	Jennifer C. Chen, Dennis M. Patten, Robin W. Roberts
subfields	https://openalex.org/subfields/1802	https://openalex.org/W2020461989	https://doi.org/10.1007/bf00384207	1989	John Tsalikis, David J. Fritzsche
subfields	https://openalex.org/subfields/1802	https://openalex.org/W2039952808	https://doi.org/10.1016/j.shpsa.2007.09.003	2007	Harry Collins, Robert Evans, Mike Gorman
subfields	https://openalex.org/subfields/1802	https://openalex.org/W2057767067	https://doi.org/10.1007/s10551-007-9440-2	2007	Morela Hernandez
subfields	https://openalex.org/subfields/1802	https://openalex.org/W2083559660	https://doi.org/10.1016/j.trf.2010.11.006	2010	Ching‐Fu Chen, Wei-Hsiang Chao
subfields	https://openalex.org/subfields/1802	https://openalex.org/W2083703821	https://doi.org/10.1057/ejis.2009.50	2010	Liqiong Deng, Douglas E. Turner, Robert Gehling, Brad Prince
subfields	https://openalex.org/subfields/1802	https://openalex.org/W2117313724	https://doi.org/10.1016/j.jbusres.2008.01.023	2008	Rajesh Iyer, James A. Muncy
subfields	https://openalex.org/subfields/1802	https://openalex.org/W2135253400	https://doi.org/10.1177/0013161x06293631	2007	Jay Paredes Scribner, R. Keith Sawyer, Sheldon T. Watson, Vicki L. Myers
subfields	https://openalex.org/subfields/1802	https://openalex.org/W2146068062	https://doi.org/10.48550/arxiv.1309.5821	2013	Jonathan S. Ward, Adam Barker
subfields	https://openalex.org/subfields/1802	https://openalex.org/W3174372074		2007	Vinod Kumar, Bhasker Mukerji, Irfan Butt
subfields	https://openalex.org/subfields/1802	https://openalex.org/W4206441762	https://doi.org/10.1109/ms.1985.231038	1985	
subfields	https://openalex.org/subfields/1802	https://openalex.org/W1495823048		1989	Michael W. Hoffman, Jennifer Mills Moore
subfields	https://openalex.org/subfields/1802	https://openalex.org/W1949048907	https://doi.org/10.19173/irrodl.v8i2.356	2007	Agnes Kukulska‐Hulme
subfields	https://openalex.org/subfields/1802	https://openalex.org/W1963494573	https://doi.org/10.1080/14639220701561775	2008	Paul M. Salmon, Neville A. Stanton, Guy H. Walker, Chris Baber, Daniel P. Jenkins, Richard McMaster, Mark S. Young
subfields	https://openalex.org/subfields/1802	https://openalex.org/W1999246676	https://doi.org/10.1016/j.chb.2012.11.007	2013	Reynol Junco
subfields	https://openalex.org/subfields/1802	https://openalex.org/W2030925008	https://doi.org/10.1007/s10551-010-0469-2	2010	Susanne Arvidsson
subfields	https://openalex.org/subfields/1802	https://openalex.org/W2082924376	https://doi.org/10.1016/j.eswa.2012.08.067	2012	Alain Yee‐Loong Chong
subfields	https://openalex.org/subfields/1802	https://openalex.org/W2089550626	https://doi.org/10.1080/00140130802170387	2008	Jan Noyes, Kate Garland
subfields	https://openalex.org/subfields/1802	https://openalex.org/W2100875432	https://doi.org/10.5465/amr.2010.0018	2011	Howard J. Klein, Janice C. Molloy, Chad T. Brinsfield
subfields	https://openalex.org/subfields/1802	https://openalex.org/W2266689939	https://doi.org/10.1086/681925	2015	Roger D. Goddard, Yvonne Goddard, Eunsook Kim, Robert J. Miller
subfields	https://openalex.org/subfields/1802	https://openalex.org/W2308521985	https://doi.org/10.1080/19312458.2015.1118446	2016	Michael Scharkow
subfields	https://openalex.org/subfields/1802	https://openalex.org/W2412243698	https://doi.org/10.1016/j.ibusrev.2016.05.009	2016	Jennifer Martínez‐Ferrero, Isabel Sánchez
subfields	https://openalex.org/subfields/1802	https://openalex.org/W2554914275	https://doi.org/10.1016/j.chb.2016.11.001	2016	Jon‐Chao Hong, Pei‐Hsin Lin, Pei-Chi Hsieh
subfields	https://openalex.org/subfields/1802	https://openalex.org/W3035240583	https://doi.org/10.1016/j.intmar.2020.05.001	2020	Hamidreza Shahbaznezhad, Rebecca Dolan, Mona Rashidirad
subfields	https://openalex.org/subfields/1802	https://openalex.org/W3133543405	https://doi.org/10.3390/electronics10050593	2021	Jianlong Zhou, Amir H. Gandomi, Fang Chen, Andreas Holzinger
subfields	https://openalex.org/subfields/1802	https://openalex.org/W317100620	https://doi.org/10.1016/j.jretai.2015.04.001	2015	Alexander Bleier, Maik Eisenbeiß
subfields	https://openalex.org/subfields/1802	https://openalex.org/W2001600087	https://doi.org/10.1108/09564230510625741	2005	Yu‐Bin Chiu, Chieh‐Peng Lin, Ling-Lang Tang
subfields	https://openalex.org/subfields/1802	https://openalex.org/W2019919421	https://doi.org/10.1007/s10833-009-9108-z	2009	Michael Fullan
subfields	https://openalex.org/subfields/1802	https://openalex.org/W2030874059	https://doi.org/10.1007/s11422-005-9009-2	2006	Karen L. Tonso
subfields	https://openalex.org/subfields/1802	https://openalex.org/W2046010418	https://doi.org/10.1108/07363761011038338	2010	Kiseol Yang
subfields	https://openalex.org/subfields/1802	https://openalex.org/W2060298340	https://doi.org/10.1016/j.ijhm.2014.10.014	2014	Woo Gon Kim, Hyun-Jung Lim, Robert A. Brymer
subfields	https://openalex.org/subfields/1802	https://openalex.org/W2070360982	https://doi.org/10.1016/j.sbspro.2014.07.025	2014	Mohd Irwan Dahnil, Kamarul Mizal Marzuki, Juliana Langgat, Noor Fzlinda Fabeil
subfields	https://openalex.org/subfields/1802	https://openalex.org/W2117823027	https://doi.org/10.1016/j.compedu.2012.11.022	2012	Amanda Szapkiw, Jennifer Courduff, Kimberly Carter, David Bennett
subfields	https://openalex.org/subfields/1802	https://openalex.org/W2134729569	https://doi.org/10.1007/s10551-006-9276-1	2007	Pascual Berrone, Jordi Surroca, Josep A. Tribó
subfields	https://openalex.org/subfields/1802	https://openalex.org/W2140993268	https://doi.org/10.1145/1459352.1459356	2009	Alicia Iriberri, Gondy Leroy
subfields	https://openalex.org/subfields/1802	https://openalex.org/W2198115191	https://doi.org/10.1016/j.chb.2015.03.058	2015	Qing Yang, Chuan Pang, Liu Liu, David C. Yen, J. Michael Tarn
subfields	https://openalex.org/subfields/1802	https://openalex.org/W2796948825	https://doi.org/10.1016/j.jik.2018.03.004	2018	Romana Rauter, Dietfried Globocnik, Elke Perl-Vorbach, Rupert J. Baumgartner
subfields	https://openalex.org/subfields/1802	https://openalex.org/W2981252154	https://doi.org/10.1016/j.compedu.2019.103732	2019	Hamaad Rafique, Alaa Omran Almagrabi, Azra Shamim, Fozia Anwar, Ali Kashif Bashir
subfields	https://openalex.org/subfields/1802	https://openalex.org/W3123395216	https://doi.org/10.1353/jhr.2010.0023	2010	Charles T. Clotfelter, Helen F. Ladd, Jacob L. Vigdor
subfields	https://openalex.org/subfields/1802	https://openalex.org/W4205389984	https://doi.org/10.1787/9789264096660-en	2011	
subfields	https://openalex.org/subfields/1802	https://openalex.org/W4252907027	https://doi.org/10.1016/0361-3682(76)90007-6	1976	Lawrence A. Gordon, Danny Miller
subfields	https://openalex.org/subfields/1802	https://openalex.org/W1517903066	https://doi.org/10.19173/irrodl.v14i5.1631	2013	Ahmad Abu-Al-Aish, Steve Love
subfields	https://openalex.org/subfields/1802	https://openalex.org/W1904353740	https://doi.org/10.1027/1015-5759.21.3.202	2005	Manfred Schmitt, Mario Gollwitzer, Jürgen Maes, Dima Arbach
subfields	https://openalex.org/subfields/1802	https://openalex.org/W2006783182	https://doi.org/10.1287/mnsc.23.9.913	1977	Gary W. Dickson, James A. Senn, Norman L. Chervany
subfields	https://openalex.org/subfields/1802	https://openalex.org/W2049801154	https://doi.org/10.1016/j.intmar.2013.04.004	2013	Fernando R. Jiménez, Norma A. Mendoza
subfields	https://openalex.org/subfields/1802	https://openalex.org/W2056197375	https://doi.org/10.1108/09600030910962249	2009	Scott J. Grawe, Haozhe Chen, Patricia J. Daugherty
subfields	https://openalex.org/subfields/1802	https://openalex.org/W2061100441	https://doi.org/10.1007/s10551-013-2044-0	2014	Simon S. M. Ho, Annie Yuansha Li, Kinsun Tam, Feida Zhang
subfields	https://openalex.org/subfields/1802	https://openalex.org/W2099979943	https://doi.org/10.1016/j.jom.2012.03.001	2012	Lih‐Bin Oh, Hock‐Hai Teo, V. Sambamurthy
subfields	https://openalex.org/subfields/1802	https://openalex.org/W2102988147		2015	Jay H. Bernstein
subfields	https://openalex.org/subfields/1802	https://openalex.org/W2138254348	https://doi.org/10.1177/1350507608099315	2009	Ann L. Cunliffe
subfields	https://openalex.org/subfields/1802	https://openalex.org/W3215397911		2010	Julie Thompson Klein
subfields	https://openalex.org/subfields/1802	https://openalex.org/W1540163242	https://doi.org/10.2307/20721434	2010	Riedl, Hubert, Kenning
subfields	https://openalex.org/subfields/1802	https://openalex.org/W1890874870	https://doi.org/10.7326/m15-0288	2015	Wendy P. Battisti, Elizabeth Wager, Lise Baltzer, Daniel Bridges, Angela Cairns, Chris Carswell, Leslie Citrome, James A. Gurr, LaVerne A. Mooney, B. Moore, Teresa Peña, Carol H. Sanes-Miller, Keith Veitch, Karen L. Woolley, Yvonne E. Yarker
subfields	https://openalex.org/subfields/1802	https://openalex.org/W1987796771	https://doi.org/10.1111/j.1467-8608.2009.01547.x	2008	Eva‐Maria Hammann, André Habisch, Harald Pechlaner
subfields	https://openalex.org/subfields/1802	https://openalex.org/W2038781021	https://doi.org/10.1016/j.ijhcs.2006.10.002	2006	Duke Hyun Choi, Jeoungkun Kim, Soung Hie Kim
subfields	https://openalex.org/subfields/1802	https://openalex.org/W2083600191	https://doi.org/10.1037/h0026566	1968	Norma Haan, M. Brewster Smith, Jeanne H. Block
subfields	https://openalex.org/subfields/1802	https://openalex.org/W2131217004	https://doi.org/10.1287/isre.1050.0044	2005	Ann Majchrzak, Arvind Malhotra, Richard S. John
subfields	https://openalex.org/subfields/1802	https://openalex.org/W2162528252	https://doi.org/10.1145/1084805.1084816	2005	Marek Wieczorek, Radu Prodan, Thomas Fahringer
subfields	https://openalex.org/subfields/1802	https://openalex.org/W2585591443	https://doi.org/10.1186/s12916-017-0785-9	2017	Larissa Shamseer, David Moher, Onyi Maduekwe, Lucy Turner, Virginia Barbour, Rebecca Burch, Jocalyn Clark, James Galipeau, Jason Roberts, Beverley Shea
subfields	https://openalex.org/subfields/1802	https://openalex.org/W2803120221	https://doi.org/10.1037/amp0000319	2018	Kara L. Hall, Amanda L. Vogel, Grace C. Huang, Katrina J. Serrano, Elise L. Rice, Sophia Tsakraklides, Stephen M. Fiore
subfields	https://openalex.org/subfields/1802	https://openalex.org/W3126046482	https://doi.org/10.2753/mis0742-1222240408	2008	Paul Benjamin Lowry, Anthony Vance, Greg Moody, Bryan Beckman, Aaron Read
subfields	https://openalex.org/subfields/1802	https://openalex.org/W1968755738	https://doi.org/10.1037/a0020540	2010	Stefan Thau, Marie S. Mitchell
subfields	https://openalex.org/subfields/1802	https://openalex.org/W1972605989	https://doi.org/10.1111/j.1468-0017.2012.01438.x	2012	Eric Schwitzgebel, Fiery Cushman
subfields	https://openalex.org/subfields/1802	https://openalex.org/W2001404751	https://doi.org/10.1016/j.giq.2008.07.001	2008	Yi‐Shun Wang, Ying-Wei Shih
subfields	https://openalex.org/subfields/1802	https://openalex.org/W2011728184	https://doi.org/10.1108/02635571011039052	2010	Zahra Tohidinia, Mohammad Mosakhani
subfields	https://openalex.org/subfields/1802	https://openalex.org/W2021559938	https://doi.org/10.2753/mis0742-1222240103	2007	Jahangir Karim, Toni M. Somers, Anol Bhattacherjee
subfields	https://openalex.org/subfields/1802	https://openalex.org/W2084547592	https://doi.org/10.1016/j.ijhm.2011.02.001	2011	Fu-Hsiang Chen, Tsung‐Shin Hsu, Gwo‐Hshiung Tzeng
subfields	https://openalex.org/subfields/1802	https://openalex.org/W2158842434	https://doi.org/10.1186/s13336-015-0019-3	2015	Christian Castañeda, Kip Nalley, Ciaran Mannion, Pritish K. Bhattacharyya, Patrick Blake, Andrew L. Pecora, André Goy, K. Stephen Suh
subfields	https://openalex.org/subfields/1802	https://openalex.org/W4251526763	https://doi.org/10.5007/2175-8069	2011	
subfields	https://openalex.org/subfields/1802	https://openalex.org/W1985015312	https://doi.org/10.1016/j.chb.2015.03.051	2015	Milad Dehghani, Mustafa Tümer
subfields	https://openalex.org/subfields/1802	https://openalex.org/W2059615651	https://doi.org/10.1016/j.annals.2014.04.008	2014	Dan Wang, Zheng Xiang, Daniel R. Fesenmaier
subfields	https://openalex.org/subfields/1802	https://openalex.org/W2062962404	https://doi.org/10.1016/j.jbusres.2009.12.007	2010	Youjae Yi, Rajan Nataraajan, Taeshik Gong
subfields	https://openalex.org/subfields/1802	https://openalex.org/W2107522226	https://doi.org/10.1016/j.dss.2012.12.032	2013	Mutaz M. Al‐Debei, Enas Al-Lozi, Anastasia Papazafeiropoulou
subfields	https://openalex.org/subfields/1802	https://openalex.org/W2121268130	https://doi.org/10.1177/0170840611410829	2011	Judy Wajcman, Emily Rose
subfields	https://openalex.org/subfields/1802	https://openalex.org/W2150449980	https://doi.org/10.1002/cb.46	2006	Barbara R. Lewis, Magdalini Soureli
subfields	https://openalex.org/subfields/1802	https://openalex.org/W2324109975	https://doi.org/10.2307/255626	1975	Ruth Taylor
subfields	https://openalex.org/subfields/1802	https://openalex.org/W2560023328	https://doi.org/10.1108/itp-02-2014-0034	2016	Ali Tarhini, Mazen El-Masri, Maged Ali, Alan Serrano
subfields	https://openalex.org/subfields/1802	https://openalex.org/W2734256217	https://doi.org/10.1109/tkde.2017.2720168	2017	Anuj Karpatne, Gowtham Atluri, James H. Faghmous, Michael Steinbach, Arindam Banerjee, Auroop R. Ganguly, Shashi Shekhar, Nagiza Samatova, Vipin Kumar
subfields	https://openalex.org/subfields/1802	https://openalex.org/W2798247400	https://doi.org/10.1016/j.cose.2018.04.002	2018	Nina Gerber, Paul Gerber, Melanie Volkamer
subfields	https://openalex.org/subfields/1802	https://openalex.org/W1486942185	https://doi.org/10.3389/fevo.2015.00065	2015	Suzanne M. Prober, Margaret Byrne, Elizabeth H. McLean, Dorothy A. Steane, BM Potts, René E. Vaillancourt, William D. Stock
subfields	https://openalex.org/subfields/1802	https://openalex.org/W1969579869	https://doi.org/10.3758/s13428-014-0533-4	2014	Timo Gnambs, Kai Kaspar
subfields	https://openalex.org/subfields/1802	https://openalex.org/W1981261334	https://doi.org/10.1016/j.ipm.2008.07.005	2008	Yuelin Li, Nicholas J. Belkin
subfields	https://openalex.org/subfields/1802	https://openalex.org/W1984560652	https://doi.org/10.1016/j.leaqua.2012.03.001	2012	Silke Astrid Eisenbeiß
subfields	https://openalex.org/subfields/1802	https://openalex.org/W1999806522	https://doi.org/10.1108/imds-08-2014-0243	2015	Yongqing Yang, Liu Yong, Hongxiu Li, Yu Ben-Hai
subfields	https://openalex.org/subfields/1802	https://openalex.org/W2044398113	https://doi.org/10.1086/208817	1980	William L. Moore, Donald R. Lehmann
subfields	https://openalex.org/subfields/1802	https://openalex.org/W2126168061	https://doi.org/10.1108/jstpm-04-2014-0012	2015	Hart O. Awa, Ojiabo Ukoha Ojiabo, Bartholomew C. Emecheta
