category	entry_id	openalex_id	doi	publication_year	authors
subfields	https://openalex.org/subfields/1802	https://openalex.org/W1970550904	https://doi.org/10.2307/1862021	1978	Merritt Roe Smith, David F. Noble
subfields	https://openalex.org/subfields/1802	https://openalex.org/W2072237339	https://doi.org/10.1016/j.cpa.2014.10.003	2014	Giovanna Michelon, Silvia Pilonato, Federica Ricceri
subfields	https://openalex.org/subfields/1802	https://openalex.org/W2134809483	https://doi.org/10.1016/j.intmar.2013.09.004	2013	Sonja Gensler, Franziska Völckner, Yuping Liu–Thompkins, Caroline Wiertz
subfields	https://openalex.org/subfields/1802	https://openalex.org/W2082598116	https://doi.org/10.1080/00420980050003946	2000	Peter Hall
subfields	https://openalex.org/subfields/1802	https://openalex.org/W4240169286	https://doi.org/10.31219/osf.io/2zuhk	2020	Quan‐Hoang Vuong
subfields	https://openalex.org/subfields/1802	https://openalex.org/W2021945153	https://doi.org/10.5860/choice.46-1586	2008	Charlene Li, Josh Bernoff
subfields	https://openalex.org/subfields/1802	https://openalex.org/W2089258835	https://doi.org/10.1037/0021-9010.72.2.307	1987	Thomas Hill, Nancy D. Smith, Millard F. Mann
subfields	https://openalex.org/subfields/1802	https://openalex.org/W2124752314	https://doi.org/10.1111/j.1751-9004.2010.00263.x	2010	Anna C. Merritt, Daniel A. Effron, Benoît Monin
subfields	https://openalex.org/subfields/1802	https://openalex.org/W2127600301	https://doi.org/10.1016/j.obhdp.2010.11.002	2010	Fred O. Walumbwa, David M. Mayer, Peng Wang, Hui Wang, Kristina Marie Workman, Amanda L. Christensen
subfields	https://openalex.org/subfields/1802	https://openalex.org/W2156438052	https://doi.org/10.1016/j.dss.2009.02.005	2009	Tejaswini Herath, H. Raghav Rao
subfields	https://openalex.org/subfields/1802	https://openalex.org/W2903429044	https://doi.org/10.1016/j.ijinfomgt.2018.11.021	2018	Maciel M. Queiroz, Samuel Fosso Wamba
subfields	https://openalex.org/subfields/1802	https://openalex.org/W2049124404	https://doi.org/10.1145/1182475.1182476	2006	Susanne Bødker
subfields	https://openalex.org/subfields/1802	https://openalex.org/W1995046486	https://doi.org/10.2753/jec1086-4415110302	2007	Eleanor T. Loiacono, Richard T. Watson, Dale L. Goodhue
subfields	https://openalex.org/subfields/1802	https://openalex.org/W2160688157	https://doi.org/10.1016/j.compedu.2004.11.007	2005	Eric W.T. Ngai, J. K. L. Poon, Y.H.C. Chan
subfields	https://openalex.org/subfields/1802	https://openalex.org/W2166264800	https://doi.org/10.3102/00346543073002125	2003	Geoffrey D. Borman, Gina M. Hewes, Laura Overman, Shelly Brown
subfields	https://openalex.org/subfields/1802	https://openalex.org/W1758167268	https://doi.org/10.2307/25148691	2005	Ahuja, Jason Bennett Thatcher
subfields	https://openalex.org/subfields/1802	https://openalex.org/W1985187994	https://doi.org/10.2307/256963	1998	Sandra L. Robinson, Anne M. O'Leary‐Kelly
subfields	https://openalex.org/subfields/1802	https://openalex.org/W4239513951	https://doi.org/10.1037/0096-1523.15.2.315	1989	Hermann J. Müller, Patrick Rabbitt
subfields	https://openalex.org/subfields/1802	https://openalex.org/W2116201926	https://doi.org/10.1016/s0272-6963(01)00090-0	2002	Susan Meyer Goldstein, Robert B. Johnston, JoAnn Duffy, Jay Rao
subfields	https://openalex.org/subfields/1802	https://openalex.org/W2293299776	https://doi.org/10.1145/1265530.1265535	2007	Todd J. Green, Grigoris Karvounarakis, Val Tannen
subfields	https://openalex.org/subfields/1802	https://openalex.org/W2033043005	https://doi.org/10.1007/s10551-006-9047-z	2006	Thomas Maak, Nicola M. Pless
subfields	https://openalex.org/subfields/1802	https://openalex.org/W2036625316	https://doi.org/10.1145/985692.985715	2004	Mary Czerwinski, Eric Horvitz, Susan Wilhite
subfields	https://openalex.org/subfields/1802	https://openalex.org/W2086838148	https://doi.org/10.1016/s0022-4359(01)00051-3	2001	Soyeon Shim, Mary Ann Eastlick, Sherry Lotz, Patricia T. Warrington
subfields	https://openalex.org/subfields/1802	https://openalex.org/W2114445079	https://doi.org/10.1177/017084069401500307	1994	Mikael Søndergaard
subfields	https://openalex.org/subfields/1802	https://openalex.org/W2010599172	https://doi.org/10.1016/j.ijhm.2013.08.007	2013	Antoni Serra Cantallops, Fabiana Salvi
subfields	https://openalex.org/subfields/1802	https://openalex.org/W2126297142	https://doi.org/10.2466/pr0.1992.71.2.499	1992	Tuntufye S. Mwamwenda
subfields	https://openalex.org/subfields/1802	https://openalex.org/W2141167937	https://doi.org/10.2753/mis0742-1222290401	2013	Stacie Petter, William DeLone, Ephraim R. McLean
subfields	https://openalex.org/subfields/1802	https://openalex.org/W2141344980	https://doi.org/10.1145/143457.143549	1992	Wanda J. Orlikowski
subfields	https://openalex.org/subfields/1802	https://openalex.org/W1588021794	https://doi.org/10.5860/choice.47-0374	2009	Lon Safko
subfields	https://openalex.org/subfields/1802	https://openalex.org/W1999697037	https://doi.org/10.1108/08876040010327220	2000	Haksik Lee, Yong‐Ki Lee, Dong-Keun Yoo
subfields	https://openalex.org/subfields/1802	https://openalex.org/W2085756167	https://doi.org/10.1016/j.elerap.2007.12.001	2008	Do-Hyung Park, Sara Kim
subfields	https://openalex.org/subfields/1802	https://openalex.org/W4210248375	https://doi.org/10.1037/h0051392	1952	C. R. Langmuir
subfields	https://openalex.org/subfields/1802	https://openalex.org/W2125475233	https://doi.org/10.1287/isre.1090.0260	2010	Janice Tsai, Serge Egelman, Lorrie Faith Cranor, Alessandro Acquisti
subfields	https://openalex.org/subfields/1802	https://openalex.org/W2222174245	https://doi.org/10.1080/10447318.2015.1087664	2015	Matt C. Howard
subfields	https://openalex.org/subfields/1802	https://openalex.org/W39280257		1996	Stefan Jablonski
subfields	https://openalex.org/subfields/1802	https://openalex.org/W1525683663		2011	Erik Mooi, Marko Sarstedt
subfields	https://openalex.org/subfields/1802	https://openalex.org/W2035731507	https://doi.org/10.1016/j.giq.2007.06.002	2007	Yi‐Shun Wang, Yi-Wen Liao
subfields	https://openalex.org/subfields/1802	https://openalex.org/W2041956344	https://doi.org/10.1002/csr.229	2010	Kathy Babiak, Sylvia Trendafilova
subfields	https://openalex.org/subfields/1802	https://openalex.org/W1508402401	https://doi.org/10.5860/choice.39-4072	2002	Peter Weill, Michael R. Vitale
subfields	https://openalex.org/subfields/1802	https://openalex.org/W2036491738	https://doi.org/10.4324/9781315263465-43	2017	Donald L. McCabe, Linda Klebe Treviño
subfields	https://openalex.org/subfields/1802	https://openalex.org/W2047036688	https://doi.org/10.1177/0092070303254408	2003	Mitzi M. Montoya‐Weiss, Glenn B. Voss, Dhruv Grewal
subfields	https://openalex.org/subfields/1802	https://openalex.org/W2011018556	https://doi.org/10.1108/02652320510629250	2005	Sylvie Laforet, Xiaoyan Li
subfields	https://openalex.org/subfields/1802	https://openalex.org/W2083610746	https://doi.org/10.1520/jte12551j	1991	A. Wolfenden, BM Strauss
subfields	https://openalex.org/subfields/1802	https://openalex.org/W2102102516	https://doi.org/10.1023/a:1014033032440	2002	Gustavo Carlo, Brandy A. Randall
subfields	https://openalex.org/subfields/1802	https://openalex.org/W2020214787	https://doi.org/10.1109/2.237456	1993	Mark Weiser
subfields	https://openalex.org/subfields/1802	https://openalex.org/W2046004785	https://doi.org/10.1093/oxfordjournals.jpart.a024390	1998	Gene A. Brewer, Sally Coleman Selden
subfields	https://openalex.org/subfields/1802	https://openalex.org/W2081823153	https://doi.org/10.1016/j.dss.2006.01.002	2006	T.C.E. Cheng, David Y.C. Lam, Andy C.L. Yeung
subfields	https://openalex.org/subfields/1802	https://openalex.org/W2246039188		2013	Bernadete do Rocio Pieper
subfields	https://openalex.org/subfields/1802	https://openalex.org/W3008231817	https://doi.org/10.1007/s11192-020-03387-8	2020	Junwen Zhu, Weishu Liu
subfields	https://openalex.org/subfields/1802	https://openalex.org/W3018610472	https://doi.org/10.3102/0013189x20912798	2020	Matthew A. Kraft
subfields	https://openalex.org/subfields/1802	https://openalex.org/W2034534447	https://doi.org/10.5840/beq201020439	2010	Michael E. Brown, Marie S. Mitchell
subfields	https://openalex.org/subfields/1802	https://openalex.org/W2116676072	https://doi.org/10.1287/isre.1040.0028	2004	Sirkka L. Järvenpää, Thomas Shaw, D. Sandy Staples
subfields	https://openalex.org/subfields/1802	https://openalex.org/W2216374586	https://doi.org/10.1556/2006.4.2015.037	2015	Severin Haug, Raquel Paz Castro, Min Jeong Kwon, Andreas Filler, Tobias Kowatsch, Michael P Schaub
subfields	https://openalex.org/subfields/1802	https://openalex.org/W4245266864	https://doi.org/10.1109/focs.2004.4	2004	
subfields	https://openalex.org/subfields/1802	https://openalex.org/W2071943694	https://doi.org/10.1108/14637150510619902	2005	Zakareya Ebrahim, Zahir Irani
subfields	https://openalex.org/subfields/1802	https://openalex.org/W4393020831	https://doi.org/10.7202/cjeap	2024	
subfields	https://openalex.org/subfields/1802	https://openalex.org/W2133085133	https://doi.org/10.1080/13527266.2013.871323	2014	Bruno Schivinski, Dariusz Dąbrowski
subfields	https://openalex.org/subfields/1802	https://openalex.org/W2160398179	https://doi.org/10.1177/014920630002600306	2000	Mary A. Konovsky
subfields	https://openalex.org/subfields/1802	https://openalex.org/W2145896244	https://doi.org/10.1207/s15430421tip4104_4	2002	Richard E. Mayer
subfields	https://openalex.org/subfields/1802	https://openalex.org/W613116134		2012	Harrison C. White
subfields	https://openalex.org/subfields/1802	https://openalex.org/W2898432261	https://doi.org/10.5765/jkacap.180021	2018	Hee‐Jeong Yoo
subfields	https://openalex.org/subfields/1802	https://openalex.org/W1496306958		1993	Joyce P. Gall, Meredith D. Gall, Walter R. Borg
subfields	https://openalex.org/subfields/1802	https://openalex.org/W3124360010	https://doi.org/10.1016/j.jbusres.2006.01.021	2006	Hans H. Bauer, Tomas Falk, Maik Hammerschmidt
subfields	https://openalex.org/subfields/1802	https://openalex.org/W1482244801	https://doi.org/10.1108/14684520810923953	2008	Hsin Hsin Chang, Su Wen Chen
subfields	https://openalex.org/subfields/1802	https://openalex.org/W2012739272	https://doi.org/10.1046/j.1365-2575.2002.00132.x	2002	Shari S. C. Shang, Peter B. Seddon
subfields	https://openalex.org/subfields/1802	https://openalex.org/W2095863122	https://doi.org/10.2307/25148853	2008	Venkatesh, Susan A. Brown, Likoebe M. Maruping, Hillol Bala
subfields	https://openalex.org/subfields/1802	https://openalex.org/W2119400430	https://doi.org/10.14778/1454159.1454166	2008	Ronnie Chaiken, B. Keith Jenkins, Per-Åke Larson, Bill Ramsey, Darren Shakib, Simon Weaver, Jingren Zhou
subfields	https://openalex.org/subfields/1802	https://openalex.org/W2922234936	https://doi.org/10.1109/icse-seip.2019.00042	2019	Saleema Amershi, Andrew Begel, Christian Bird, Robert DeLine, Harald C. Gall, Ece Kamar, Nachiappan Nagappan, Besmira Nushi, Thomas Zimmermann
subfields	https://openalex.org/subfields/1802	https://openalex.org/W2041591938	https://doi.org/10.1016/s0010-4655(00)00065-5	2000	Ricky A. Kendall, Edoardo Aprà, David E. Bernholdt, Eric J. Bylaska, Michel Dupuis, George I. Fann, Robert J. Harrison, Jialin Ju, Jeffrey A. Nichols, Jarek Nieplocha, Tjerk P. Straatsma, Theresa L. Windus, Adrian T. Wong
subfields	https://openalex.org/subfields/1802	https://openalex.org/W2131451765	https://doi.org/10.1128/aem.69.6.3593-3599.2003	2003	Colin D. Campbell, Stephen J. Chapman, Clare Cameron, M.S. Davidson, Jacqueline M. Potts
subfields	https://openalex.org/subfields/1802	https://openalex.org/W2209024180	https://doi.org/10.1016/j.chb.2015.04.024	2015	Gonçalo Baptista, Tiago Oliveira
subfields	https://openalex.org/subfields/1802	https://openalex.org/W3124973809	https://doi.org/10.1111/j.1540-5885.2006.00203.x	2006	Nikolaus Franke, Eric von Hippel, Martin Schreier
subfields	https://openalex.org/subfields/1802	https://openalex.org/W1508185183	https://doi.org/10.1080/07421222.2004.11045797	2004	Kevin Zhu, Kenneth L. Kraemer, Jason Dedrick
subfields	https://openalex.org/subfields/1802	https://openalex.org/W1572210709	https://doi.org/10.17705/1jais.00120	2007	Viswanath Venkatesh, Fred D. Davis, Michael G. Morris
subfields	https://openalex.org/subfields/1802	https://openalex.org/W2013637770	https://doi.org/10.1111/j.1467-8608.2006.00466.x	2007	Jane Collier, Rafael José Esteban de la Rosa
subfields	https://openalex.org/subfields/1802	https://openalex.org/W2024120027	https://doi.org/10.1086/444197	1998	Karen Seashore Louis, Helen M. Marks
subfields	https://openalex.org/subfields/1802	https://openalex.org/W2050421060	https://doi.org/10.1016/j.compedu.2012.12.003	2012	Ronnie Cheung, Doug Vogel
subfields	https://openalex.org/subfields/1802	https://openalex.org/W2318035687	https://doi.org/10.1016/0377-2217(83)90101-7	1983	Peter Bennett
subfields	https://openalex.org/subfields/1802	https://openalex.org/W3122152026	https://doi.org/10.1016/j.jpubeco.2004.08.004	2004	Brian Jacob
subfields	https://openalex.org/subfields/1802	https://openalex.org/W2141268236	https://doi.org/10.1109/3468.852435	2000	Anol Bhattacherjee
subfields	https://openalex.org/subfields/1802	https://openalex.org/W2294044876	https://doi.org/10.17705/1jais.00065	2005	Izak Benbasat, Weiquan Wang
subfields	https://openalex.org/subfields/1802	https://openalex.org/W2068322856	https://doi.org/10.1111/j.1540-5915.1994.tb01868.x	1994	William J. Kettinger, Choong C. Lee
subfields	https://openalex.org/subfields/1802	https://openalex.org/W3124090698	https://doi.org/10.1002/smj.2407	2015	Aaron Chatterji, Rodolphe Durand, David I. Levine, Samuel Touboul
subfields	https://openalex.org/subfields/1802	https://openalex.org/W3125332982	https://doi.org/10.1007/s10551-007-9609-8	2007	Krishna Udayasankar
subfields	https://openalex.org/subfields/1802	https://openalex.org/W4235243453	https://doi.org/10.18637/jss.v059.i10	2014	Hadley Wickham
subfields	https://openalex.org/subfields/1802	https://openalex.org/W2990531823		1979	Hershey H. Friedman, Linda Weiser Friedman
subfields	https://openalex.org/subfields/1802	https://openalex.org/W4252541056	https://doi.org/10.17226/11153	2004	
subfields	https://openalex.org/subfields/1802	https://openalex.org/W2040111550	https://doi.org/10.1016/j.jbusres.2013.05.002	2013	Kevin Trainor, Adam Rapp
subfields	https://openalex.org/subfields/1802	https://openalex.org/W2062146188	https://doi.org/10.1177/002224299305700403	1993	Gregory T. Gundlach, Patrick E. Murphy
subfields	https://openalex.org/subfields/1802	https://openalex.org/W2099008647	https://doi.org/10.1111/j.1540-627x.2012.00354.x	2012	Vinit Parida, Mats Westerberg, Johan Frishammar
subfields	https://openalex.org/subfields/1802	https://openalex.org/W2954503794	https://doi.org/10.1609/aimag.v40i2.2850	2019	David Gunning, David W. Aha
subfields	https://openalex.org/subfields/1802	https://openalex.org/W2525730749	https://doi.org/10.5860/choice.37-0274	1999	
subfields	https://openalex.org/subfields/1802	https://openalex.org/W2034338878	https://doi.org/10.1111/j.1540-5915.1997.tb01315.x	1997	Cynthia Jackson, Simeon Chow, Robert A. Leitch
subfields	https://openalex.org/subfields/1802	https://openalex.org/W2102567586	https://doi.org/10.2307/25148693	2005	Beaudry, Pinsonneault
subfields	https://openalex.org/subfields/1802	https://openalex.org/W2153501322	https://doi.org/10.1007/s10551-005-0849-1	2005	Jessica Mesmer‐Magnus, Chockalingam Viswesvaran
subfields	https://openalex.org/subfields/1802	https://openalex.org/W4230451384	https://doi.org/10.1093/acprof:oso/9780199573127.001.0001	2012	Maciej Lewenstein, Anna Sanpera, V. Ahufinger
subfields	https://openalex.org/subfields/1802	https://openalex.org/W1559269151	https://doi.org/10.1080/07421222.1994.11518035	1994	Ronald L. Thompson, Christopher A. Higgins, Jane M. Howell
subfields	https://openalex.org/subfields/1802	https://openalex.org/W2009995238	https://doi.org/10.1016/j.econedurev.2007.10.002	2007	Charles T. Clotfelter, Helen F. Ladd, Jacob L. Vigdor
subfields	https://openalex.org/subfields/1802	https://openalex.org/W2560183295	https://doi.org/10.5860/choice.30-1065	1992	
subfields	https://openalex.org/subfields/1802	https://openalex.org/W1974816463	https://doi.org/10.1108/eb026918	1993	Carol C. Kuhlthau
subfields	https://openalex.org/subfields/1802	https://openalex.org/W2143225719	https://doi.org/10.1016/j.earscirev.2006.05.001	2006	Jane Hart, Kirk Martinez
subfields	https://openalex.org/subfields/1802	https://openalex.org/W2162111811	https://doi.org/10.1145/2043932.2043962	2011	Pearl Pu, Li Chen, Rong Hu
subfields	https://openalex.org/subfields/1802	https://openalex.org/W4214702734	https://doi.org/10.1142/9789814287067_0013	2010	Robert C. Blattberg, John Deighton
subfields	https://openalex.org/subfields/1802	https://openalex.org/W2055353381	https://doi.org/10.1287/mnsc.36.1.76	1990	Nancy Paule Melone
subfields	https://openalex.org/subfields/1802	https://openalex.org/W2113840470	https://doi.org/10.1016/j.im.2006.08.009	2006	Dianne Cyr, Milena Head, Alex Ivanov
subfields	https://openalex.org/subfields/1802	https://openalex.org/W2166016744	https://doi.org/10.1111/0161-4681.00057	2000	David K. Cohen, Heather C. Hill
subfields	https://openalex.org/subfields/1802	https://openalex.org/W618002855		2005	J. Hair, B. Babin, A. Money, P. Samouel
subfields	https://openalex.org/subfields/1802	https://openalex.org/W1489143527	https://doi.org/10.1016/s0166-4115(08)62387-0	1988	Gary B. Reid, Thomas E. Nygren
subfields	https://openalex.org/subfields/1802	https://openalex.org/W1976012759	https://doi.org/10.1016/s0167-9236(98)00061-x	1998	Ting‐Peng Liang, Jin-Shiang Huang
subfields	https://openalex.org/subfields/1802	https://openalex.org/W2081330205	https://doi.org/10.1016/j.tourman.2010.01.011	2010	Myung Ja Kim, Namho Chung, Choong‐Ki Lee
subfields	https://openalex.org/subfields/1802	https://openalex.org/W2108738598	https://doi.org/10.1002/job.627	2010	Ronald F. Piccolo, Rebecca L. Greenbaum, Deanne N. Den Hartog, Robert Folger
subfields	https://openalex.org/subfields/1802	https://openalex.org/W2122570643	https://doi.org/10.1016/s0968-090x(96)00025-3	1997	J.D. van der Laan, Adriaan Heino, Dick de Waard
subfields	https://openalex.org/subfields/1802	https://openalex.org/W2124235076	https://doi.org/10.1016/s0742-051x(03)00059-3	2003	Barry Fishman, Ronald W. Marx, Stephen Best, Tali Tal
subfields	https://openalex.org/subfields/1802	https://openalex.org/W1537187979	https://doi.org/10.1108/02635570610666403	2006	Carlos Flavián, Miguel Guinalíu
subfields	https://openalex.org/subfields/1802	https://openalex.org/W2061503185	https://doi.org/10.1145/959258.959260	2003	Diane Kelly, Jaime Teevan
subfields	https://openalex.org/subfields/1802	https://openalex.org/W2124100017	https://doi.org/10.1109/3468.852436	2000	Moez Limayem, Mohamed Khalifa, Anissa Frini
subfields	https://openalex.org/subfields/1802	https://openalex.org/W2171630887	https://doi.org/10.2307/2392251	1983	Joanne Martin, Martha S. Feldman, Mary Jo Hatch, Sim B. Sitkin
subfields	https://openalex.org/subfields/1802	https://openalex.org/W2031933651	https://doi.org/10.1177/002224298905300309	1989	Shelby D. Hunt, Van R. Wood, Lawrence B. Chonko
subfields	https://openalex.org/subfields/1802	https://openalex.org/W2163050413	https://doi.org/10.1016/j.im.2006.05.002	2006	Jen‐Her Wu, Yu-Min Wang
subfields	https://openalex.org/subfields/1802	https://openalex.org/W2076684951	https://doi.org/10.1016/j.bdr.2015.01.006	2015	Xiaolong Jin, Benjamin W. Wah, Xueqi Cheng, Yuanzhuo Wang
subfields	https://openalex.org/subfields/1802	https://openalex.org/W2068376489	https://doi.org/10.1145/269012.269025	1998	Thomas C. Redman
subfields	https://openalex.org/subfields/1802	https://openalex.org/W2139464545	https://doi.org/10.1207/s15327051hci1523_5	2000	Mark S. Ackerman
subfields	https://openalex.org/subfields/1802	https://openalex.org/W3165003809	https://doi.org/10.1017/s0140525x00057046	1989	Paul Thagard
subfields	https://openalex.org/subfields/1802	https://openalex.org/W1977109083	https://doi.org/10.1126/science.6879207	1983	Christopher D. Wickens, Arthur F. Kramer, Linda Vanasse, Emanuel Donchin
subfields	https://openalex.org/subfields/1802	https://openalex.org/W2022480744	https://doi.org/10.2307/2667052	1999	Ann E. Tenbrunsel, David M. Messick
subfields	https://openalex.org/subfields/1802	https://openalex.org/W1467526212	https://doi.org/10.1007/978-1-4419-6108-2_12	2011	Jeff Baker
subfields	https://openalex.org/subfields/1802	https://openalex.org/W1966297423	https://doi.org/10.1371/journal.pone.0010271	2010	Daniele Fanelli
subfields	https://openalex.org/subfields/1802	https://openalex.org/W2083495577	https://doi.org/10.1057/palgrave.ejis.3000438	2002	Susan A. Brown, Andrew Massey, Mitzi M. Montoya‐Weiss, Jim Burkman
subfields	https://openalex.org/subfields/1802	https://openalex.org/W2108985975	https://doi.org/10.1016/j.infsof.2009.11.005	2009	Mark Turner, Barbara Kitchenham, Pearl Brereton, Stuart Charters, David Budgen
subfields	https://openalex.org/subfields/1802	https://openalex.org/W1554976349	https://doi.org/10.1108/oir-01-2015-0011	2015	David Stuart
subfields	https://openalex.org/subfields/1802	https://openalex.org/W2023505872	https://doi.org/10.1080/00913367.2004.10639175	2004	Chang-Hoan Cho, University of Texas at Austin is a as-
subfields	https://openalex.org/subfields/1802	https://openalex.org/W2073379693	https://doi.org/10.2753/mis0742-1222240402	2008	Dianne Cyr
subfields	https://openalex.org/subfields/1802	https://openalex.org/W2100967055	https://doi.org/10.1207/s15327590ijhc1602_04	2003	Dorine Andrews, Blair Nonnecke, Jennifer Preece
subfields	https://openalex.org/subfields/1802	https://openalex.org/W2112175905	https://doi.org/10.1145/2888422.2888425	2016	Susan Dumais, Edward Cutrell, J. J. Cadiz, Gavin Jancke, Raman Sarin, Daniel C. Robbins
subfields	https://openalex.org/subfields/1802	https://openalex.org/W2074074847	https://doi.org/10.1016/j.compedu.2006.01.001	2006	Shu-Sheng Liaw, Hsiu‐Mei Huang, Gwo‐Dong Chen
subfields	https://openalex.org/subfields/1802	https://openalex.org/W2081565467	https://doi.org/10.1177/002224299205600106	1992	Jerry R. Goolsby, Shelby D. Hunt
subfields	https://openalex.org/subfields/1802	https://openalex.org/W2148097819	https://doi.org/10.1016/j.eswa.2009.03.024	2009	Ja‐Chul Gu, Sang‐Chul Lee, Yung‐Ho Suh
subfields	https://openalex.org/subfields/1802	https://openalex.org/W2009296073	https://doi.org/10.1086/208931	1983	Girish Punj, Richard Staelin
subfields	https://openalex.org/subfields/1802	https://openalex.org/W2123663722	https://doi.org/10.1109/ssdbm.2004.44	2004	İlkay Altıntaş, Chad Berkley, E. Jaeger, Matthew B. Jones, Bertram Ludäscher, Stephen Mock
subfields	https://openalex.org/subfields/1802	https://openalex.org/W2123797837	https://doi.org/10.1016/j.ecolecon.2013.04.008	2013	Patric Brandt, Anna Ernst, Fabienne Gralla, Christopher Luederitz, Daniel J. Lang, Jens Newig, Florian Reinert, David J. Abson, Henrik von Wehrden
subfields	https://openalex.org/subfields/1802	https://openalex.org/W2101686155	https://doi.org/10.1086/314322	2000	Dan Ariely
subfields	https://openalex.org/subfields/1802	https://openalex.org/W1988316526	https://doi.org/10.2501/ijmr-2014-025	2014	Nick Hajli
subfields	https://openalex.org/subfields/1802	https://openalex.org/W2018073696	https://doi.org/10.1016/s0148-2963(99)00013-2	2000	Kjell E. Gruner, Christian Homburg
subfields	https://openalex.org/subfields/1802	https://openalex.org/W2099287431	https://doi.org/10.1145/765891.765971	2003	I. Scott MacKenzie, R. William Soukoreff
subfields	https://openalex.org/subfields/1802	https://openalex.org/W2501702703	https://doi.org/10.4018/978-1-4666-0179-6.ch010	2012	José L. Roldán, Manuel J. Sánchez‐Franco
subfields	https://openalex.org/subfields/1802	https://openalex.org/W2890784719	https://doi.org/10.1080/00207543.2018.1518610	2018	Sachin Kamble, Angappa Gunasekaran, Himanshu Arha
subfields	https://openalex.org/subfields/1802	https://openalex.org/W3131907316	https://doi.org/10.2307/2070835	1984	Patricia S. Mann, Sandra Harding, Merrill B. Hintikka
subfields	https://openalex.org/subfields/1802	https://openalex.org/W2082092096	https://doi.org/10.1016/s0378-7206(03)00079-x	2003	Hung‐Pin Shih
subfields	https://openalex.org/subfields/1802	https://openalex.org/W2111053589	https://doi.org/10.1177/0149206304271375	2005	Markus Groth
subfields	https://openalex.org/subfields/1802	https://openalex.org/W2139808242	https://doi.org/10.1287/isre.1070.0157	2008	D. Veena Parboteeah, Joseph S. Valacich, John D. Wells
subfields	https://openalex.org/subfields/1802	https://openalex.org/W2141084584	https://doi.org/10.1016/j.chb.2014.03.007	2014	Jonna Koivisto, Juho Hamari
subfields	https://openalex.org/subfields/1802	https://openalex.org/W2153163719	https://doi.org/10.1162/qjec.2010.125.1.175	2010	Jesse Rothstein
subfields	https://openalex.org/subfields/1802	https://openalex.org/W1967852330	https://doi.org/10.1016/j.im.2007.09.002	2007	Said S. Al‐Gahtani, Geoffrey S. Hubona, Jijie Wang
subfields	https://openalex.org/subfields/1802	https://openalex.org/W1970550905	https://doi.org/10.1080/19312450802458935	2008	Masaki Matsunaga
subfields	https://openalex.org/subfields/1802	https://openalex.org/W1996905187	https://doi.org/10.1108/02652320310457776	2003	Philip Gerrard, John Cunningham
subfields	https://openalex.org/subfields/1802	https://openalex.org/W2037302630	https://doi.org/10.3102/0013189x033002003	2004	Joseph A. Maxwell
subfields	https://openalex.org/subfields/1802	https://openalex.org/W2077181076	https://doi.org/10.1371/journal.pmed.1001747	2014	John P. A. Ioannidis
subfields	https://openalex.org/subfields/1802	https://openalex.org/W2124330866	https://doi.org/10.2307/248803	1988	William DeLone
